,title,comments,author,guilded,num_comments,score,pinned,subreddit,author_flair_text,created_utc,r_id,body
75,Went with the second cheapest photographer quote to try and stick with my budget and so happy with what I got :),<praw.models.comment_forest.CommentForest object at 0x7fcfaea54d68>,TheHomemadeBride,0,5,135,False,weddingplanning,,1536030287.0,9crvdb,
76,Board games at wedding reception?,<praw.models.comment_forest.CommentForest object at 0x7fcfb6f118d0>,xiaomei1123,0,26,11,False,weddingplanning,,1536078638.0,9cx8yw,"Hi everyone! My fiance and I love board and card games, and so do a lot of our friends. We thought it would be awesome to have some board game tables set up during our reception. Has anyone done this at their wedding, and how did you go about this? My main concern is losing or having damaged pieces/cards, which would be awful! Some specific games we own include Dominion, Mahjong, Betrayal at Baldur's Gate, Coup, Bang, Once Upon a Time, none of which are inexpensive or have easily replaceable pieces/cards.

We'll probably have about 70 guests (no kids), and will be in an indoor space for the reception. If we do this, I plan to have a sign by the games asking people not to have food or drink while using the games, and to please be careful to not lose or damage parts, but accidents do happen. Any ideas on how to implement this while ensuring the ""safety"" of our board games? Are there board game rental services that I don't know about?

EDIT: after a google search, I found [boardgameexchange.com](https://boardgameexchange.com). Anyone have experience with them? "
77,"Help Me, Fashionistas. You're My Only Hope.",<praw.models.comment_forest.CommentForest object at 0x7fcfaea94748>,WitchoftheWilde,0,9,3,False,weddingplanning,"Halloween 2019 | Phoenix, AZ",1536097770.0,9d038d,"Let's start with some facts.

1. Our engagement photos are scheduled for late October in a forest.

2. Fashion choices are hard for me.

Here's the sitch. FH and I are really casual usually. I'm a leather jacket, combat boots and flannel kind of girl usually. I like the idea of getting photos done that are very ""us"". Relaxed. Comfortable. Cozy.

I'm also pagan, so we intended to do a self-led handfasting during our engagement photos as a betrothal ceremony. We like the idea of having some really nice photos of this intimate moment that's literally almost a year and a day from our real wedding date (which is significant in terms of Celtic pagan tradition). However, I felt weird about doing such an important ceremony in our super casual clothes. 

So, I was considering bringing a second outfit. One that's more formal. Like a beautiful flowy, maxi dress in burgundy or hunter green or something with heels. But the thought of searching for a special dress is stressing me out. I'm not great with shopping. I get overwhelmed super easily and just wish I could get the Fab Five from Queer Eye to dress me up so I don't have to worry about whether or not my fashion sense is whack. 

I don't know, guys. I'm freaking out a little internally. 

**Question 1: Should I even feel weird about doing the ceremony in casual clothes?**

**Question 2: Where do you guys go to shop for and try on pretty dresses?**

**Question 3: I have bright red hair and grey eyes. Which colors should I avoid?**"
78,Day of Timeline-CC,<praw.models.comment_forest.CommentForest object at 0x7fcfaea69780>,johnnyb1017,0,2,2,False,weddingplanning,,1536111279.0,9d1s7j,"So we have a non-traditional type wedding. Getting married on a Wednesday (date significance), no bridal party--his Uncle is marrying us @ 5:30pm. Getting married at an Italian restaurant before having a dinner and then playing games (NO DJ). Below is the ""Day of"" Timeline I've kind of come up with. The makeup and hair people are asking for times, and I'm unsure on when to tell them to be here (they're traveling)? Can I move the hair/makeup later do you think? What needs to be tweaked?

&#x200B;

10am-Hair (I have thick hair...doing a braid. Hair will be dry when she starts work)

11:30am-Makeup

12:30pm-Lunch

2:00pm-Finish getting ready

3:30pm-5:00pm-Pictures (off-site, some on-site...may be making 2 off-site stops)

5:00-5:30pm-Greet guests as they arrive (maybe...not sure about this time)

5:30-6:00pm-Ceremony

6:00pm-7:00pm-Some family photos out front, more B&G shots outside; Cocktail Hour

7:00pm-Cake cutting, then dinner

8:00pm-Dessert (cake & sundae bar) & playing games!

10:00pm-End of rental time

&#x200B;

&#x200B;

&#x200B;

&#x200B;

&#x200B;

&#x200B;"
79,What was your dress shopping process?,<praw.models.comment_forest.CommentForest object at 0x7fcfb6f08198>,TimeLadyJ,0,19,10,False,weddingplanning,"June 22, 2019",1536079647.0,9cxewe,"How many times did you go shopping? Did different people go with each time?

My tentative plan is:

1. My mom and I go and don't tell anyone. This is just to determine style and fit. We will not be actively looking for ""the dress.""
2. We go again with MIL and bridesmaids and try on dresses that fit with what I liked the first time. We hope to find ""the dress.""

What was yours?"
80,How do you involve two moms in a meaningful way,<praw.models.comment_forest.CommentForest object at 0x7fcfaeaa5940>,ricketywrecked87,0,7,7,False,weddingplanning,,1536089314.0,9cyvlr,"My sister is getting married and our mom is a total narcissist.  Mom has a long history of being completely selfish and just an all around shitty person.  That being said we’re both still in contact and moms coming to the wedding but she isn’t really a part of the wedding planning.  Our Aunt has been like a mother to me and my sister for the longest.  She is generous, loving and all the qualities my mom lacks.  

My sister really wants to include our Aunt in her wedding since Aunt’s really filled the void mom created, but she’s not sure how to do it in a meaningful way.  She wants to do something more than just asking Aunt to do a reading.  

What do you guys think?  How have you incorporated your ‘second mom’ into your big day?"
81,Thoughts on gray (or other colors) wedding dresses?,<praw.models.comment_forest.CommentForest object at 0x7fcfb6f082e8>,soggybutter,0,14,5,False,weddingplanning,,1536091163.0,9cz57u,"Essentially, I'm making my own dress. I've spent weeks researching and trying to find the perfect lace for my dream dress, a strapless ballgown with layers and layers of tulle, a chapel length train, and a sheer bodice with coverage being provided by individually placed bits of lace (think Pnina Tornai but less scandalous.) I did, and I placed the order over the weekend. Unfortunately, they are sold out of ivory, white, and champagne. They do still have a light gray version. What are the thoughts on non traditional dress colors? I still want to look glam and very much be the bride. Show me your non traditional wedding dresses!"
82,Trying to plan a destination wedding but I have never been to one and I have so many questions...,<praw.models.comment_forest.CommentForest object at 0x7fcfaeaa5cc0>,badplanner,0,5,4,False,weddingplanning,,1536090330.0,9cz0uj,"Hi all, we’ve been together nearly 7 years and got engaged in December 2017. I’m hoping to plan a destination wedding for June 2019. I’m getting very anxious about timing. I’m feeling overwhelmed about what I should have / need to have done by now for June 2019 to become a reality.

I contacted a wedding planner and was told that once I decide on the location & resort, guests will have 30 days to put a deposit down to guarantee their travel rates and it sounds like to also ensure we have 10 rooms (btw I’m not sure what the consequences would be if we don’t have 10 rooms confirmed in advance). This leaves me with two initial concerns:

1. 30 days just seems like a really quick window and doesn’t leave time for formal invitations - is this normal, do most people just send email invites for destination weddings?

2. It feels like a pretty big expectation to put on people to commit to coming to a wedding 9 months away and to firmly do so with a deposit in a 30 day window.

I hate planning and this stuff is really overwhelming for me. I don’t want to be a burden on possible guests. I just want this to be easy for everyone involved (myself included). Please tell me what you’ve all done or seen regarding invitations and “RSVP expectations” for destination weddings..."
83,Destination wedding problem,<praw.models.comment_forest.CommentForest object at 0x7fcfb5737f28>,banana466,0,0,1,False,weddingplanning,,1536120832.0,9d2xhb,"Fiance and I are getting married next year.. his best friend who will be his best man cannot afford to book his flight (SE asia) we are from Canada. Considering the fact that he knows that we will be getting married outside the country for a year now. My fiance would like to pay for his ticket, and I used to be okay with it, but unfortunate things happened with both our work and we end up not being able to afford paying for his ticket, we still have at least 8 grand balance for our wedding. 
We are having a fight over this. I obviously dont want to pay for his friend's ticket. I feel like if he wanted to be at his best friend's wedding he could've saved some for it..mind you, my fiance is already paying half of his ticket using his credit card points.
Am I being unreasonable? Horrible person?
Ps. His friend is on govt aid. No job but is getting money from the govt, living with his parents and no kids or wife...🤷‍♀️"
84,How much is a dj?,<praw.models.comment_forest.CommentForest object at 0x7fcfb572b780>,jjv77,0,0,1,False,weddingplanning,,1536120645.0,9d2wrp,"I got quoted from two, $1000 and $850
For 1 hour ceremony and 5 hours reception.
My wedding is in August 2019"
85,"One weekend elopement, one rainy reception, eight pies, and $3800 later... I know everyone says it, but don't sweat the small stuff. When the day comes you won't care about the table runners you forgot to lay out.",<praw.models.comment_forest.CommentForest object at 0x7fcfb3672978>,nitarrific,0,4,68,False,weddingplanning,August 2018 | Alaska,1536038563.0,9cspxu,
86,How did you guys go about gathering emails to send out invitations? How do you deal with bridal party?,<praw.models.comment_forest.CommentForest object at 0x7fcfb572e6d8>,khburzon,0,7,3,False,weddingplanning,,1536098846.0,9d08cw,"So my fiance and I are building our wedding website from scratch. We want to use it as our main line of communication to everyone who's involved in the wedding and all guests. We will literally be sending a URL and surprise people! But how do you gather people's emails without telling them first what it's for. 

Also on that note, how do you pop bridal party questions? Do you talk to them face to face regarding the wedding and then surprise them with the ""will you be my bridesmaid/groomsmen"" question? Or just send a card asking the question? I won't be doing any wedding favors so I will not be sending them anything when I ask them either. I'm also not asking them to do anything for me except show up to the wedding, look cute, and have fun. Im also buying their dresses and paying for hair and make up. Is it ok to just call them up and ask over the phone? I don't want to put people on the spot either. But I am close to my potential bridesmaids. I'm completely ok with them saying no to me. I just don't want then to feel uncomfortable. 

Any CC would be appreciated. "
87,Digital Save the Dates & Invites,<praw.models.comment_forest.CommentForest object at 0x7fcfb6f2cef0>,verdinda,0,5,5,False,weddingplanning,,1536088748.0,9cysrh,New to this and my significant other and I were planning on going totally digital and sending a save the date via email or drive them to a site of some kind. Has anyone had a good experience with this or know of website that do this?  Really appreciate the help and advice.
88,Calling all Brazilian Room brides/grooms!,<praw.models.comment_forest.CommentForest object at 0x7fcfb572e828>,Pigeontin,0,3,3,False,weddingplanning,,1536097711.0,9d02wd,"I am looking at their list of caterers...theres a lot! And I don't even know how to start to narrow it down. Most of them have great yelp reviews. And by looking at their websites either I can barely find any helpful information or they say they can do almost everything!

Has anyone chosen or ruled out any caterers for this venue? And if so, why or what was your process like?

&#x200B;"
89,"No longer just a lurker! Woke up this morning to a trail of roses leading to my boyfriend, who handed me this rose with the ring inside and asked me to be his wife. I can't wait to plan with you all!!",<praw.models.comment_forest.CommentForest object at 0x7fcfb570ccf8>,MoonlightBender,0,15,366,False,weddingplanning,,1536003698.0,9coj1j,
90,What song did you walk down the aisle to? Looking for ideas!,<praw.models.comment_forest.CommentForest object at 0x7fcfb12df400>,captainkitty8140,0,9,1,False,weddingplanning,,1536118458.0,9d2oa7,
91,Fun and funny bridal shower games?,<praw.models.comment_forest.CommentForest object at 0x7fcfb42cd1d0>,basicbitchslapshot,0,13,5,False,weddingplanning,"January 25, 2019 - Newtown Square, PA",1536083014.0,9cxy8c,What games have you played or planned at bridal showers that wound up being really fun/funny? Everything I find on Pinterest just seems dumb.
92,How many edited photos should you expect from your photographer?,<praw.models.comment_forest.CommentForest object at 0x7fcfaea933c8>,alwaysdaruma,0,10,5,False,weddingplanning,Sept 2019 | Maryland,1536082753.0,9cxwrm,"I know photographers can take around 100 photos an hour at a wedding, and not every photo will be ""good"" (they'll catch someone mid-sneeze, the balance was off, they were jostled by Great Uncle Greg and the shot is blurry, etc.) They're only human! That's fine. 

How many \*edited\* photos versus ostensibly \*not edited\* (or I suppose quickly touched up) photos should you expect? Or should you generally expect everything you get back to have the rock star treatment? There is a photographer I'm considering whose port looks great, but it looks like he only does additional processing on a limited number of photographs per event. I'm trying to figure out if it's worth talking with and meeting him if that's not standard sort of practice in the industry."
93,Got engaged over the weekend when our son asked me to be with daddy forever :) time to join you all and start planning,<praw.models.comment_forest.CommentForest object at 0x7fcfb572b588>,the_throw_away4728,0,2,87,False,weddingplanning,,1536030601.0,9crwli,
94,Anyone ever used greenvelope for their invitations?,<praw.models.comment_forest.CommentForest object at 0x7fcfb6efe550>,toastyghosty22,0,1,5,False,weddingplanning,,1536089041.0,9cyu9d,"Hello! 

Has anyone used greenvelope to send e-invites for their wedding or save the dates? FH and I are toying with the idea of e-invites to save on costs(and they’re environmentally friendly!). Greenvelope seems pretty awesome but I wanted to see if any other brides on here had any experiences with them.

Thank you :)"
95,Non White Wedding Dress... Veil?,<praw.models.comment_forest.CommentForest object at 0x7fcfb5703e80>,Fluffy_Sand,0,7,8,False,weddingplanning,,1536075173.0,9cwovg,"Has anyone opted for a non white dress and still wore a white veil?  I'm really interested in finding a dark green velvet dress for my fall wedding next year, but I have the opportunity to wear my great grandmother's veil and I think I should take it.  I'm wondering if it will look out of place.  Thoughts?"
96,Married on September 1st!,<praw.models.comment_forest.CommentForest object at 0x7fcfb42d0f28>,fall2018wedding,0,8,318,False,weddingplanning,,1536002624.0,9codmq,
97,Was Your Wedding the Best Day Of Your Life?,<praw.models.comment_forest.CommentForest object at 0x7fcfb42cdd30>,sacchilax,0,10,10,False,weddingplanning,,1536068744.0,9cvqvu,Just asking for context.
98,Wedding reception help!,<praw.models.comment_forest.CommentForest object at 0x7fcfb42c9fd0>,hannahdgordon,0,5,3,False,weddingplanning,,1536092217.0,9czb0m,"I am getting married July 12, 2019 at San Francisco city hall at 3 Pm and plan on taking photos until around 5 pm. I’m looking for either a small restaurant I can rent out that is pretty decently priced or or even better would be a restaurant with a small dance floor that is included or may be temporarily installed. I saw Bix but haven’t found pricing Looking for all options of cuisine. But mostly, price is a big deal. We’re looking to spend $2,000-5,000 including food. Thanks in advance for any suggestions as I am completely lost! "
99,Nerdy wedding favor help.,<praw.models.comment_forest.CommentForest object at 0x7fcfb56fd080>,FantaSciFile,0,7,1,False,weddingplanning,,1536113222.0,9d20qj,My fiancé and I would like to have personalized resin 20 sided dice (D-20’s) as wedding favors. Does anybody have any recommendations or suggestions on where to order them? Looking to keep it on the cheaper side. Would need about 100-150 of them. 
