,title,comments,author,guilded,num_comments,score,pinned,subreddit,author_flair_text,created_utc,r_id,body
45,CleanFreak: NO PDAs! And why do you never kiss us goodnight?,<praw.models.comment_forest.CommentForest object at 0x7fcfb37a68d0>,TheFilthyDIL,0,33,773,False,JUSTNOMIL,,1536005970.0,9coucf,"​ETA: This was more than 40 years ago, and CleanFreak is long dead. 

CleanFreak was . . . weird when it came to Public Displays of Affection.  On our first visit there we were still in the newlywed phase, as our second anniversary was still on the horizon.  So we were (and still are) physically demonstrative.  I’m not talking about lap dances and tonsil cleaning, but loving pats and touches and quick kisses.

I was sitting on the couch at the PIL’s house when DH walked past.  I patted him on the butt and he leaned down for a kiss.

CleanFreak hit the ceiling.  “WHY DO YOU ALWAYS HAVE TO BE PAWING AT HIM?!?  **DECENT** PEOPLE DON’T DO THAT IN PUBLIC!!”

Me: “Because we love each other.  My parents still kiss and touch each other all the time.  Don’t you?”  (Incidentally, my parents still affectionately kissed and touched after 70 years of marriage.)

​CleanFreak: “WHERE THE H-E-DOUBLE HOCKEYSTICKS DO YOU COME OFF CLAIMING THAT BECAUSE WE DON’T GROPE EACH OTHER ALL THE TIME, THAT MEANS WE DON’T LOVE EACH OTHER?!?!  THAT WE HATE EACH OTHER?!?”

​I JADEed.  DH JADEed.  I don’t remember any resolution to the “discussion,” if any.  CleanFreak was adamant that I said they must hate each other.

​But the next night, ah, the next night – bedtime came (thank Goddess!) I said goodnight and started to go up the stairs.

​CleanFreak: “Aren’t you forgetting something?”

​Me: “Did I only think that I said goodnight?  Because if I didn’t say it out loud, I apologize. Goodnight.”

​CF: “YOU DIDN’T KISS US GOODNIGHT!!  YOU NEVER DO!! **IS THAT ANY WAY TO TREAT YOUR PARENTS?”**

​Me: ""You aren't MY parents.  And I stopped kissing MY parents goodnight when I was about 10.  I don’t intend to kiss you and Dad, not after that fit you threw yesterday.  GOOD. NIGHT.”  And I went upstairs to bed.  IIRC, she complained loudly about it, but what could she do, other than add to her increasing catalog of Butt-Hurt Reasons to Hate Her Awful DIL?"
46,HTF do I negotiate the holidays with JNMIL...,<praw.models.comment_forest.CommentForest object at 0x7fcfb358c7b8>,TenaciousTapir,0,22,12,False,JUSTNOMIL,,1536087679.0,9cyn89,"My (24F) SO (29M) and I have been dating for a year and a half and living together for just over a year now. We’re not in a rush to get married but know we will someday. 

My SO and I are generally on the same page when it comes to our families. Mine is great to be around and we spent 10 days last Christmas break living at my parents and would do it again no problem. His family is boring, we don’t share any common interests with them (and our attempts to do things we think his mom would enjoy usually fall flat/are under appreciated), they are not warm or expressive and conversations rarely go beyond small talk. 

So last year, we were living an airplane ride away and my sister and mom came to visit us for thanksgiving and we had a fantastic time. For Christmas break, we drove 14hrs home (our families live 45 miles apart), stayed 10ish nights with my family and 3 days total but only 1 night with his. We spent Christmas Eve and morning with his family and headed over to my family’s around 1pm to do Christmas “morning” with them and then dinner. We enjoy the time with my family much more and both feel like we are doing what we’re obligated to do around his fam. I encouraged him to plan a few more nights we could spend at his parents so they didn’t feel like we were spending all our time at my fam’s but he didn’t, which was fine until when we came over for a day before we were making the long drive back, JNMIL made a comment about how we didn’t split time very equally. Gahhhh! SO did nothing to make it clear that that wasn’t my fault, but I think he knows to next time. 

Anyways, that brings me to the advice part. We’ve recently started talking about how we’re going to break up the holidays this year. SO and I now live 2-3 hr drive away from our parents and my sister and some of my extended fam live in the same city we’re in. We will likely have thanksgiving with my family, but I think JNMIL will be offended by this because it’s my BILs year to be at her place with his wife + daughters. 
I have no idea what we’re doing about Christmas this year yet. We just have so much more fun with my family. 

I’m just looking for stories and advice from people who split holidays (50/50 or a less even split) and how to do this without pissing off in laws who refuse to talk about what they want and prefer to be passive aggressive. "
47,PlantageNOT: the BEC files,<praw.models.comment_forest.CommentForest object at 0x7fcfb357ada0>,NotFuckingWarren,0,25,152,False,JUSTNOMIL,,1536035221.0,9csdw1,"Hey Llamas!  This is mainly some weird & BEC stuff, all leading up to the big blowout.  Standard disclaimers apply.  We are super NC.  See BB for previous crazy.

So when we last left off, PlantageNOT tried to be all Gollum about FIL's dress clothes and acted like the nasty, spiteful person she is and we had a baby shower in the midst of a family tragedy.  These moments take place in the month that followed: 

-The dueling phone calls continued, with a twist:  now PlantageNOT wanted to make DH the beneficiary of her life insurance policy.  All she needed was his SSN.  

Um, NOOOO.

-FIL gets wind of this (don't know how) and ups the ante: he wants to make the baby his beneficiary.  That is still inside me.  Then he couldn't understand why this wasn't possible. (Not that we would have gone for it anyway).

-Conversations start about holidays.  We tell both that we will split them.  FIL gets Thanksgiving,  PlantageNOT can come on Christmas Day afternoon  (cause you aren't fucking up my Doctor Who Christmas episode, I don't care who you are).   Both were pissy because we should leave the other out and give them allll the holidays because the other sucks.  

Seriously?  How about you both suck and we just dip the fuck out?  Yeah, thought so.

- Then we get to the main event:  who gets to come to the hospital after DD is born (at what time).  Now again, I will give PlantageNOT this.  She never tried to be there while I was in labor in any capacity.  (Small favors to your deity of choice, right?)  But we did have their RO to consider when it came to visiting, and she was insistent that she be there before FIL.  

Luckily, FIL was respectful of us from jump and had suggested he come the day after.  He did act like an ass that day...but that's a mention for the comments should anyone care to hear.

Summer turned into fall and the big day arrived.  After a fashion, DD made her appearance.  Now, I had made a special card for DH to keep in his wallet for the big day.  It was a list of which friends to call, which friends to text, and when for when we went to the hospital (we have a good sized circle of friends that have become our family, both in and out of state).  At the bottom of this card, it said: 

""Call your family at your discretion.""

Note:  Just so everyone understands, (and because it is about to come into play) my choice of wording is simply how I speak, and it was a wallet sized card.  So I kept it simple. DH and I had previously discussed what I wanted and he was in total agreement.  The card was a reminder because 1st baby and shit gets hectic.

No big deal, right?  Ha!  Sure, keep dreaming.  

I do my thing, DH does his thing (and is fucking amazing), the doc does his thing.  DD checks out and we are having cuddle time while I finish my bag of pitocin and get some feeling back in my legs (thank Glob for epidurals, ya'll, 46 hours from start to finish is a BITCH).  My best friend is there, and DH asks if PlantageNOT,  Sibling and Sibling's SO can come in.  I say sure, everyone is cool and DD is passed around (with my consent).  It really was ok!  Then, DH gets the card out to make the last round of calls/texts and Sibling and SSO offer to help.  DH hands over the card, it gets done.  Again, everything seems fine. 

Fast forward to a few days later.  PlantageNOT comes to visit us at the house.  And that's when the other shoe drops.  Turns out they were hurt by me writing 'at your discretion' on the fucking card.  Why?  No idea to this day.  Just didn't like the word choice. 

Now, I couldn't believe that Sibling and SSO would give a flying fuck about something so trivial, nor would they take issue with the notion that it was DH's prerogative when he called his family. 

 Time would tell on that issue."
48,Intro to Giggles: light Boundary Pusher has stepped up to her first full CBF,<praw.models.comment_forest.CommentForest object at 0x7fcfb35b5ac8>,Agile_Strawberry,0,8,16,False,JUSTNOMIL,,1536079469.0,9cxdvr,"Obligatory on mobile disclaimer. Have posted before, but with a different account. Going to keep this one for all related things, and start diving into the stories.

I was going to originally start with stories of my JNM, but this weekend, my FMIL decided to step up. She's been a boundary pusher previously, but more in the asking if you want a glass of water, you say no, and she brings you one anyways. The harmless kind that you make note of, but it's not worth fighting at all. She's got a bad case of babies rabies, and I'll share a store about shutting that down (which clearly only worked for a while) later. But onto the story. Due to her normal behaviour when boundary pushing, I shall give her the name of Giggles.

Quick background: FH (he doesn't get to be called dear for this story) and I have been together for 8+ years, engaged for 2.5 years. We had some paperwork problems (JNM caused - story for another day), so we haven't been able to do the thing yet, but just got it sorted so can officially start planning. We do want kids, but aren't in any rush. I also have a family history of having a hard time conceiving, and just went through an early miscarriage just over a month ago, on my birthday to boot. So I'm extra sensitive to baby things, and FH knows this… FH is also deep in the FOG.

The scene: we're at JNMIL’s place. I'm on the couch beside her, FH is sitting in a chair across from us and FSFIL (future step father in law) is sitting in his recliner. Convo is small talk things, and I'm more or less a grey rock of answers (also because life is rather quiet, so there really isn't much to say). 

Giggles (leaning over to me): so when do I get grandbabies? (With an accompanying giggle)
Me: You know we want to get married first. (And then I turned back to the main conversation because I am not dealing with this right now. We haven't shared with people about the miscarriage mainly because I don't want Giggles to think we are trying.)

Giggles asks if we've found a venue for our wedding yet. I say that it's really hard to find a venue for a small wedding. Her recommendation? We should get married  where she did, and have our reception at the same place too, and we should also do it in the fall like she did. Y'all, the way she said it, with a giggle, it gave me serious Jocasta vibes.

Of course it's at this time that FH decides to make an announcement. He's been on and off about getting a tattoo for years, and he's back to the on of it. He decides he wants to tell his mom, because her reaction will “be funny”. His sister has many small tattoos, so in theory there should be no reaction.

FH: so mom, I wanted to tell you something… (big dramatic pause). I'm…

Giggles grabs my arm. This is it. I know what she's thinking. I know I just said no, but she's ready. I look at FH, shooting thoughts of “say it and don't play with your mom's emotions"". He doesn't. He done gone and messed up big time.

FH: (he's dragging it out for as long as possible). I'm pregnant.

Giggles doesn't hear the I'm, she just heard pregnant and turns to me. I'm blank faced and simply say absolutely not, while shooting daggers at FH. He catches a dagger and says we aren't. He follows it up with saying he's planning on getting a tattoo, specifically a sleeve. 

Giggles starts getting a little bit of a CBF. She does a “but we're faaaaammillyyyy” type of response that he can't get a tattoo. Giggles turns to me, thinking I will talk him out of it, because I'm supposed to be loyal to her wants, and enforce what she thinks is best for her full grown in his 30s son.

Me: FSIL has many. I have one. If he wants one, he can have one. And I'll probably get more too. 

The CBF increases. Suddenly FSFIL asks a question (I think to move it into a more productive direction), and I start answering it. Giggles is not having it, and starts interrupting. She playfully hits my arm and says I'm supposed to be on her side. I keep answering the question (something about motorbikes and tattoos) so she adds that everyone is against her and it's not fair, in the full whinny voice (we all know the voice). I stop my response just long enough for us all the hear that, and then, before continuing, said “I'm just going to ignore that”. Full CBF. 

She tries again to guilt FH into not wanting a tattoo. FSFIL, just keeping the convo going, asks if FH has ridden his bike a lot this summer. Giggles hates that he has a bike. She thinks I shouldn't let him have a bike. And she thinks that even if he has one, I shouldn't let him ride it. I should guilt him whenever he goes for a ride, because she doesn't want him to. 

FH and I spoke about it all on the way home. He apologized for how he did it, but he's deep in the fog still. The amount of times he said “it's just how she is” was ridiculous. He's been officially warned by me to get her under control, especially about babies, because I will not keep having the same conversation. I have even gone so far as to tell him that her obsession with us having kids makes me not excited to get married, because I know the moment we get married she'll start asking again (she's been asking since before we got engaged, so it's been 3+ years of giving her the same answer). He's been warned as well that if she keeps asking, my default answer will be “why are you so obsessed with us having sex”. The good (?) thing is that this was the push I needed to truly look into pre-marital counseling, because he needs to get on my page about boundaries (he's made a few comments that if me and Giggles have problems, it'll be a problem for him, so I want to sort that out before we do the thing to make sure he understands who's side he needs to be on. I'm not asking him to turn on her, just to be an adult, say no, and back me up or buffer.)
"
49,CryBaby is...Done?,<praw.models.comment_forest.CommentForest object at 0x7fcfb359a5f8>,BlueBee773,0,41,524,False,JUSTNOMIL,,1536010583.0,9cph24,"Good news, llamas! DD’s first birthday (end of August) has officially come and gone with no real, direct drama from CryBaby. I know it’s not the nom-filled update it could have been, but I’ve never been so content to have nothing major to report. 

DH and I had canvassed possible contact attempts beforehand, having decided after CryBaby tried badmouthing us to my GM that we would not be offering an olive branch in the name of DD’s birthday, and discussed how we would respond to each if they happened, but nothing. Not a card, not a call, not an attempted visit/party crash. We were left alone. DD’s party was beautiful, DD was happy, and we were both able to just enjoy the day with her. 

Now, that’s not to say that CryBaby’s presence (or lack thereof) wasn’t noticeable; it’s just that it was there in ways that didn’t matter to us anymore. YBIL never responded to DH’s text inviting him down for the party, and AIL/CILs never responded to my invitation on Facebook (didn’t really want AIL there anyway, but couldn’t invite CILs without her). With YBIL, we’ve pretty much accepted that he’s taken his mother’s side, even though there is no need for sides, and that we probably will be/have been cut out by him. As far as the AIL/CILs go, we didn’t figure they’d make the trip anyway, as they live a state over, but we didn’t want to hurt CILs’ feelings or feed the “They’ve cut us all out!” narrative by not at least inviting them. 

So anyway, none of them came, but we weren’t really surprised and honestly probably were able to enjoy the party more because of it. The party started, they don’t show, and we didn’t really think about it again, figuring it was reasons stated above. 

But. Then we got home, I put the girl (who is now one, holy crap!) down for a nap, and we found out what had really happened via our Facebook FMs. CryBaby only posted one thing out of the ordinary on DD’s actual birthday, just a quick, “My beautiful granddaughter is turning one today. Happy birthday, DD!” Nothing life shattering, just standard run of the mill attention seeking/pretending for her public that she still sees her GD. The next day (the day of the party she wasn’t invited to), however, she posted a ton of pictures of a birthday party (cake at home, dinner out) for YBIL, featuring herself, GMIL, AIL, and the CILs and the following caption:

>>Celebrating [BIL’s childhood nickname] early. [BIL’s mid-September birthdate] is right around the corner. 

Hm. So the real reason none of them could come to our DD’s first birthday party wasn’t because of distance, but because they were too busy making that same distance to celebrate YBIL’s birthday instead...half a month early and just coincidentally on the same day as the party for DD? Okay. Good to know where we stand, I guess. 

Honestly, we’re not even mad, but I will own to being surprised. Of all the scenarios we had planned for, her throwing a petty revenge party wasn’t one of them, especially since this woman hasn’t done anything for a birthday for either of her sons—cake, party, dinner, etc.—since DH was 16 and even that one he planned for himself. I mean, she’d send money for a gift, but a party, with dinner, cake, and other people? No. Everything nice that was done for DH’s birthdays since we started college was done by me, and she usually didn’t even show up. Which makes us both believe this was just a case of “They’re throwing a party and not inviting me?! Fine! I’ll throw a party and not invite them, plus steal people from their party to come to mine! That’ll show them!” The cake was even themed for our alma mater’s rival school. And really? The whole thing is just...sad. Because this didn’t effect us at all, if that’s what she was hoping for. 

I’m beginning to wonder if it’s finally over, though. The morning of DD’s birthday, CryBaby apparently changed her profile picture from DD (the pic meant to look like DD eating birthday cake, see bot) to one of herself where she’s trying to look younger (think a different style of makeup, Vogue glasses...oddly enough she looks like DH’s last ex in this pic). Then the day of YBIL’s party, she changed her cover picture from one of DD (the one of her in a “party” dress, see bot) to one of YBIL wearing a birthday hat at the restaurant they ate at for his party. 

So she’s officially scrubbed her page of our DD, which is just not normal considering how much she loves using DD for attention fodder. We haven’t heard from her in over a month, and if there was going to be an extinction burst, I was sure it would have been DD’s birthday. I mean, I know her throwing YBIL a party the same day was definitely spiteful, but it wasn’t something that had any direct or real impact on us at all. Could this be it? Is she really giving up and cutting us out? Because, seriously, DH and I can’t come up with a single downside to her “cutting us out,” only things we no longer have to worry about or deal with. Or do you thinking I’m counting my peaceful, drama-free chicks too early? 



"
50,My car accident and fall semester of senior year,<praw.models.comment_forest.CommentForest object at 0x7fcfb354ff60>,drowninginhighlight,0,2,14,False,JUSTNOMIL,,1536079274.0,9cxcpd,"Not much recent updates on the QGR front. She’s actually been pretty tame/quiet. Actually not being unhelpful about the whole new job stressing me out thing. Still not telling her shit about the “bile/stomach bug” being a panic attack. Maybe once I’ve quit and found a new job. Anyways, I’m here to post about the time I totaled a car and how she treated me for the first six months after.

Now, I’m not here to play the victim or justify anything. I’ll give credit where it’s due, and I do commend QGR for at least not raising me to be a snowflake. As well as being one of those moms that would Bitch slap me inside out if I ever so much as rolled my eyes at her, or spoke to her like a ton of other kids spoke to their parents. But there has to be a line.

So summer 2015, I wanted to be a dentist, and was taking a summer class, while shadowing at a dentist’s office. This one particular day, I was shadowing, after a tumultuous all nighter studying for a test. Now, maybe I shouldn’t have been wearing wedges. Nor should I have used my phone at a red light. Long story short, I made an improper left and this resulted in a head on collision. A week before my 21st.

Initially, QGR and her consort were cool about it, and more relieved that me and the other guy weren’t massively injured. Just some bruises. And they didn’t really want me to regress and lose confidence driving, so they got a rental for a week. But alas, this isn’t a happy story.

The day of my 21st birthday, I had class. Shadowing in the morning, quick lunch, then off to school. Right before shadowing, QGR told me that I totaled the car to get attention on Facebook. Um. I didn’t post shit on Facebook or any social media platform. And if I wanted attention on social media so bad, I’d probably get a super expensive makeover and post some selfies. Not total a car.

Her consort was also joining in the fun too. They’d constantly be up my ass about being on my phone, and he had this new rule in place. All phones in the hall at night. Bitch I use that shit for alarms. The other actual alarm clocks don’t work for shit anymore. And he wanted to fucking walk from the enterprise office back home. Something I was scared to dispute because he often snapped at me about needing to exercise more. OF COURSE I TELL QGR THIS AND SHE SNITCHES AND GETS ME YELLED AT.

Around this time, I also found out that my “friends” couldn’t have given even a marble turd. This after constantly calling and texting about my accident. The mutual friend who informed me was supposed to be my best friend. And she was making excuses for her college crushes, that “they may not want to be friends but they want you to be happy with your other friends!” And “you have all these other friends idk why you think it’s embarrassing.” 

This was also around the time I got an iPhone and decided to share dad’s iCloud. YES I KNOW ROOKIE MISTAKE I DIDNT KNOW HOW IPHONE WORKS. So of course QGR snoops on my texts via his MacBook Pro. And throws them in my face, accusing me of sexual harassment (IT WAS MUTUAL FLIRTING. THANK GOD NO NUDES), and clearly knew about the friends thing. She belittled it indirectly. And called me emotionally unstable, along with a tirade of other things wrong with me. WHYYYYYY WONT YOU TALK TO MEEEEEEEEEE?!

Around the time the semester started, I was defeated. You llamas know the whole all science academic probation junk. This is just the prologue/behind the scenes. I had a new car after Labor Day, and was taking a defensive drivers course to get the two points off my license. But that semester was plagued by untreated depression.

At one point early on, she wanted to take me to a yoga therapist. She wanted to “get to the root of the problem,” and the school counseling center was taking advantage of me (PLEASE ENLIGHTEN ME). She then screams that I’m close-minded. Nah, I just don’t want to do yoga and meditation because you were up my ass about it. So we go to the yoga therapist, and I still hate her for reasons I’m going to detail in this next paragraph.

I told that bitch I didn’t appreciate QGR ending my high school relationship (I’m actually over it now, not sure if I’ll ever make a post about it), because two horny teens were sexting. And how she caused my ex bf to be bitter at me. SHE TOLD QGR. I didn’t find this out till finals, when I spent all night up studying and making a cheat sheet (sanctioned for the exam), and she screamed at me about it when I tiredly told her I guess we’d find out how the final went.

I didn’t know HOW QGR knew until we saw a psychiatrist and she simpered to her about it, and then admitted that she may have spoken to his parents. Or implied it. I know, it’s been 9 years at this point. But it was the principle of the matter. I’m a firm believer that people should fuck up their own relationships. 

It was also around finals week that she was snapping at me for running my mouth and apparently telling people she ruined my life. I mean. I didn’t use those words but sure whatever you wanna believe. She then proceeds to justify her marriage (tainted by her own JNMIL), saying that at least he was only an alcoholic and she stayed because her parents wouldn’t “let” her divorce, and he said he loves his wife and kids. Lol.

That’s pretty much it. At this point, maybe I’ll be posting some stories about my childhood. Not sure how many of those there are, but you llamas will get the scoop as more recent stuff goes down! "
