,title,comments,author,guilded,num_comments,score,pinned,subreddit,author_flair_text,created_utc
0,Boyfriend spanking teenage GF,<praw.models.comment_forest.CommentForest object at 0x7fcfb33d5e80>,DIOgenes_123,0,3,22,False,chuunibyou,,1535995854.0
1,Absolutely beautiful,<praw.models.comment_forest.CommentForest object at 0x7fcfb3438668>,29IdeaPI65,0,0,20,False,JennaLouiseColeman,,1535998158.0
2,⚜️💮 H A C K E D 💮⚜️,<praw.models.comment_forest.CommentForest object at 0x7fcfb3443828>,Bartmania,0,2,21,False,DeepFriedMemes,,1535999408.0
3,furry_irl,<praw.models.comment_forest.CommentForest object at 0x7fcfb348ccc0>,Azurfen,0,5,16,False,furry_irl,Makes the internets go,1535999963.0
4,"This game is amazing, I couldn't resist drawing Niko!",<praw.models.comment_forest.CommentForest object at 0x7fcfb34790f0>,MissyPie,0,2,17,False,oneshot,,1535996295.0
5,"This guy said it was his last day, so he wore some WakDonald's merch",<praw.models.comment_forest.CommentForest object at 0x7fcfb3438908>,Misha_Bo_Bisha,0,6,94,False,PewdiepieSubmissions,,1535995731.0
6,McKenna Denson’s testimony in Joseph Bishop’s ward in Arizona,<praw.models.comment_forest.CommentForest object at 0x7fcfb34ac2b0>,NewNameNoah,0,23,51,False,exmormon,,1535999320.0
7,When someone posts a fantastic meme but it has terrible resolution,<praw.models.comment_forest.CommentForest object at 0x7fcfb33b7fd0>,savagecomics,0,0,29,False,raimimemes,,1535995879.0
8,I stepped out of my box a little with this month’s cover,<praw.models.comment_forest.CommentForest object at 0x7fcfb33a87b8>,fwumsle,0,1,23,False,bulletjournal,,1535999494.0
9,LeSean McCoy has evidently been named a captain for the Bills. Telling his teammates to call him Captain McCoy,<praw.models.comment_forest.CommentForest object at 0x7fcfb3474630>,LongWillingness,0,2,16,False,buffalobills,,1535999266.0
10,Terra-misu,<praw.models.comment_forest.CommentForest object at 0x7fcfb34096d8>,wilde-cherry,0,0,17,False,forbiddensnacks,,1535999698.0
11,phil swift the mail man,<praw.models.comment_forest.CommentForest object at 0x7fcfb3479710>,CaptainMeem,0,1,14,False,NewVegasMemes,NCR,1535998321.0
12,Steve be like...,<praw.models.comment_forest.CommentForest object at 0x7fcfb344c7b8>,Dark-Wolverine,0,2,21,False,marvelmemes,,1535996390.0
13,Buy Buy Buy,<praw.models.comment_forest.CommentForest object at 0x7fcfb3409668>,RootRazr,0,75,31,False,MemeEconomy,,1535999755.0
14,Lego Loaf,<praw.models.comment_forest.CommentForest object at 0x7fcfb34562b0>,AndreaElaine320,0,2,19,False,Catloaf,,1535998767.0
15,I laughed harder at this than one might expect,<praw.models.comment_forest.CommentForest object at 0x7fcfb33b2cf8>,catipleasegetawaffle,0,0,12,False,arcticmonkeys,,1535999215.0
16,"Biker falls on highway, car driver immediately shields him with his car",<praw.models.comment_forest.CommentForest object at 0x7fcfb33f6c50>,Areskoi,0,0,20,False,HumansBeingBros,,1535999663.0
17,The beta lights a ‘V’ on my Logitech keyboard :),<praw.models.comment_forest.CommentForest object at 0x7fcfb34bbbe0>,chasewd,0,3,17,False,BattlefieldV,,1536000059.0
18,you ever just you know you just KNOW,<praw.models.comment_forest.CommentForest object at 0x7fcfb34094a8>,Jeremiah9790,0,6,57,False,KGATLW,,1535995958.0
19,Poppy handing my favorite anime character a flier hoping to find that hero,<praw.models.comment_forest.CommentForest object at 0x7fcfb344cc50>,Niethy,0,2,11,False,PoppyMains,,1535997552.0
20,Blackpink,<praw.models.comment_forest.CommentForest object at 0x7fcfb33a8c50>,chandlerbing26,0,0,12,False,BlackPink,,1535996983.0
21,Ahri from League of Legends by Gunaretta Cosplay,<praw.models.comment_forest.CommentForest object at 0x7fcfb33436d8>,LysandeArts,0,0,14,False,LysandeGunaretta,,1535996537.0
22,The only appropriate use for an Amazon Alexa,<praw.models.comment_forest.CommentForest object at 0x7fcfb3355fd0>,SameCap5,0,0,24,False,tumblr,,1535998795.0
23,Should the President block the release of Mueller's report?,<praw.models.comment_forest.CommentForest object at 0x7fcfb34b8f98>,mclumber1,0,1,14,False,AskTrumpSupporters,Non-Trump Supporter,1535998757.0
24,So uncivilised,<praw.models.comment_forest.CommentForest object at 0x7fcfb3343fd0>,Unoriginalkid2121,0,4,19,False,PrequelMemes,Hello there!,1535999847.0
25,Boyfriend and I as The Countess and James March for Halloween last year!,<praw.models.comment_forest.CommentForest object at 0x7fcfb3380080>,the_lacemaker,0,4,13,False,halloween,,1535997630.0
26,"My Iron 883. There are many like it, but this is mine.",<praw.models.comment_forest.CommentForest object at 0x7fcfb334b5f8>,mef15to,0,4,18,False,Harley,,1535999132.0
27,Life: good,<praw.models.comment_forest.CommentForest object at 0x7fcfb3362fd0>,StealthTR,0,1,16,False,WhitePeopleTwitter,,1536000097.0
28,An interesting title,<praw.models.comment_forest.CommentForest object at 0x7fcfb334bfd0>,ThereIsNoShrimp,0,3,84,False,dankchristianmemes,,1535995649.0
29,TheKingOfTheDeadTheLordOfTheGraves,<praw.models.comment_forest.CommentForest object at 0x7fcfb3485eb8>,IAMTHEYOUARETHE,0,0,28,False,TeamSESH,deadboy,1535995873.0
30,2meirl4meirl,<praw.models.comment_forest.CommentForest object at 0x7fcfb33805f8>,MilEnialE,0,6,23,False,2meirl4meirl,,1535998928.0
31,"I put together a greenhouse, terraced my yard and laid a floor underneath!",<praw.models.comment_forest.CommentForest object at 0x7fcfb33f6dd8>,Lance2020x,0,4,19,False,gardening,,1535999635.0
32,this is brilliant but I like this,<praw.models.comment_forest.CommentForest object at 0x7fcfb336cfd0>,datboi3637,0,3,14,False,DarlingInTheFranxx,i need oxygen to survive thats why i have 02 (my darling),1535998810.0
33,Only the truth,<praw.models.comment_forest.CommentForest object at 0x7fcfb33505c0>,GenosseJannik,0,0,23,False,CommunismMemes,,1535996132.0
34,"Ok so I've never really been able to fully embrace my curly, fizzy hair. Teased in school etc. But you know what, no more! I need to embrace my big ass hair! If Solange Knowles can pull it off, why can't I!? 😏",<praw.models.comment_forest.CommentForest object at 0x7fcfb3362780>,Jindarella89,0,6,63,False,curlyhair,,1535996016.0
35,"Home for barely 48 hours and she’s already a new cat. A trip to the vet, ear drops for her ear infection, cleaned abscess, antibiotic injection, a good meal, fresh water, and a whole night of cuddling. This 18 month old rescue has gone from terrified to grateful in just a day. Meet Noah.",<praw.models.comment_forest.CommentForest object at 0x7fcfb3372fd0>,littlemaxbigworld,0,5,28,False,sphynx,,1535995774.0
36,If this gets 200 upvotes YuB has to make his voice like Bob's For 1 video.,<praw.models.comment_forest.CommentForest object at 0x7fcfb3485da0>,MT92604,0,0,13,False,YuB,,1535996179.0
37,The long con........,<praw.models.comment_forest.CommentForest object at 0x7fcfb3368cc0>,CleverSpaceMonkey,0,5,156,False,equelMemes,,1535997161.0
38,Big if true,<praw.models.comment_forest.CommentForest object at 0x7fcfb3362588>,Crispyray,0,6,154,False,memes,,1535996558.0
39,Molly and Beaner brave the cold while the snow melts.,<praw.models.comment_forest.CommentForest object at 0x7fcfb3380c88>,home_cheese,0,3,20,False,Chihuahua,,1535995708.0
40,telltale presenting s3 to the public (colorized),<praw.models.comment_forest.CommentForest object at 0x7fcfb334b860>,Excellus,0,4,66,False,TheWalkingDeadGame,Disco Broccoli ,1535996005.0
41,Wow,<praw.models.comment_forest.CommentForest object at 0x7fcfb34a5048>,bulldogs678,0,3,19,False,MomorDaughter,,1535997360.0
42,from r/wholesomememes,<praw.models.comment_forest.CommentForest object at 0x7fcfb3474f60>,cyndifusic,0,4,10,False,AganistGayMarriage,,1535998973.0
43,Anon runs from the rape dwarf.,<praw.models.comment_forest.CommentForest object at 0x7fcfb3300a20>,WhatAreUJewingHitler,0,1,18,False,greentext,,1535999720.0
44,"Made the Asia vs Kameron lip synch, if it took place in Pokemon Gold and Silver🦋🦋",<praw.models.comment_forest.CommentForest object at 0x7fcfb3368c50>,sindorman,0,10,31,False,rupaulsdragrace,Monét X Change,1535999744.0
45,"Loving the fiery red, first self dye in a couple years",<praw.models.comment_forest.CommentForest object at 0x7fcfb3300ac8>,kaptionless,0,4,45,False,Hair,,1535997751.0
46,"Circuit festival, Barcelona and Paris have taken a number on me.. Back to reality 😩",<praw.models.comment_forest.CommentForest object at 0x7fcfb338b1d0>,throwawayFP1187,0,1,16,False,gaybrosgonemild,,1535997844.0
47,2 dorks dress up a whole month early,<praw.models.comment_forest.CommentForest object at 0x7fcfb344c048>,trickstermonkey,0,28,20,False,DDLC,,1535999771.0
48,Fortnut,<praw.models.comment_forest.CommentForest object at 0x7fcfb3971470>,outofideas007,0,3,44,False,SuddenlyGay,,1535996924.0
49,"Thanks for this mr vsauce, really needed to hear this",<praw.models.comment_forest.CommentForest object at 0x7fcfb35fb518>,EatMyBricks,0,1,18,False,vsaucememes,,1535997915.0
50,ich_iel,<praw.models.comment_forest.CommentForest object at 0x7fcfb330af28>,mickwe01,0,1,12,False,ich_iel,,1535997813.0
51,Make Nebraska Football Great Again,<praw.models.comment_forest.CommentForest object at 0x7fcfb34b8048>,ninja8ball,0,3,14,False,Huskers,GO BIG RED,1535999059.0
52,"I first posted this in r/ooer, but now i deleted it from there and decided that this is the perfect sub.",<praw.models.comment_forest.CommentForest object at 0x7fcfb34706a0>,Empisi9899,0,5,24,False,LoopBrother,,1535996196.0
53,Let’s just appreciate Duck Hunt Kirby.,<praw.models.comment_forest.CommentForest object at 0x7fcfb3474a58>,AllenLombax,0,3,12,False,Kirby,,1535996354.0
54,One title I’m happy we don’t have anymore,<praw.models.comment_forest.CommentForest object at 0x7fcfb3536ba8>,Goats-r-us,0,1,19,False,Everton,,1535999021.0
55,A reminder to everyone to everyone ❤,<praw.models.comment_forest.CommentForest object at 0x7fcfb3372898>,Name_Shmame,0,4,21,False,CPTSD,,1535995503.0
56,New Zealand landscape perfectly divided by this railing,<praw.models.comment_forest.CommentForest object at 0x7fcfb3443908>,i_have_no_ygrittes,0,0,16,False,Perfectfit,,1535999652.0
57,NSFW [by Naturalton](1186x1956),<praw.models.comment_forest.CommentForest object at 0x7fcfb34f9a20>,TheR41D,0,1,40,False,Animewallpaper,,1535996380.0
58,New CB450,<praw.models.comment_forest.CommentForest object at 0x7fcfb34702b0>,breadb8,0,3,21,False,HondaCB,,1535997192.0
59,"September 3, 1942 The First Jewish Rebellion Against Liquidation By the Nazis Broke Out in the Łachwa Ghetto in Poland. Fighting Only With Axe Heads, Sticks and Their Bare Hands, 1,000 Jews Escaped, Killing 14 of Their Heavily Armed Oppressors in the Struggle. Yitzhak Rochzyn Led The Rebellion",<praw.models.comment_forest.CommentForest object at 0x7fcfb3422d30>,way26e,0,3,61,False,Judaism,,1535995684.0
60,CELTIC GLASGOW! 🍀,<praw.models.comment_forest.CommentForest object at 0x7fcfb3310908>,RotaryMotor,0,0,21,False,CelticFC,,1535996811.0
61,I mean..,<praw.models.comment_forest.CommentForest object at 0x7fcfb3409748>,Rage2Lego,0,0,11,False,TheOfficialPodcast,,1535998167.0
62,How about a meme to kick off the regular season?,<praw.models.comment_forest.CommentForest object at 0x7fcfb3485400>,theblueguppy,0,3,31,False,NYGiants,,1535998920.0
63,If you buy just to resell: fuck you,<praw.models.comment_forest.CommentForest object at 0x7fcfb338bbe0>,DoctorWho957,0,4,20,False,Golfwang,,1535997096.0
64,My two lovely ladies sharing a blanket on the couch! I tried to capture the moment,<praw.models.comment_forest.CommentForest object at 0x7fcfb3422780>,PixelFinch,0,5,10,False,drawing,,1535998923.0
65,Stole this from r/target,<praw.models.comment_forest.CommentForest object at 0x7fcfb34b9748>,wrks94,0,2,41,False,walmart,,1535995675.0
66,A wholesome Christmas.,<praw.models.comment_forest.CommentForest object at 0x7fcfb338be48>,Ned_Dinkster,0,1,28,False,wholesomeouija,,1535995461.0
67,He’s not usually this nice,<praw.models.comment_forest.CommentForest object at 0x7fcfb338bf28>,MariahValles__,0,0,14,False,parrots,,1535997499.0
68,"discount ""do not want!""",<praw.models.comment_forest.CommentForest object at 0x7fcfb34b9828>,Icepickthegod,0,2,15,False,Chinese_Bootleg_Memes,Only Guarantee My Cuckoldry The Safety,1535995593.0
69,8 weeks vs 2 years,<praw.models.comment_forest.CommentForest object at 0x7fcfb342d5c0>,tinewashere,0,2,30,False,corgi,,1535997109.0
70,Why Kazuma,<praw.models.comment_forest.CommentForest object at 0x7fcfb34b5c88>,SRayTraider,0,0,18,False,Konosuba,,1535996410.0
71,hmmm,<praw.models.comment_forest.CommentForest object at 0x7fcfb342d1d0>,Visibeaver,0,0,22,False,hmmm,,1535999099.0
72,Dirty Rosalina,<praw.models.comment_forest.CommentForest object at 0x7fcfb338be80>,FBIGETOUTNOW,0,1,13,False,NintendoWaifus,:Glowing_Eyes_Etika:,1535997253.0
73,"Proposed to my girlfriend, now fiancee, today at Magic Kingdom!",<praw.models.comment_forest.CommentForest object at 0x7fcfb34f9748>,soulsazn,0,1,14,False,JustEngaged,,1535996192.0
74,Dude's got four arms,<praw.models.comment_forest.CommentForest object at 0x7fcfb342dba8>,RadiatedDalek,0,0,16,False,bonehurtingjuice,,1535998460.0
75,A moment with Kellen Goff and Bon-Bon at Dragon*Con,<praw.models.comment_forest.CommentForest object at 0x7fcfb34b5ba8>,Negaduck9,0,3,11,False,fivenightsatfreddys,Former Artist,1535999488.0
76,My collection of Switch games so far!,<praw.models.comment_forest.CommentForest object at 0x7fcfb34b1b38>,platinumpuss88,0,2,11,False,NSCollectors,,1535997329.0
77,Over the shoulder,<praw.models.comment_forest.CommentForest object at 0x7fcfb3314240>,itsme_matt,0,0,23,False,LorenaRae,,1535995896.0
78,Latest from IG,<praw.models.comment_forest.CommentForest object at 0x7fcfb33c6b38>,GiantWithDwarfism,0,0,26,False,IsabelaFernandez,,1535997340.0
79,Credit to u/TrebVidSmah,<praw.models.comment_forest.CommentForest object at 0x7fcfb34b5da0>,Darkdoomer9,0,2,29,False,casualChildAbuse,,1535995521.0
80,"""What beautiful weather we're hav-""",<praw.models.comment_forest.CommentForest object at 0x7fcfb34b96d8>,DudleyBeagle,0,3,15,False,yesyesyesno,,1535998941.0
81,;),<praw.models.comment_forest.CommentForest object at 0x7fcfb34b1f60>,PonyDev,0,0,15,False,Anarcho_Capitalism,,1535996617.0
82,A week in Cleveland,<praw.models.comment_forest.CommentForest object at 0x7fcfb34b1c50>,geekaz01d,0,5,35,False,Cleveland,,1535998394.0
83,Read me like a book,<praw.models.comment_forest.CommentForest object at 0x7fcfb3438dd8>,YemekBebek,0,0,14,False,bipolar,Bipolar 1,1535996175.0
84,Trump Deserves more Hotties,<praw.models.comment_forest.CommentForest object at 0x7fcfb3459d68>,JoanCameron,0,0,0,False,hottiesfortrump,,1535997089.0
85,2 lewd 2 look,<praw.models.comment_forest.CommentForest object at 0x7fcfb3314a20>,DIOgenes_123,0,0,22,False,chuunibyou,,1535997150.0
86,This is so old but...,<praw.models.comment_forest.CommentForest object at 0x7fcfb34f94e0>,grghearn,0,2,17,False,fantanoforever,,1535996638.0
87,GreatAwakening is under attack,<praw.models.comment_forest.CommentForest object at 0x7fcfb3438eb8>,DrogeAnon,0,131,221,False,greatawakening,You have more than you know. - Q,1535997559.0
88,0.000 Second Defuses,<praw.models.comment_forest.CommentForest object at 0x7fcfb34ef4a8>,3kliksphilip,0,8,20,False,3kliksphilip,,1535995608.0
89,"I see, you need a new friend",<praw.models.comment_forest.CommentForest object at 0x7fcfb3465cf8>,SRayTraider,0,1,17,False,wholesomeanimemes,,1535996001.0
90,"Favorite track from Gintama ? (no openings or endings just original soundtracks, those from movies and Live Action movies also count)",<praw.models.comment_forest.CommentForest object at 0x7fcfb3329ac8>,Anas_Hadri,0,1,12,False,Gintama,,1535995648.0
91,"Hot elves get thousands of upvotes, how many can we get for our bearded boy?",<praw.models.comment_forest.CommentForest object at 0x7fcfb32c8f98>,PolishKaiser,0,1,17,False,lotrmemes,,1535997518.0
92,Guys can't really fall for this... right?,<praw.models.comment_forest.CommentForest object at 0x7fcfb3395940>,Celticfan93,0,3,25,False,Nicegirls,,1535998489.0
93,Richmond airport has free female hygiene products in the restrooms,<praw.models.comment_forest.CommentForest object at 0x7fcfb3329b70>,Haia-Hai,0,1,10,False,rva,,1535997193.0
94,"Yukari, Ann, and Rise!",<praw.models.comment_forest.CommentForest object at 0x7fcfb3465e80>,IncaseAce,0,2,32,False,Persona5,,1535997320.0
95,Anime girls,<praw.models.comment_forest.CommentForest object at 0x7fcfb342df60>,Panswaggy,0,1,12,False,Grimdank,,1535998328.0
96,"When it’s the late Pliocene and the Earth is cooling, mysticetes have become less diverse, and new super-predators have emerged",<praw.models.comment_forest.CommentForest object at 0x7fcfb349be48>,GoddHowardsServant,0,0,13,False,Paleontology,,1535995360.0
97,That time of the year,<praw.models.comment_forest.CommentForest object at 0x7fcfb3395be0>,DJLusciousEagle,0,0,10,False,CHIBears,Ryan Pace,1535999995.0
98,Not to sound like an entitled brat: When will the mod be released?,<praw.models.comment_forest.CommentForest object at 0x7fcfb33eda58>,NatSynd,0,4,9,False,CBTSmod,,1535997148.0
99,South Philly sign of the day.,<praw.models.comment_forest.CommentForest object at 0x7fcfb32d6fd0>,Arosen2301,0,0,15,False,philadelphia,,1535997810.0
