,title,comments,author,guilded,num_comments,score,pinned,subreddit,author_flair_text,created_utc,r_id,body
79,Update to Memory Loss - DD2's Birthday and You've Got Mail,<praw.models.comment_forest.CommentForest object at 0x7fcfb2eff240>,ImaginationCalls,0,11,176,False,JUSTNOMIL,,1535991218.0,9cmqro,"I'm naming my MIL Rose-Colored Glasses (RCG) unless it's been taken. She tends to look at all her behavior, no matter what, through these.

Due to weather, we moved DD2's party from the place we always have it to another location. This turned out to be a good thing. SIL came (invited) to the party bearing a large envelope full of smaller envelopes. All from RCG. Along with those, the information that yep - RCG had planned to just come to the party anyway. Thankfully, SIL told her party had been moved and would not say where, so we didn't have to deal with that.

I didn't tell DH about the envelope of envelopes until after the party and we'd gotten home. He opened it and found the following enclosed:

* Birthday card for DH (from July)
* Birthday card for DD2
* Birthday card for me
* Back to school cards(?) for DD1 and DD2, with $20 cash in each(?)
* A letter in a sealed envelope for DH
* An open letter with a weird clipart image on the side on cardstock

Not included - any form of card or gift for DD1's birthday WHICH WAS IN APRIL.

DH gave the girls their cards. I have chosen not to open mine and it will either be mailed back or ... ? IDK. I don't want her money. DH didn't open his birthday card but he did open the letter that was so full of rugsweeping rainbows and unicorns and POOR ME's that he almost didn't make it through the first paragraph. First, I will tell you what that weird clipart cardstock letter said:

\[DH\],I gave birth to you but you can with no instructions. All I knew was that I loved you long before I saw you. I know I made some mistakes and for that I am sorry, but I was doing the best I could with what I knew. Everything I did for you, I did from love. You are my child, my life, my dreams for tomorrow. I will always LOVE you and there is nothing that could destroy my love for you. Love- Mom

Got it? Cool. Onto letter #2, which I will add my own commentary to in parenthesis)

Dear \[DH\],

​

I really do not know what to say any more. I can understand about the \[phone company\] bill that I will continue to say I never received. *(This proving that she really still thinks this is about the goddamn money/credit score and it's NOT, it's about her refusing to acknowledge that it ever happened, that she was ever made aware of it, and her lying.)*  My question is; why you didn't say anything back in 2006*. (Well, probably because it fucking happened in 2012*?) It would have been taken care of*. (Just like all your other bills, right, RCG*?) I am paying you this back whether you want it for not. Enclosed is t he $145.00*. (It was actually $150, and STILL BESIDES THE FUCKING POIN*T) I never want to owe my kids money*. (She has asked to borrow thousands from both DH and SIL*.) So for me this is the end of the \[phone company\] conversation*. (Okay...*?)

I don't know if you realize this, I am not one to hold grudges. My problem is that I care too much at times. There are also times that I will trust the wrong people and get burned *(We know the feeling, girlfriend.*) I also will have to learn lessons the hard way. What I am saying is that I am not perfect *(ROFL)*. I am far from being perfect. You and \[SIL\] are my world. I always tried to do my best when it came to raising you two. To this day I feel I did the best I could. Again I will tell you that I am not perfect. I know I made some mistakes.

I want to tell you that I am sorry if I did wrong while you were growing up. I worried way too much. I had an extremely hard time of letting go. I love you more than life itself So for that I am sorry. I miss talking to you. I miss our friendship. I miss my son. I miss my daughter in law. I always wanted to be close with her *(hard pass)*. When I saw what you were dealing with, I wanted so bad to be there for you *(I recently have had some health issues, none of which would have been aided by her ""help"")* both. I wanted to be there with you when \[ImaginationCalls\] went through surgery *(there have been many - which time?)*. I wanted to help with \[DD1\] and \[DD2\]. All you had to do was pick up the phone and tell me you needed help. I would have been there for you*. (This makes me think maybe she thinks we are upset that we didn't have her help? IDK. We had plenty of help and were certainly fine*.) If I am such a bad person, do you think \[SIL\] would have me babysit \[Nephew2\]  when she went ba*ck to work? (Side story: SIL had to actually last-minute find someone else to babysit after a few weeks bc RCG wasn't changing him often enough even after SIL asked her to multiple times and Nephew2 wound up with terrible rashes and yeast issues, but those RCGs must have omitted that fact from her mind.) Do you think she would trust me enough to take \[Niece\] and \[Nephew1\] to school or get them on the bus? (SIL needs help with this stuff, and Niece is *almost 10 so...) I would love to have the same close relationship with you and \[ImaginationCalls\]. I want to be close with \[DD1\] and \[DD2\]. I want to come to things they have at school. Not once since they have started school have I been invited to anything they have participated in or when the*y have received awards. (Fake news. She has been invited 4 times. One she was so late the event was over before she arrived. 3 times she flaked completely AFTER promising my gi*rls she would be there). All I am guilty of is loving my family with all my heart. I am guilty of wanting to be in your life. I never understood when my mom would tell me that she loved me more than y*ou know until after she passed away (Yep. You'll* die one day. We know. Subtle, RCG.) I learned that no matter what a Mother's love never dies. I\[t\] goes on forever. So no matter how mad you are and no matter how long you will hold this grudge, I will always love you more than you know.

Love you! Mom

So wow. DH doesn't know what he's going to do with the $. He's hurt and upset that she doesn't get it and mad she is trying to guilt him. I'm worried this is only going to escalate over the holidays.

Anyway, I'm hoping SIL will no longer be playing messenger. She seems like she doesn't understand DH's stance either and IDK if it's him not articulating it clearly enough (I consider myself fluent in DHnese but even I get lost at times) or she's got her own set of glasses."
80,Thunder Theif and the Weekend Intrusion,<praw.models.comment_forest.CommentForest object at 0x7fcfb2ec4898>,mamabear727,0,17,62,False,JUSTNOMIL,,1536010071.0,9cpema,"It's been a few since I've posted, but I've decided to call my mom Thunder Thief. I cant recall who suggested the name, but thank you so much! 

TT is the one who takes all of our experiences with DS. She announced my pregnancy to all my friends, announced DS birth on Facebook, gave him cheesecake at 4 fricken months, etc. 

TT used to babysit 2 full days a week and one evening while DH and I were out. We've enrolled DS in a daycare, so now she is down to one evening a week, and one full day of babysitting. I feel that this is plenty of quality time. Wrong....

TT frequently mentions how she misses watching him twice a week and wants to spend EVERY weekend with us. I feel like that's too excessive, so this weekend when she asked us what we were up to, we politely said we were busy all weekend.

 DS goes to a weekly class on Sundays. We get a text from TT that morning asking if DS is going to class that day. We tell her that he might,  if he wakes up from his nap in time. We go to the class, everything is fun and great,  no TT.

Monday rolls around and TT is finally visiting. 

TT: So did DS go to class yesterday? 

Me: yes, he woke up from his nap really late but we were able to make it.

TT: he's in the ""name she shouldnt know because I've never told her"" class right?

Me: uh.... yea why.

TT: well I was across the street at the gym that morning and I stopped by class to see if you guys were there. Then I remembered he's in the ""name she shouldnt know"" class and I was there an hour early. I would have waited but I didn't want to wait for you guys if you weren't coming that day so I went home.

WTF.... Translation....so you just went to the building, looked up his class like a stalker, and then were going to wait around.... for over an hour for us to show up. UNINVITED.  We tell you we're busy all weekend, but you're just going to barge into our DS's class uninvited anyway. 

Then today when its finally time for her visit, we tell her to come for dinner at 5:30. Ya'll she showed up, unannounced,  2 and a half hours early while I'm literally in my pajamas repainting the kitchen! She gets here and I just continue to clean up while she's all ""come give Gramma  kisses!!!!!"" To my one year old. Because she does this all the time, she doesnt think about DS's schedule, so after 30 minutes of visiting, it's time for his nap. 

DH and I take DS to his room and he cries because he hates getting his diaper changed when he's tired. TT is complaining ""awww he's crying he wants to stay with Gramma"" and my DH (Oh how I love him) just closes the door in her face. 

This pales in comparison to what I've been reading on here lately, but this crap and worse happens all the time. She comes over without warning and just walks into our home or invites herself on our outings. This isn't the worst thing she's done by a long shot, it's just the most recent.... thanks if you made it this far!"
81,We’re finally NC which is awesome but why am I sad?,<praw.models.comment_forest.CommentForest object at 0x7fcfb2eedfd0>,carryandwander,0,22,33,False,JUSTNOMIL,,1536023920.0,9cr4q3,"My in laws suck. Like a lot. After years of bullshit the camels back finally broke and we’re no contact. Obviously for the best but as awesome as it is that we no longer have to deal with them I’m sad. Why? I have no clue I know it’s not actually because I miss them but still, the sadness is there. 

Oh llamas there’s so many stories I want to tell you, until then any advice on how to move on is appreciated. "
82,Elope in two weeks!,<praw.models.comment_forest.CommentForest object at 0x7fcfb2edc860>,snanger_danger,0,43,462,False,JUSTNOMIL,,1535970992.0,9ckfbo,"I just want to thank you guys so much for your support and advice. ~~SO and~~ I would not be here with out all of you. YOU helped me support *him* ignoring his own mom. 

Yes, I still struggle to try to bound with her. But I have a good year under my belt of not using SO to talk to her or enable her.

Two weeks! Bitch bot has our rambling story, but pretty much SO and I don't value traditional weddings. We've both been in enough wedding parties to see how *more* fun (for us) it is to stand with bride/groom versus being bride/groom. We want to get married for tax and insurance reasons. After sharing our ""engagement"" with family, we've discussed all avenues of ceremony. We went from small destination wedding, to vegas, to courthouse. All our attempts were to give family *some* celebration because we DGAF. At each step we were met with criticism and offers of upgrading.

So they win. Wedding is planned for next year. MIL gets her ceremony with flowers and vows, and my dad gets to invite everyone I've met briefly since I was born. They win. Plan your wedding yall.

Cause that's all it is at this point. *Their* wedding. And you know what? SO and I are super excited for it! We're getting married in a civil ceremony two weeks from now, at our county court house. It's a secret, no one knows! Out closest couple friends will stand with us then we're hitting the county fair after. I AM SO EXCITED TO GET MARRIED THIS WAY.

The brewery we originally wanted to attend after elopement will now be the reception venue for wedding next year. It's like a costume party where I get to be bride.

Knowing we're getting married in two weeks **our way** has made next years wedding feel stress free, and *fun.* 

We could not have got here without this sub, thank you!"
83,"Update: My JNMiL is living here now... (long post, drama llamas)",<praw.models.comment_forest.CommentForest object at 0x7fcfaceebc18>,Mistress_Jedana,0,74,263,False,JUSTNOMIL,,1535981467.0,9clhi2,"Check BB for what's been going on, if you like.  A bit of drama, and I've been battling migraines all week long. Some family drama in here, but all relates to the MIL issue.

So, last week, we said my JNMiL could come and live with us.  She's been couch surfing for at least the last couple of years, going from grandchild to grandchild to cousins or siblings or their kids.

I posted on FB that she was coming, asked for any advice/help.  I also posted I was a bit frustrated, as she is not well and hasn't been taking care of herself, and I was going to end up being a caretaker yet again (as I was for DH during his 10 years of hell).  I also said that I think it's going to be a hard time for us for awhile, as neither side really knows the other (having only ever physically been around her less than the fingers on my hands).   I did not once call her any names, make any negative comments about her or her family; this post solely centered on my thoughts and feelings and what was coming.

I will point out here that the only people on my FB page are people I actually know;  like 50 people and most of that is family.  I don't even have all of my family on there, because I don't want to deal with their shit even online.  I thought I had blocked off all of DH's family (because I have zero use for their shit, even less than my own family) years ago, but I missed one of his nieces.

Well, his niece popped onto my post and started threatening me.  Then my dumbass sister (who can't keep her damn nose out of anything) started on her.   So...I blocked the niece and put my sister in FB timeout for 30 days.  The niece called her mommy (who is now officially bipolar, and having seizures, and lives with a random guy in his semi) and then they brought the drama to the rest of DH's family.  As they couldn't contact me (since none of them have my phone number and I blocked them on FB years ago), they contacted my fucking daughters on their FB.  DH's sister went as far as contacting my teenage son, telling him to have his dad call her because his 'bitch of a mom' is ignoring her.    Both my girls told them all to fuck right off and blocked them as well (and when his sister called my middle kid 'little J (my name)', she proudly posted on her FB page that she would like to be called 'little J' from here on out.  Hell, my sons-in-law both laughed at that shit, and said they can only hope their wives turn out like me.  /blush

DH and I had a very long talk when he got home, and he has ignored every attempt at his family to contact him since.  He said he doesn't need their drama, and he has my back.  He did tell his sister that if she ever pulled that shit again, he'd let me loose on her.  He also told her she didn't want to start shit with any of my kids, because they were trained by the best (he means me!) and would rip her dumb ass to shreds.    He earned his happy time that day, haha.

We showed up to where his mom has been staying on Saturday.  She didn't tell them that we were coming to get her, because she didn't think we were coming.  So, we got what stuff she had there (4 bags of clothes, that's all she has in the world) and brought her home.  She didn't even have a toothbrush.   She was sleeping a recliner in front of a tv in the living room...Eight people (5 adults, 3 kids), 3 bedroom house, 1 bathroom; one elderly adult in a wheelchair, one elderly adult barely able to walk, 2 grown adults who smoke constantly, a 19 year old adult/kid, a 10 year old kid and a 5 year old kid with Cystic Fibrosis, who is trying to get on the lung transplant list, plus MIL.  The kids all shared a room (yeah, 19 boy, 10 boy, 5 girl); the other two elderly share a room (they are MIL's siblings) and then the adults share a room.

Here, she has her own bedroom, a twin bed with a very good mattress (was DS's and is less than 4 months old; we upgraded him to a Full bed); she has my old 40"" tv w/cable box (DS was using it; we're buying him a new one for his birthday next month).   We bought her a flip phone (her choice, big number buttons) so she has her own phone line to call her family; I gave her my old Kindle, made her an email and a FB account so she can contact her family that way.   We are getting her a shower chair, and will put that in our bathroom (as we have a walk in shower, and it would be safer for her to shower in there than in other bathroom, which has a regular tub/shower set up).

DH calls her 'an emotional terrorist', and I see why.  She is so passive aggressive with her comments, and it's already driving us all nuts.  DH and I are presenting a united front (any disagreements will happen in the privacy of our bedroom or the car) and he has told his family to entirely fuck right off and to not contact him again.

He's taking her next Friday to open a bank account, as her SS checks get deposited to an account she shares with her daughter (so all her money has been being hijacked by that cunt); he'll be on the account with her, but we aren't touching a penny of it.  That's for her to use to get what she needs/wants or pay for medical stuff; we're covering living expenses and most food costs for her.    He's trying to figure out what she has for medical coverage, and what we need to get started for her; I don't think she even has her social security card or a picture id.   This is gonna suck.  


ETA:  fixed what was wrong with the little kid; had the wrong thing listed"
84,Bette Crawford was actually violent (tw: child abuse),<praw.models.comment_forest.CommentForest object at 0x7fcfb2e9e8d0>,MadHatter06,0,10,105,False,JUSTNOMIL,,1535997007.0,9cnkqz,"I’ve told before about how weird Bette Crawford was when it came to sex. At the same time, what she’d let us watch (old movies that didn’t exactly hide sex stuff) made it seem like she was okay with all that. Maybe it was just part of her crazy making, I don’t know. 

I added the tw as a just in case. This was the only time she actually got physically abusive with me. But unfortunately it wasn’t a surprise. I had realized years before this that she was always on the edge of abusive. I think the only thing that kept that from happening was that with our social circle, it wouldn’t have been easy to hide, since we were seeing people outside of family 3-4 times a week. She couldn’t have hid if we were bruised and battered.

This happened when I was 12. Now this was many moons ago, but you expect that by 12, a girl has at least a little knowledge of what sex between adults is. I had very vague understanding, since Bette did her best to completely shelter me and keep me ignorant and babied. A friend was over, and we were playing with Barbies. Yeah, I was probably close to outgrowing that, but this incident pushed that. We have Ken and Barbie living their lives, married, working, and all that Jazz. And so in this little story, Barbie and Ken come home, have dinner... and then its business time. Basically they had their clothes off and were in the bed. That’s it.

Bette comes busting into my room for no reason. Startles me so bad I literally jumped to my feet. She looks down, sees the dolls, and I watch her face. I know in that moment that I’m dead. She says something to me and my friend and leaves. My friend can’t understand why I’m shaking at this point, but I know that as soon as my friend is gone, I’m gonna get in so much trouble.

Sure enough, Bette waits. After my friend is gone, and after I’ve gotten ready for bed, she comes in and shuts the door. I didn’t realize the significance of that at the time, but now I know she didn’t want my dad or brother to hear any of this. They would have put a stop to her plan. She starts demanding to know WHY we were playing with our dolls that way, WHO taught me about that, and WHO had the idea to play that way?!? Again, I’m 12, with very vague knowledge, but I do know that married folks get in bed, get naked, and do... something. I seriously had no real knowledge, which is rather sad in itself.

So she grabs the dolls and basically wants me to reenact the entire play leading up to that. This was another one of her favorite tactics, demanding to know everything leading up to something and then exploding when you don’t remember every detail, declaring that it meant you were lying. No Bette, some people just don’t record the minutes of every interaction and action like it’s a business meeting. So I’m trying, but by this point I’m tired, I’m scared, and I’m trying to figure out what she wants from me and how much trouble I’m in. When I can’t give her detailed breakdowns, she grabs the Ken doll and throws it. At my face. From less than a foot away. Hits me square in the nose.

In that moment, I remember wishing so badly that she broke my nose. Why? Because I knew that otherwise, no one would believe that this happened and she would feign innocence. 

Bette demands again that I show her. When I can’t, she does it again. It happened FOUR times. She deliberately picked up a toy and threw it at the same spot on my face four times.

The next few days were a total mess. She was screwing with my head at that point. In front of other people she acted just fine, like nothing was wrong. Two nights later, the same thing happened. She comes in, shuts the door, and the interrogations begin again. The day after, everything was peachy.

After this, she “decided” that since I was old enough to know about sex, I was too old to play with barbies and ordered that I box them up. They stayed in those boxes till seven years later, when some younger relatives came over and began playing. Turning to me, Bette, in this light half laughing tone, asked me why ever did I stop playing with Barbies. I went stone cold and reminded her that she made me stop. She laughed, said “Oh yeah”, and walked away.

I tried for years to understand. Did she think I was being molested? Why was she so angry? But none of her questions were about if someone was harming me. No, she was asking about tv shows, about friends, about movies. She loved to sudden declare something was “inappropriate” and forbid it, keeping me from either fitting in with others my age or just making me seem weird and an outsider. She loved me being an outcast. I now understand she was looking to shut me off from more of the world. She wouldn’t have cared if I had been harmed, since she never cared when I said someone made me uncomfortable. When that happened I was mocked and basically told that I had no reason to feel that way and to suck it up. 

She never got physically violent with me again. But I always knew that she had the ability to do so.

TL:DR : Bette whapped me with a toy four times and then pretended like she was a doting mother."
