,title,comments,author,guilded,num_comments,score,pinned,subreddit,author_flair_text,created_utc,r_id,body
46,My mother keeps saying my child's father isn't the dad?,<praw.models.comment_forest.CommentForest object at 0x7fcfb20c0cc0>,anonms1,0,2,4,False,raisedbynarcissists,,1536095361.0,9czr58,"I am 19 years old, and 32 weeks pregnant exactly as of today. I had sex with guy A, between December 30-January 4th. That was the last time we ever had sex. I got a period on January the 23rd, and I started having a sexual relationship with guy B, around the middle of January. I know the exact dates I ovulated.. Feb 6th-8th. This is when I conceived. I got my first positive pregnancy test on February 17th. I had my very first ultrasound done on March 9th, which showed I was measuring 6 weeks and 1 day. My mother has came with me to doctors appointments and the ultrasound tech said I am measuring perfect. Not ahead at all. My mother acts like she believes me, then goes behind my back and tells my grandmother she knows it isn't his, and it's guys A. This is literally impossible. Guy A is black, and guy B is white/Asian. I am biracial myself (black and white). I got a 4D ultrasound done, and she says the baby looks like the first guy and has ""black features"". I can't help this. I told her that yes, the ultrasound is somewhat how the baby is going to look, but of course his nose looks alittle bigger, and his features are more prominent because he is squished up inside the womb. She texted my grandmother today saying ""there's no way"", and ""to check her calander and look at the dates"". I am extremely offended she continues to go behind my back and say my child's father isn't his father, and then pretends to my face she knows it is his. Then, she told my grandmother to delete the messages because ""sometimes I look in her phone"".

The father and I are getting a DNA test and are no longer together, and I can't wait to show her the results that it is his. Even the doctors have said right infront of her that the baby is right on track, and my report says ""size is consistent with dates"". There's no way I conceived in the beginning of January and got a menstrual cycle on the 23rd. And doctors ultrasounds are not going to be this far off. I am so fed up of my mother going behind my back, saying these things. It's offensive, and I am to the point now I just want to leave her out of the rest of this pregnancy. Am I wrong for not wanting her in the delivery room? At this point, I just want to be in there alone. I am tired of the stress and constant ""back stabbing"" from my own family
"
47,I feel like I missed out on being myself as a teen.,<praw.models.comment_forest.CommentForest object at 0x7fcfb2c2d080>,nightsister888,0,1,3,False,raisedbynarcissists,,1536089427.0,9cyw57,"First off, I feel like I have no right to post here after reading some of the stories, but this has been bothering me lately because my younger sister still lives with my NMom. When I was a teenager I LOVED the emo/scene look and I wanted to dress that way desperately, (cringe I know) but if I wore anything black, anything at all really, my mother and her sister relentlessly made fun of me. Makeup? Passive aggressive comments about being a slut, no makeup? You look boring, ""normal clothes""? You look like you don't care, anything black? You look ridiculous what's wrong with you? The only time she ever said anything positive about my appearance was when I would wear anything similar to what she wore when she was a teenager. Now, I never got to dress as a cringey little scene kid, I never got to experience being part of a group because I was too afraid of ridicule, and even now as an adult I struggle with how I'm perceived when I dress. Regardless of what I wear I just hear her telling me I look stupid. Nothing looks right on my body because of her and I can't stand it. She tries to tell me about my younger sister dressing ""strangely"" and I tell her to leave her the hell alone so she won't end up like me. She's bothering my sister less than she did me which I'm grateful for."
48,DAE have a fight-or-flight response with loud voices?,<praw.models.comment_forest.CommentForest object at 0x7fcfb20e7f60>,aqua_sparkle_dazzle,0,18,44,False,raisedbynarcissists,,1536042157.0,9ct214,"I do better when I'm in public, I hear someone yelling, and I only freeze for a brief moment. But deity-of-your-choice forbids it's someone I care about that's being loud. My person is naturally loud and rambunctious, he gets loud - as one does - when enjoying himself, chatting to friends or watching a game. 


And me? Whenever he gets loud I'm terrified or I snap and yell too. Loud voices, raised inflections from someone I love, terrify me to the core. Because when I was growing up, someone getting loud means BAD. Bad things will happen and usually they downpour on me, the scapegoat of the year. Someone getting loud means my good day is about to turn sour, means I need to run interference and I need to do it fast, or... Or else. I don't think I'm so much afraid of the loudness as I am of its implications, because it's been programmed into me to fear the ""or else"".


And loud voices are my air raid sirens for those ""or else"". I'm not dumb by any means, but I can't seem to reprogram myself that loud sometimes just means someone's totally immersed in enjoying what they're doing.


Is this what we call a FLEA?"
49,I had no idea that it wasn't just me.,<praw.models.comment_forest.CommentForest object at 0x7fcfb23c0f98>,MoosesMom7,0,14,24,False,raisedbynarcissists,,1536052407.0,9ctz2y,"I've been a lurker for a while now, and I didn't realize just how many people had similar stories to my own. I could probably write a book about the crap I had to deal with growing up. I think it's important to share stories, and see commonalities, so here's mine. 

&#x200B;

My Mother is a narcissist. As a little girl, I was her baby doll, being dressed up in the cutest dresses and being constantly doted on. Once I started talking, that's when everything went down hill. I would be yelled at, hit, called every name in the book, and was basically her slave. If she wasn't giving me a verbal beatdown, she was ordering me around, ""take out the trash"", ""make me food"", & and so many others. She went so far as to encourage me to commit suicide, and had I actually been suicidal at the time, I can't say that I wouldn't have followed through with it. There were a few times in high school when she didn't allow me to shower because it would, ""raise the light bill"".  My aunts and uncle, were always her sisters and brother, she never spoke of them in relation to me. No matter what happened, it was never her fault. She got arrested once, and it was the cop's fault. My dad was a bastard, in her mind, when he gave me stuff and not her. 

&#x200B;

When I was 14, I was hit by a car and taken to the hospital with a dislocated knee. Rather than ask me if I was alright, she got into the room, waited until the doctors and nurses were gone, and told me I was going to get so much money from this. Yep, you read that right. I was just hit by a car, and she was looking forward to the settlement money that I would eventually get. I did get a pretty decent settlement from the accident though, about $9500. Thankfully, my dad was smart and got me a lawyer, and I set up a meeting with her to ask her to hold on to the check until I turned 18. I picked up the check shortly after my 18th birthday, and opened a savings account in my name. Boy was she pissed that she wasn't on the account, she needed the money ""to raise me"". She conned me out of $4000 dollars, which she used to pay off her credit cards, and told me she would pay back... that was over five years ago and I still haven't seen a penny. 

&#x200B;

Sometimes, I'd lose things, like any normal person would. When I'd ask her if she'd seen it, she would say that I was accusing her of stealing it. One time, she swiped a five dollar bill out of my pants and I asked her if she had seen it, as I thought I may have left it on a counter or something, again, I was the bitch for accusing her of stealing. Yet, after I took the dog out to cool off, she called me into my room, lifted a pillow, and lo and behold, there was my money. All nice and flat underneath the pillow. It's kind of hard to believe that she didn't put it there, considering it was crumpled up in my pocket the day before. 

&#x200B;

About a month before I graduated high school, she kicked me out for going to the bathroom before getting ready for school, because it ""went against routine"". I was a ""backwards ass"", which angered me and things escalated to the point where she said, ""your 18, you're on your own, get the fuck out of my house"". I was so upset that when my dad picked me up, I was sitting on the front porch crying. I called off from school that day, I was 18, so I could excuse myself. She got a call saying that I wasn't in class, and reported me skipping. This would have barred me from walking at graduation, and I told her as much. So she got to call the attendance office and excuse the absence so I could walk. Thankfully, she was willing to let me spend the weekend at my father's house, like she did unless she was pissed at him for some stupid reason, and I stuffed my duffel bag as full as I could get it and didn't come home after the weekend. The following Monday, I went to the school counselor and changed my address to my dad's and explained what happened. She was beyond kind and understanding and told me exactly what I had to do. 

&#x200B;

Of course, there were complications, she wouldn't let me have my things or my dog. For about two years, I had to steal from myself just so I could have clothes. She let her crackhead friends sleep in my room, do drugs in there (I once found a makeshift pipe) and take whatever clothes and jewelry they wanted. I was furious when I found my class ring missing, and she got pissed when I confronted her and told her I had reported it stolen, and given the police her friend's names and contact info. 

&#x200B;

It took nearly two years for me to get my dog back, and when I did he was skin and bones, with wounds from a fight with another dog. It took me three days to get him to eat, and he was just barely beginning to gain weight when my mother brought the cops to my house after I refused to give him back to her. She wanted to take him back to the same house, where the dog that attacked him lived, and out of concern for his safety, I said no. Unfortunately, because everything pertaining to him was in her name, I was forced to give him back to her. I told her to never speak to me again. She called me the same damn day and told me to come get him because he'd been hurt again. I was livid. My dad and I were sharing a car at the time, so I didn't have the car until the following monday, and when I went to get him, I was infuriated. She had left him in his kennel the entire weekend, not even letting him out to go to the bathroom. His kennel was soaked in urine, and he was bonier than before, as if he hadn't eaten. I took him home, gave him a bath, fed him, washed out his kennel, set up an appointment with a vet I knew, and got him registered in our county. My baby ate like he was starved. He cleaned the bowl in less than 10 minutes. I would be damned if she took him from me again, as she clearly demonstrated that she wasn't capable of taking care of him. She tried again about six months later, and failed. My Moose has been living with me for about three years now, although he's still got some trust issues surrounding women, he knows that I'll do anything to make sure he has what he needs. He doesn't get hit, he doesn't get yelled at (unless he's doing the yelling), and he doesn't get locked in the kennel unless we have to leave for more than a couple hours (he gets bored and destroys the apartment).

&#x200B;

My mother has more recently convinced my family that I'm nothing but a liar and a thief. None of my maternal family members speak to me, especially after I cut my mother out of my life a couple years ago. I only have one cousin who talks to me because he's lived with her. He knows what she's like, and he saw the way she treated me. He's the only one who believed me. 

&#x200B;

One of her favorite abuse techniques is telephone harassment. She used to call me upwards of 40 times a day, calling me every name in the book, detailing how she was going to get me fired, making threats on my life, things like that. Eventually, she got my work phone number, and started harassing me at work. So, my boss got involved, and called a couple friends of his at the local police department (he had retired from there several years earlier). I spoke to an officer, and explained what was happening, let her listen to the voicemails that she left. And she said that she would tell her to cut it out, but, if she did that, I couldn't reach out to her. This was because, if I wanted to press telephone harassment charges, the DA wouldn't take the case if I'd reached out and contacted her. I agreed not to contact her. Little did I know, I had just made the best decision of my life. 

&#x200B;

About a year after she threw me out, I was diagnosed with anxiety, likely caused by the abuse from my mother. It took over a year of therapy, and daily SSRI's, but I'm doing really well. Cutting her out of my life was one of the best things I ever did, and I don't regret it in the slightest. I have a wonderful Fiance, a nice apartment, Moose is spoiled rotten, and things are looking great for me. It's possible to overcome the lifetimes of abuse we all suffer. It's not easy, but it's doable. No contact has been a great thing for me, and I have no reason or desire to make contact with her. And I'm determined to not raise my children the way she raised me. I refuse to be that kind of mother. Our family's cycle of abuse stops with me. "
50,My Nmom’s idea of a “good boyfriend”,<praw.models.comment_forest.CommentForest object at 0x7fcfb2b9f908>,lauraishereagain,0,7,9,False,raisedbynarcissists,,1536072206.0,9cw8jk,"Thought I’d share this because I’m curious if anyone else had parents whose ideas of a perfect partner for them sounded kind of like these...


-she doesn’t like my hard-working, kind boyfriend because he was born in a poor family and had to work in IT since the age of 14 to earn his living and give money to his parents. She says his family “shames us” (my family is rich by my country’s standards) 


-also, he’s 1 inch shorter than me. She told me that if a man isn’t at least 4 inches taller than me (I’m 5’10” so that narrows things down) I shouldn’t even speak to him because I look “like a mother talking to a baby” (??!!) 


-she says that she’d much prefer if I had an older man (40+, I’m 19) who was a doctor or something of the sort who could give me money without me doing anything. Basically, she wants me to get a sugar daddy. I told her she’s sick and she said that I am so naive about the ways of the world that it hurts. 
Did anyone’s mom say things like these? Is she as sick as she seems to me? 
"
51,Still coming to terms with the realisation my family is toxic,<praw.models.comment_forest.CommentForest object at 0x7fcfb20894e0>,stagnantriver35,0,2,7,False,raisedbynarcissists,,1536075375.0,9cwpy5,"I still feel even as I write this that I'm deluded. That I really am a bad person as I've been made to believe and that I've fabricated this whole thing in my head that my parents are narcissistic or at least possess some of the traits.

And yet I can't ignore certain things anymore. I can't ignore how their behaviour matches the traits. How I identify and feel the pain of people in similar situations. I keep rationalising what's happened because it seems too awful, too sick to believe this happened and is still happening. Its like I've found out a dirty little secret. That the people that are meant to love me want to hurt me. That they would take advantage of my nature. 

For years my friends have hated my parents from what I tell them, but I just brushed it off and in my head thought no I deserve this, my friends are just too soft, parents should be hard on their kids and I obviously thought ""of course my friends are going to side with me my version of events could be bias and also they want to make me feel validated"". I was told by my parents that ""Mary's parents think the sun shines out her ass"" whenever they just loved their kid normally. My version of what is normal is skewed. I believed my parents telling me I was all these negative words. If it weren't for my best friend I doubt I'd have realised. She is so bitter towards them for how I've been treated. Whenever she comes to my house my dad acts so fake and weird and she feels uncomfortable because she knows what he's really like. Like I deserve to be slapped, hit, emotionally abused, called stupid most days despite excelling academically, ganged up on, called fat since age 10 when I was not, being chased up the stairs running from someone who's supposedly my dad who's screaming at me ,""IM GOING TO KILL YOU""., told my nose is warped, that I'm socially awkward, will never find a husband, compared to my prettier and more socially conforming friends. grounded for eating a chocolate bar, talked about critically as if I'm not in the room, humiliated in front of my friends/boyfriend, shouted at for other siblings behaviour, my dad walking into my room despite me saying ""I'm getting changed"", being banned from using the computer when I need to do schoolwork, told that I'm such an expense as a child and made to feel guilty. 

I can't stop crying realising the reality of it all. I always wondered what was so wrong with me, what I did to anger and upset them so much. A lifetime of indignant injustice is threatening to overwhelm me. Any advice on where to go from here would be appreciated. One reason I feel like this has happened as the youngest of 4 children is my relaxed nature allows people to walk all over me. I never respond to insults because it seems useless to but I'm now wondering if this has enabled the abusers behaviour. I don't want to turn into them by acting like them."
52,Ndad is financially illiterate,<praw.models.comment_forest.CommentForest object at 0x7fcfb207f240>,youngempanada,0,5,7,False,raisedbynarcissists,,1536078276.0,9cx6rs,Are Nparents oblivious when it comes to finance?
53,How do you deal with narc enablers?,<praw.models.comment_forest.CommentForest object at 0x7fcfb207f518>,cosmo_kitten906,0,10,25,False,raisedbynarcissists,,1536050857.0,9ctu7d,"My dad is ex military, meaning that he missed a lot of my narc mums behaviour as he was often away. He’s left the military for quite a few years now so he’s experienced some of the stuff she’d been doing to my brother and I for years, and I’ve had many breakdowns where I’ve explained what she’s done, but it’s like he refuses to acknowledge it?

Well, that’s not strictly true. My Nmum is also extremely emotionally abusive to my dad, she treats him terribly, they will typically end up in an argument or he just takes the abuse and rants to me about it afterwards. When he does rant to me about it, it’s as if it’s the first time he’s seen her treat someone like that despite the fact he watches her do it to my brother and I all the time. I try to explain to him that the way she is treating him isn’t new and that she’s been like this for years. The thing is that when she does do it to us, he refuses to back us up. He chooses to pick her side, even when it makes absolute no sense.

He’ll tell us that she’s the parent and we must respect that and do what she says. She’s extremely anal about how things get done (they must be done exactly the way she wants it otherwise she has a meltdown and starts a huge  fight) but instead of realising that this behaviour of her is uncalled her, he tells us that we should walk on eggshells, always accommodate to her, basically that we should know better. 

It’s kinda hard to explain it all in a way that makes sense? Here’s an example of what I’m talking about:

My mother frequently accuses me of doing drugs (I don’t drink, I don’t do drugs, I don’t go out late, I have wholesome friends, I’m literally the last person to do drugs) but for some reason I could just be sitting at the table and she’d accuse me of doing drugs. 

One day she showed me a photo of a new sofa she bought and I said it was nice but my response wasn’t good enough so she accused me of not even looking at the picture and made me describe it, obviously since i did in fact look at the picture I was able to describe it and prove her wrong. So she accused me of doing drugs. I was clearly bothered by it and kinda just avoided her and because I was being ‘huffy’ she screamed my dads name to get him to rip into me for her because I was being ‘disrespectful’.

We had a huge family argument over it, i kept explaining that I found it offensive to be accused of taking drugs for no reason, that I had my phone taken off me, been sat down and shouted at, because I was offended of being accused of something. After lots of screaming and shouting my mum decides to come up with the excuse ‘I was only joking’

Now we ALL know she wasn’t joking but my dad decides to jump on the excuse with her, backing her up and telling me repeatedly that it was just a joke, all fun and bants. I fully broke at that point and told him that I was oh so glad that we was able to knowingly lie to me to avoid going against my mum. He didn’t say anything. 

I’m so sorry for ranting about it, I can’t seem to come up with a simplified version of what I’m trying to explain? 

So how do you deal with parents that just enable and encourage narc behaviour, forcing you to deal with it the same way they’ve chosen to deal with it, instead of actually addressing it and realising that the narc is wrong."
54,How can I help my girlfriend with her narcissistic mother ?,<praw.models.comment_forest.CommentForest object at 0x7fcfb20de198>,TAMokty,0,4,13,False,raisedbynarcissists,,1536061654.0,9cuv7c,"My girlfriend's mother is a alcoholic, has strong depressions and is really manipulative. Just yesterday she got into a fight with my girlfriend because her mother repeatedly told her, that she want's to kill herself. My girlfriend messaged me and asked if she could come over and I told her sure she can. So she arrived here and her mother messaged her a picture of herself crying to guilttrip her. And then she sent her messages like ""I do everything for you."", ""I will never contact you again."" etc. 

I was kinda shocked, I'm in a relationship with my girlfriend since 2 years, and she often told me about her mother being an alcoholic, and also abusive, but I would have never thought that she would behave like that.

The worst thing is tho, that I can't have my girlfriend come over at the moment. I have really important stuff to do for work, and I just can't have her over. I told her that she can come over for 2 weeks but only next week, until then I just can't because I would get in trouble. She told me she understands that and I believe her, but I still want to help her. You guys are or were in her position once and I just want to know from you people, what would you have wished for or what do you wish for when you were in that position ? "
55,"Nmom shutting doors, cupboards, doing dishes extra loudly whenever i'm out of her sight at her house.",<praw.models.comment_forest.CommentForest object at 0x7fcfb2c2d940>,metalion4,0,4,3,False,raisedbynarcissists,,1536089882.0,9cyyhk,"Seriously wtf.. does anyone else get this done to them? I'm 26 years old, it's \*\*\*\*ing pathetic.. like she thinks i'm a child that needs to supervised 24/7. She does it the worst when I type."
56,Why bother?,<praw.models.comment_forest.CommentForest object at 0x7fcfb20f2eb8>,stronger2003,0,3,3,False,raisedbynarcissists,,1536089611.0,9cyx3d,"I had a doctor's appointment today and got a high five from the doctor because I've lost 16 pounds over the last year. I tell my Nmom, and her response is ""well I can't tell"". Why do I even bother with her?! "
57,"Went NC, and now moving out of state from Nmom.",<praw.models.comment_forest.CommentForest object at 0x7fcfb2baa080>,AtomicTeddybear,0,4,3,False,raisedbynarcissists,,1536089485.0,9cywgn,"So, I have gone NC from my Nmom for about 2 months now, but due to atill living in the same same town, bumping into her can happen every now and then. 
Fortunately, I am moving about 12 hours away next week and so I won't have to deal with that anymore, but multiple people have told me that I should at least tell her I'm movinh because she's my mom. Problem is, I'm moving to a place where she grew up, but due to financial reasons she can't go back. I feel that telling her will just cause more harm, but thought I'd come to reddit to ask for advice."
58,so... how many of you had braces?,<praw.models.comment_forest.CommentForest object at 0x7fcfb2c23748>,deadturquoise,0,5,3,False,raisedbynarcissists,,1536089172.0,9cyuwp,"...and how many of you actually wanted braces? i had frequent painful visits to orthodontists and metal shit in my mouth for years during high school, why??? apparently if my teeth weren't straight i'd be a less likeable/lovable person... i have more to say sometime but this is a quick thought.... "
