,title,comments,author,guilded,num_comments,score,pinned,subreddit,author_flair_text,created_utc,r_id
0,We apologize,<praw.models.comment_forest.CommentForest object at 0x7fcfb6cb3c50>,ekjp,13,20928,0,False,announcements,,1436204196.0,3cbo4m
1,"Content Policy update. AMA Thursday, July 16th, 1pm pst.",<praw.models.comment_forest.CommentForest object at 0x7fcfb7059b00>,spez,6,18129,0,False,announcements,,1436908016.0,3dautm
2,"Hilary Duff, AMAA!",<praw.models.comment_forest.CommentForest object at 0x7fcfb6bfe160>,hilaryduff,0,1572,0,False,IAmA,,1434398587.0,39ybrp
3,"My 4 year old asked me, ""Daddy will you show your internet friends"".",<praw.models.comment_forest.CommentForest object at 0x7fcfb5edba58>,Yellr,1,882,44,False,gaming,,1402758394.0,284ul2
4,"Promote ideas, protect people",<praw.models.comment_forest.CommentForest object at 0x7fcfb5edbcc0>,kn0thing,1,5164,76,False,blog,,1431621180.0,35ym8t
5,"I am a Priest in the Church of Satan. Nevermind the crazies, let's have fun and ask me anything!",<praw.models.comment_forest.CommentForest object at 0x7fcfb56c47f0>,Invisible-War,0,3369,0,False,IAmA,,1393866278.0,1zg23j
6,"Hey, it's Lars from Metallica. AMA",<praw.models.comment_forest.CommentForest object at 0x7fcfb57356d8>,RealLarsUlrich,0,7297,77,False,IAmA,Lars Ulrich ,1391117427.0,1wl9ic
7,I'm the CEO of Renault and Nissan and we're making autonomous driving vehicles happen by 2020. Ask me anything!,<praw.models.comment_forest.CommentForest object at 0x7fcfb52e8048>,CarlosGhosn,0,4509,1800,False,IAmA,,1421101002.0,2s7obx
8,I've had my PS4 controller for a little over a week. The left stick is already a flap of rubber...,<praw.models.comment_forest.CommentForest object at 0x7fcfad367fd0>,Cayos,0,1350,0,False,gaming,,1383913910.0,1q68ek
9,"My dad invented a tool to lift heavy bags (like kitty litter) and asked me to make an ""infomercial"" for it...",<praw.models.comment_forest.CommentForest object at 0x7fcfae606f98>,nickelloafer,0,727,0,False,videos,,1388948384.0,1uh3ud
10,Emma Watson Sex Tape NSFW,<praw.models.comment_forest.CommentForest object at 0x7fcfb6f48ba8>,Execrat0r,0,269,281,False,videos,Never gonna let you down,1427815360.0,30xn63
11,5 Million Gmail Usernames and Passwords Leaked,<praw.models.comment_forest.CommentForest object at 0x7fcfb5735748>,ParanoiaNervosa,0,573,0,False,technology,,1410343633.0,2fzrdt
12,How the presidential election of 2016 would look like if only millennials voted,<praw.models.comment_forest.CommentForest object at 0x7fcfb6f5a7f0>,gytn25,0,369,124,False,dataisbeautiful,,1478689812.0,5c0hoh
13,Overworked game developer gets revenge by sneaking this past his boss and the Apple app review team. Wow. - [1:26],<praw.models.comment_forest.CommentForest object at 0x7fcfb7a7a6d8>,bensjammins,1,118,27,False,videos,,1418399970.0,2p35gi
14,Today is my Birthday. I turned 25. All I want for my birthday is an upvote.,<praw.models.comment_forest.CommentForest object at 0x7fcfb5c98b70>,SmashPig,0,170,0,False,AskReddit,,1300982186.0,gajxc
15,Every Man Is Responsible For His Own Soul,<praw.models.comment_forest.CommentForest object at 0x7fcfb68a3080>,yishan,2,4652,1447,False,blog,,1410050377.0,2foivo
16,Went skateboarding in an old Ford plant. Found this on the top floor.,<praw.models.comment_forest.CommentForest object at 0x7fcfb7724240>,Supermotility,0,311,0,False,creepy,,1419020888.0,2ptja1
17,How to throw your life away 101,<praw.models.comment_forest.CommentForest object at 0x7fcfb640de80>,TurqTurtle,0,452,284,False,funny,,1392311667.0,1xtdts
18,TIFU by destroying my girlfriend's family :(,<praw.models.comment_forest.CommentForest object at 0x7fcfb689e9b0>,Ambinevolence,2,1434,0,False,tifu,,1415265547.0,2lgk2j
19,"my friend looks just like the ""Frozen"" cutout at Target!",<praw.models.comment_forest.CommentForest object at 0x7fcfb6c11048>,hotcreamysex,0,370,163,False,funny,,1395791343.0,21da50
20,"reddit changes: individual up/down vote counts no longer visible, ""% like it"" closer to reality, major improvements to ""controversial"" sorting",<praw.models.comment_forest.CommentForest object at 0x7fcfb7aee630>,Deimorz,3,14170,0,False,announcements,,1403120379.0,28hjga
21,"I'm Pieter Hintjens, and I'm here to discuss psychopaths and other stuff, AMA!",<praw.models.comment_forest.CommentForest object at 0x7fcfb7710be0>,pieterh,0,767,0,False,IAmA,,1459016298.0,4c27ss
22,TIFU by having Taco Bell with my Girlfriend.,<praw.models.comment_forest.CommentForest object at 0x7fcfb87a7898>,,0,418,0,False,tifu,,1407707004.0,2d6fit
23,"The state of the subreddit, and how we’re going to tackle the current status of r/SimCity",<praw.models.comment_forest.CommentForest object at 0x7fcfaec66710>,InternetExplorer8,0,620,5,False,SimCity,,1363545293.0,1ah51f
24,"Came home from work to this desktop background, and promptly shat a brick.",<praw.models.comment_forest.CommentForest object at 0x7fcfaec730f0>,Enigma037,0,271,59,False,gaming,,1399751735.0,2589a1
25,"How Apple updates slow your old iPhone down, pushing you towards a new iPhone.",<praw.models.comment_forest.CommentForest object at 0x7fcfae9c2c88>,Dr__Nick,0,735,303,False,technology,,1413280285.0,2j7bpl
26,ISIS orders all women and girls in Mosul to undergo Female Genital Mutilation,<praw.models.comment_forest.CommentForest object at 0x7fcfb5cd52b0>,rahulthewall,0,1114,352,False,news,,1406205404.0,2bl8d7
27,TIL I'm a racist,<praw.models.comment_forest.CommentForest object at 0x7fcfae9c6518>,jaynap1,0,1711,601,False,funny,,1394944209.0,20j5iy
28,"Nintendo, always ahead of the game.",<praw.models.comment_forest.CommentForest object at 0x7fcfae541a20>,Baconandporn,0,1806,535,False,gaming,,1397484484.0,23063d
29,TIFU by not paying enough attention,<praw.models.comment_forest.CommentForest object at 0x7fcfb83f1080>,disappointed-guy,0,212,30,False,tifu,,1470569974.0,4wkj8b
30,Shots Fired.,<praw.models.comment_forest.CommentForest object at 0x7fcfaec44c88>,mafibasheth,0,277,0,False,gaming,,1402366458.0,27r35p
31,My girlfriend's dad was given just one month to live exactly 4 weeks ago today. Reddit show him your support for overcoming the odds and keeping calm even in the wake (no pun intended) of bowel cancer!,<praw.models.comment_forest.CommentForest object at 0x7fcfaf8ad6d8>,kingsfan2005,0,102,212,False,pics,,1406077208.0,2bg8qr
32,Ken Jennings (who won 73 straight games of Jeopardy) gives a reasonable response as to why he's a mormon on /r/exmormon,<praw.models.comment_forest.CommentForest object at 0x7fcfb26c3780>,timdual,0,1032,284,False,bestof,,1398303125.0,23tkzo
33,Finally.,<praw.models.comment_forest.CommentForest object at 0x7fcfaf88a6a0>,,0,348,634,False,funny,,1401810735.0,277k8m
34,IamA Porn Star Tanya Tate! AMA!,<praw.models.comment_forest.CommentForest object at 0x7fcfaf7bea20>,TanyaTatexxx,0,1430,241,False,IAmA,,1452790424.0,40yeyi
35,Wave of Violence in Israel and the Palestinian Territories,<praw.models.comment_forest.CommentForest object at 0x7fcfaf7f3080>,WorldNewsMods,0,1352,0,False,worldnews,,1445909971.0,3qd2ek
36,"Soon to become a minority in the US, whites express declining support for diversity, psychology study finds",<praw.models.comment_forest.CommentForest object at 0x7fcfb2698080>,Jewish_NeoCon2,0,388,37,False,science,,1412512340.0,2icpry
37,Tried scanning my face in NBA2k15... Never again.,<praw.models.comment_forest.CommentForest object at 0x7fcfafe49780>,mayobf,0,103,53,False,gaming,,1454262209.0,43jzuy
38,[NSFW] Female streaker runs onto soccer pitch and scores an incredible goal,<praw.models.comment_forest.CommentForest object at 0x7fcfafe45438>,pepito420,0,254,223,False,videos,,1398105396.0,23lzad
39,"Eurasian Eagle-owls are one of the few owls to soar on thermals during the day, often resulting in them getting confused for hawks! [OC]",<praw.models.comment_forest.CommentForest object at 0x7fcfaf068c88>,UnidanX,0,437,0,False,Awwducational,,1406777806.0,2c7hrw
40,/u/brettybluevein explains the problem with making excuses for going slightly over limits,<praw.models.comment_forest.CommentForest object at 0x7fcfaf1ae518>,Somesortofthing,0,178,0,False,bestof,,1432438721.0,3723ma
41,Anna Kendrick.,<praw.models.comment_forest.CommentForest object at 0x7fcfaf068e80>,KAOS1212,0,296,650,False,funny,,1393548809.0,1z4ysb
42,Life in Japan,<praw.models.comment_forest.CommentForest object at 0x7fcfada0af60>,,0,89,0,False,pics,,1421768699.0,2t24f5
43,"I left my phone in the bathroom, came back to get it and this pic was on it.WTF",<praw.models.comment_forest.CommentForest object at 0x7fcfb427dc88>,tumey23,0,325,792,False,funny,,1397139645.0,22p0cr
44,Her baby sister is having heart surgery tomorrow. Please throw up an extra one tonight to whoever you pray to.,<praw.models.comment_forest.CommentForest object at 0x7fcfad9fb1d0>,jillenejillene,0,513,527,False,pics,,1394772963.0,20dq7d
45,We apologize,<praw.models.comment_forest.CommentForest object at 0x7fcfafe256d8>,ekjp,1,2511,0,False,modnews,,1436204078.0,3cbnuu
46,[NSFW] Daughter rides mom while son motorboats,<praw.models.comment_forest.CommentForest object at 0x7fcfaedf4080>,Kieji,0,815,743,False,videos,,1391481050.0,1wy7zp
47,Crysis came out 8 years ago,<praw.models.comment_forest.CommentForest object at 0x7fcfaedd2588>,kencrema,0,863,451,False,gaming,,1390191264.0,1vn9od
48,Leonardo DiCaprio wins Best Actor. 2016 Academy Awards.,<praw.models.comment_forest.CommentForest object at 0x7fcfb5df8dd8>,GoinFerARipEh,0,105,174,False,pics,,1456721641.0,488g9g
49,Someone does the ALSA ice bucket challenge and reveals a scam,<praw.models.comment_forest.CommentForest object at 0x7fcfada31588>,ecir2002,0,579,512,False,videos,,1408482475.0,2e0qk0
50,According to this thing.,<praw.models.comment_forest.CommentForest object at 0x7fcfaeab9f98>,TehRawrz,0,597,756,False,funny,,1396978049.0,22j5tv
51,We’re fighting for marriage equality in Utah and around the world. Will you help us?,<praw.models.comment_forest.CommentForest object at 0x7fcfb0177320>,maxgprime,0,8617,1102,False,blog,,1399309953.0,24seva
52,Hi. My name is Skrillex. AMA,<praw.models.comment_forest.CommentForest object at 0x7fcfae8394e0>,MyN4meIsSkrillex,0,8779,761,False,Music,Verified,1394218350.0,1ztuxf
53,Up the butt?,<praw.models.comment_forest.CommentForest object at 0x7fcfafef16a0>,Illfixt,0,586,801,False,gifs,,1400930143.0,26db0b
54,"I know I'm a big girl, I like food. But I refuse to be a glued-to-the-couch big girl.",<praw.models.comment_forest.CommentForest object at 0x7fcfb22b3ba8>,LovelySweet1789,0,945,667,False,pics,,1390089768.0,1vk3h4
55,WikiLeaks outs gay people in Saudi Arabia in ‘reckless’ mass data dump,<praw.models.comment_forest.CommentForest object at 0x7fcfb6b4ff98>,xbettel,0,725,435,False,worldnews,,1471957694.0,4z6d0n
56,"Reddit, my dad died yesterday. I am absolutely destroyed, but this video of him hula hooping on Wii Sports is helping me to stay sane as I go through the funeral preparations.",<praw.models.comment_forest.CommentForest object at 0x7fcfb856a240>,thingsthingsthings,0,919,781,False,videos,,1397014009.0,22kt6h
57,This really is becoming an epidemic. Now there teaming up.,<praw.models.comment_forest.CommentForest object at 0x7fcfb8210fd0>,Notasandwhichyet,0,109,132,False,funny,,1424490422.0,2wmfoy
58,Tonight is the big night! Wish me luck reddit!,<praw.models.comment_forest.CommentForest object at 0x7fcfb800ec18>,wangtown_usa,0,442,420,False,pics,,1408927049.0,2ehk9n
59,This kid is my fucking hero,<praw.models.comment_forest.CommentForest object at 0x7fcfb7f62c50>,Brian_Sun_,0,483,2338,False,funny,,1437155207.0,3dnbts
60,Freckled nose,<praw.models.comment_forest.CommentForest object at 0x7fcfb7e1e9b0>,,1,181,319,False,pics,,1459165255.0,4c9smm
61,My brother and I got in a fight before he left for basic training a couple months ago...This is the first thing I've received from him.,<praw.models.comment_forest.CommentForest object at 0x7fcfb65b6b70>,Rhyno001,0,421,686,False,funny,,1396567599.0,225any
62,Friends that build docks together stay together,<praw.models.comment_forest.CommentForest object at 0x7fcfb787fdd8>,,0,268,534,False,pics,,1438338093.0,3f9vkr
63,THE H3H3PRODUCTIONS RANT - Leafy,<praw.models.comment_forest.CommentForest object at 0x7fcfb764def0>,jdpalmer,0,722,110,False,videos,,1458776289.0,4bp5c1
64,Justin Bieber Arrested for Drag Racing / DUI (Miami),<praw.models.comment_forest.CommentForest object at 0x7fcfb76b7240>,S_E_G_A,0,3636,736,False,news,,1390477708.0,1vxp05
65,got slapped by my sister for this one.,<praw.models.comment_forest.CommentForest object at 0x7fcfb71b7ef0>,iLikeShmellyEggs,0,838,677,False,funny,,1390250765.0,1vp8es
66,A 1-minute old elephant,<praw.models.comment_forest.CommentForest object at 0x7fcfb4ec7ef0>,Trippze,0,426,837,False,pics,,1403356325.0,28pwm8
67,Wave of Violence in Israel and the Palestinian Territories,<praw.models.comment_forest.CommentForest object at 0x7fcfb6d481d0>,WorldNewsMods,0,845,0,False,worldnews,,1445605584.0,3pwi22
68,This was left in the disc tray when my first-gen XBox was returned to me from Microsoft after overheating,<praw.models.comment_forest.CommentForest object at 0x7fcfb7f5ea20>,johny380,0,97,0,False,gaming,,1450365908.0,3x81mo
69,How to pick up american girls...,<praw.models.comment_forest.CommentForest object at 0x7fcfb4aedcc0>,RJ777,0,790,850,False,funny,,1402492192.0,27vga4
70,TIFU - Shark Touch Tank Accident -NSFW,<praw.models.comment_forest.CommentForest object at 0x7fcfb48826a0>,dick_thrownaway,1,268,143,False,tifu,,1469911352.0,4vdw36
71,"Dear America. Love, Canada.",<praw.models.comment_forest.CommentForest object at 0x7fcfb6bd5208>,Das_Mojo,0,416,701,False,funny,,1391125323.0,1wln0a
72,"[F]18, I'm a little shy, but here's my hot ass....",<praw.models.comment_forest.CommentForest object at 0x7fcfb4088f98>,tricky3737,0,231,734,False,funny,,1386722815.0,1slevy
73,"Girls who enjoy getting cum on your face, what was your first experience like? What does it mean to you psychologically?",<praw.models.comment_forest.CommentForest object at 0x7fcfb3e98f98>,French_Bulldog,0,889,244,False,AskReddit,,1436623062.0,3cwv3l
74,"Teacher orgets projector is on, stalks student's Facebook profile",<praw.models.comment_forest.CommentForest object at 0x7fcfb40f83c8>,,0,126,220,False,pics,,1416040407.0,2md6wk
75,"As a female who is generally unaware of her car, this was GREATLY appreciated. Thanks kind stranger!",<praw.models.comment_forest.CommentForest object at 0x7fcfb3c58eb8>,mrredditkarma,0,137,364,False,pics,,1399206163.0,24otgb
76,He's back! Free sex (Rémi Gaillard),<praw.models.comment_forest.CommentForest object at 0x7fcfb3e182e8>,HeftyDanielson,0,205,188,False,videos,,1396004959.0,21l1jq
77,Ladies let's get this right.,<praw.models.comment_forest.CommentForest object at 0x7fcfb3b809b0>,illshootyouintheface,0,158,127,False,funny,,1398605501.0,243pm7
78,"So my brother is on a road trip, and this is the single fucking picture he sends me",<praw.models.comment_forest.CommentForest object at 0x7fcfb3a28b38>,lampshit,0,275,1619,False,funny,,1440814502.0,3iswb2
79,Modern music production,<praw.models.comment_forest.CommentForest object at 0x7fcfb35a36a0>,joecooool418,0,309,531,False,funny,,1388941234.0,1ugu6h
80,My friend dressed up as his mom & tried to get his phone back,<praw.models.comment_forest.CommentForest object at 0x7fcfb3a22358>,B4DASS,0,434,815,False,funny,,1400869710.0,26bfpp
81,Kanye West at his best...,<praw.models.comment_forest.CommentForest object at 0x7fcfb3157240>,Goldenoir,0,395,756,False,funny,,1399205872.0,24ot8o
82,Seems like anything can get to the frontpage on /r/funny so here's this.,<praw.models.comment_forest.CommentForest object at 0x7fcfb31571d0>,Busterr,0,252,922,False,funny,,1399416948.0,24wkyj
83,R.I.P. to Justin Bieber's Career as of today (2009-2014),<praw.models.comment_forest.CommentForest object at 0x7fcfb2e63438>,EzioBreed,0,3399,1124,False,videos,,1401905536.0,27b6pe
84,Kevin's figured it out,<praw.models.comment_forest.CommentForest object at 0x7fcfb3c0b358>,KashK10,0,437,771,False,funny,,1391959123.0,1xfq52
85,We're sharing our company's core values with the world,<praw.models.comment_forest.CommentForest object at 0x7fcfb2c11518>,reddit,0,4033,0,False,blog,,1430932269.0,352twf
86,"Science AMA Series: I’m Laura Salazar, associate professor of health promotion and behavior at the School of Public Health at Georgia State University. I’m developing web-based approaches to preventing sexual assaults on college campuses. AMA!",<praw.models.comment_forest.CommentForest object at 0x7fcfb2804320>,Prof_Laura_Salazar,0,302,0,False,science,Professor of Health Promotion |Georgia State,1446724618.0,3rmapx
87,"I’m Zoë Quinn, the indie game developer behind the Chuck Tingle game, Depression Quest, and a whole mess of other stuff. AMA!",<praw.models.comment_forest.CommentForest object at 0x7fcfb3151048>,zoequinn,0,1082,86,False,IAmA,,1478547871.0,5bobt6
88,How we decided to announce we were expecting.,<praw.models.comment_forest.CommentForest object at 0x7fcfb2148208>,jesfunshinebear,0,767,800,False,funny,,1398903726.0,24ey4l
89,Joan Rivers,<praw.models.comment_forest.CommentForest object at 0x7fcfb03dcac8>,oakes_smnth,0,737,820,False,funny,,1391402016.0,1wv7v7
90,"'Jews, Out of France!' Around 17000 March in Paris Chanting Anti-Semitic Slurs",<praw.models.comment_forest.CommentForest object at 0x7fcfb03d5940>,official_TASKER,0,1389,418,False,worldnews,,1391058969.0,1wj89m
91,Pokénatomy,<praw.models.comment_forest.CommentForest object at 0x7fcfb01ca2b0>,Venau,0,111,46,False,gaming,,1465141674.0,4mny2f
92,Selena Gomez,<praw.models.comment_forest.CommentForest object at 0x7fcfafdc1da0>,wxnderwall,0,328,729,False,funny,,1392742427.0,1y95ck
93,Ladies: What non-sexual thing can make you want to bang a guy?,<praw.models.comment_forest.CommentForest object at 0x7fcfafd9ce80>,,0,1182,44,False,AskReddit,,1435229212.0,3b25v5
94,What is happening in this subreddit?,<praw.models.comment_forest.CommentForest object at 0x7fcfb6b62b70>,tnvb,0,394,4,False,apple,,1477745038.0,5a09xt
95,This is how the star quarter back and the half back came out on the last day of school in Alabama. So proud of them!,<praw.models.comment_forest.CommentForest object at 0x7fcfaf8c1e48>,,0,168,236,False,pics,,1431619260.0,35yi3l
96,"Real WW1 footage: A rare video of a real front line clash, British Soldiers advancing from the right and German Soldiers from the left.",<praw.models.comment_forest.CommentForest object at 0x7fcfaf4268d0>,LeWhisp,0,107,82,False,videos,,1431438128.0,35pkaz
97,Stripper transformation - Before and After,<praw.models.comment_forest.CommentForest object at 0x7fcfafa79940>,Dannydreadd,0,302,692,False,pics,,1393419631.0,1yzhmn
98,Possibly the greatest selfie ever taken...,<praw.models.comment_forest.CommentForest object at 0x7fcfb6b62dd8>,RyanCast1,0,1185,1106,False,pics,,1393628691.0,1z7x0s
99,Justice,<praw.models.comment_forest.CommentForest object at 0x7fcfaf09e7b8>,UFCWWF,0,63,0,False,pics,,1406566011.0,2byi1e
