,title,comments,author,guilded,num_comments,score,pinned,subreddit,author_flair_text,created_utc,r_id,body
0,We apologize,<praw.models.comment_forest.CommentForest object at 0x7fcfb781abe0>,ekjp,13,20928,0,False,announcements,,1436204196.0,3cbo4m,"We screwed up. Not just on July 2, but also over the past several years. We haven’t communicated well, and we have surprised moderators and the community with big changes. We have apologized and made promises to you, the moderators and the community, over many years, but time and again, we haven’t delivered on them. When you’ve had feedback or requests, we haven’t always been responsive. The mods and the community have lost trust in me and in us, the administrators of reddit.

Today, we acknowledge this long history of mistakes. We are grateful for all you do for reddit, and the buck stops with me. We are taking three concrete steps:

**Tools**: We will improve tools, not just promise improvements, building on work already underway.  u/deimorz and u/weffey will be working as a team with the moderators on what tools to build and then delivering them.

**Communication**: u/krispykrackers is trying out the new role of Moderator Advocate. She will be the contact for moderators with reddit and will help figure out the best way to talk more often. We’re also going to figure out the best way for more administrators, including myself, to talk more often with the whole community.

**Search**: We are providing an option for moderators to default to the old version of search to support your existing moderation workflows. Instructions for setting this default are [here](https://www.reddit.com/wiki/search#wiki_enabling_legacy_search).

I know these are just words, and it may be hard for you to believe us. I don't have all the answers, and it will take time for us to deliver concrete results. I mean it when I say we screwed up, and we want to have a meaningful ongoing discussion. I know we've drifted out of touch with the community as we've grown and added more people, and we want to connect more. I and the team are committed to talking more often with the community, starting now.

Thank you for listening. Please share feedback here. Our team is ready to respond to comments.
"
1,"Content Policy update. AMA Thursday, July 16th, 1pm pst.",<praw.models.comment_forest.CommentForest object at 0x7fcfb7e2f898>,spez,6,18129,0,False,announcements,,1436908016.0,3dautm,"Hey Everyone,

There has been a lot of discussion lately —on reddit, in the news, and here internally— about reddit’s policy on the more offensive and obscene content on our platform. Our top priority at reddit is to develop a comprehensive Content Policy and the tools to enforce it.

The overwhelming majority of content on reddit comes from wonderful, creative, funny, smart, and silly communities. That is what makes reddit great. There is also a dark side, communities whose purpose is reprehensible, and we don’t have any obligation to support them. And we also believe that some communities currently on the platform should not be here at all.

Neither Alexis nor I created reddit to be a bastion of free speech, but rather as a place where open and honest discussion can happen:  These are very complicated issues, and we are putting a lot of thought into it. It’s something we’ve been thinking about for quite some time.  We haven’t had the tools to enforce policy, but now we’re building those tools and reevaluating our policy.

We as a community need to decide together what our values are. To that end, I’ll be hosting an AMA on Thursday 1pm pst to present our current thinking to you, the community, and solicit your feedback.

PS - I won’t be able to hang out in comments right now. Still meeting everyone here!"
2,"Hilary Duff, AMAA!",<praw.models.comment_forest.CommentForest object at 0x7fcfb5a500f0>,hilaryduff,0,1572,0,False,IAmA,,1434398587.0,39ybrp,"Hi guys!

I'm [Hilary Duff.](https://www.hilaryduff.com/home)

My new single is [""Sparks""](https://itunes.apple.com/us/album/sparks-single/id980330101) and my new album, ""Breathe In. Breathe Out."" is released tomorrow June 16.

I'm here at reddit with Victoria helping me out today. AMAA!

https://twitter.com/HilaryDuff/status/610538727245512705

**EDIT**:

Thank you guys so much for taking time out of your day to be here, and asking me questions, and listen to me babble! I really hope you enjoy ""Breathe In. Breathe Out."" I thank you for sticking with me for such a long time, and supporting everything I do. And I'm just grateful. So thank you and I hope you enjoyed the chat!"
3,"My 4 year old asked me, ""Daddy will you show your internet friends"".",<praw.models.comment_forest.CommentForest object at 0x7fcfb55a3b00>,Yellr,1,882,36,False,gaming,,1402758394.0,284ul2,
4,"Promote ideas, protect people",<praw.models.comment_forest.CommentForest object at 0x7fcfb6bec668>,kn0thing,1,5164,78,False,blog,,1431621180.0,35ym8t,
5,"I am a Priest in the Church of Satan. Nevermind the crazies, let's have fun and ask me anything!",<praw.models.comment_forest.CommentForest object at 0x7fcfb657ceb8>,Invisible-War,0,3369,0,False,IAmA,,1393866278.0,1zg23j,"Over the past several weeks Satanism, directly and indirectly, has caught the attention of the media. Lunatics are blaming the Devil for their deranged acts of violence, rumors of ""Satanic"" cults are spreading among the tabloids and fans of True Detective are searching for the Yellow Sign in satanic rituals. Peter H. Gilmore, the current High Priest of the Church of Satan, has been [a guest on CNN](http://religion.blogs.cnn.com/2014/02/17/satanist-church-accused-craigslist-killer-not-one-of-us/), [interviewed by the CBC](http://www.cbc.ca/day6/popupaudio.html?clipIds=2438899671) and numerous other outlets (published and unpublished) in an effort to defuse a revival of the Satanic Panic from 80's and 90's. It's a shame that for many people the only exposure to Satanism is in reaction to such grim, pointless insanity; when by and large the Satanists I know are some the most life-loving individuals I've ever encountered. 

Due to the recent media exposure I'm not surprised to see several threads hitting the front page of Reddit mentioning Satanism, attempted AMA's from questionable sources, and a genuine interest in what Satanism and the Church of Satan is actually about. Obviously one can go to the Church of Satan's website and [check out the basic texts](http://churchofsatan.com/theory-practice.php) and [FAQ](http://churchofsatan.com/frequently-asked-questions.php), but we recognize that humans are social creatures and a certain level of interaction can help drive points home.  

That said, my name is Raul A. and I'm an officially ordained Priest in the Church of Satan, and have been an active Satanist for over 10 years. In my time with the Church of Satan, and well before that, I've interacted with Satanists with a wide range of interests, personalities, and backgrounds. I've organized concerts with Satanic folk bands to experimental electronic musicians. I am the technical director of [Radio Free Satan](http://www.radiofreesatan.com/). My wedding was officiated by a Satanic Priest, I enjoyed Tiki drinks and 50's music with High Priestess Peggy Nadramia, and watched Kaiju films and talked Pacific Rim with High Priest Gilmore. I've also known many nonpublic Satanists who, for various reasons, cannot openly proclaim their worldviews.   

Why am I doing this AMA? For one, I think the Reddit community is interested in the topic and has been mostly given a poor representation of what Satanism is about, in theory and practice. I've seen some fairly interesting questions go without responses, and mostly a lot of talk from people who ""read Crowley in high school"" (FYI, Crowley never identified himself as a Satanist, and has very little to with Satanism) or ""knew a guy once"". Responses are often such a bore and miss the point entirely.  

So here's your chance, ask me anything! And, like any decent Satanist, let's make this fun! Let's try things other than the usual ""Why call it Satanism if you don't believe in Satan"" (*), let's talk about life, experiences, and the pleasures of the material world! Let the games begin!  

Proof: http://imgur.com/a/wAPvz?gallery

* The ""Satan"" in ""Satanism"" refers to the Hebrew word for ""the adversary"", and that is the context in which we use it. We understand that the human animal has an innate need for religion, symbolism, and dogma so we Satanists willfully choose the one we most identify with.

Edit: I have a business call to attend to for an hour or so, I'll be back shortly!

Edit: Seems that many of my responses have been downvoted to Hell (ba dum). Here's a handy Q&A table http://www.reddit.com/r/tabled/comments/1zgfeg/table_i_am_a_priest_in_the_church_of_satan/  

Edit: Time to roll up the tent. Overall I had a fairly good time, answered a few good questions, made some new friends, and ran into some old ones. If you haven't seen my responses, especially in the first few hours of this AMA, it's because my comments were immediately being downvoted and hidden from the default views([I didn't realize Reddit were such big fans of the Westboro Baptist Church](http://www.reddit.com/r/IAmA/comments/1zg23j/i_am_a_priest_in_the_church_of_satan_nevermind/cfte5pu)). See the table above or my comment history to see my responses, [which apparently is more than most celebrity AMA's combined](http://www.reddit.com/r/IAmA/comments/1zg23j/i_am_a_priest_in_the_church_of_satan_nevermind/?sort=confidence#cftg9u9). Special thanks to the moderators who've attempted to inject some rationality and to /u/Milagre for the help with the Q&A Table."
6,"Hey, it's Lars from Metallica. AMA",<praw.models.comment_forest.CommentForest object at 0x7fcfb361e400>,RealLarsUlrich,0,7297,79,False,IAmA,Lars Ulrich ,1391117427.0,1wl9ic,"I am Lars Ulrich, drummer for Metallica.  Our band has been around for over 30 years and the movie we made in 2012, ""Metallica Through The Never,"" just came out on DVD.  We're going to do what we love best and hit the road on tour in Latin America and Europe this Spring and Summer, where we will be playing an all request set list each night.  Go for it and ask me anything!

Metallica Through The Never - http://www.throughthenevermovie.com

**My Proof:** https://www.facebook.com/photo.php?fbid=10151890021595264&set=a.10150204649640264.311112.10212595263&type=1&theater

UPDATE: I'll answer a couple more questions and then our time's up (I'm told).

UPDATE: I gotta run - afternoon school pickup grind is commencing. Let's all meet around the keyboard again soon! Thanks to everyone for being a part of this. 
L"
7,I'm the CEO of Renault and Nissan and we're making autonomous driving vehicles happen by 2020. Ask me anything!,<praw.models.comment_forest.CommentForest object at 0x7fcfb8741400>,CarlosGhosn,0,4509,1801,False,IAmA,,1421101002.0,2s7obx,"I am Carlos Ghosn, the President and CEO of Renault and Nissan. Over a year ago, I made a pledge that we would bring autonomous driving vehicles to market by 2020. We're on track to make that happen. In fact last week, I announced the formation of a partnership between NASA's Ames and our Silicon Valley research centers. 

Today, I revealed the new Nissan Titan at the Detroit Auto Show. Go ahead, ask me anything!

My Proof: https://twitter.com/Nissan/status/553932864895864832/photo/1

EDIT: I'm sorry I have to leave, but this was fun, thank you everyone for your time!

EDIT 2: Hello Reddit! I wish I had more time yesterday to answer questions. I am going to try to make that up to you and answer more questions later today. Please bear with me – the hardest part is the typing."
8,I've had my PS4 controller for a little over a week. The left stick is already a flap of rubber...,<praw.models.comment_forest.CommentForest object at 0x7fcfae8be208>,Cayos,0,1350,0,False,gaming,,1383913910.0,1q68ek,
9,"My dad invented a tool to lift heavy bags (like kitty litter) and asked me to make an ""infomercial"" for it...",<praw.models.comment_forest.CommentForest object at 0x7fcfae8e5160>,nickelloafer,0,727,0,False,videos,,1388948384.0,1uh3ud,
10,Emma Watson Sex Tape NSFW,<praw.models.comment_forest.CommentForest object at 0x7fcfae93b400>,Execrat0r,0,269,279,False,videos,Never gonna let you down,1427815360.0,30xn63,"Oooh

We're no strangers to love


You know the rules and so do I


A full commitment's what I'm thinking of


You wouldn't get this from any other guy

I just wanna tell you how I'm feeling


Gotta make you understand

Never gonna give you up


Never gonna let you down


Never gonna run around and desert you


Never gonna make you cry


Never gonna say goodbye


Never gonna tell a lie and hurt you

We've known each other for so long


Your heart's been aching, but


You're too shy to say it


Inside, we both know what's been going on


We know the game and we're gonna play it

And if you ask me how I'm feeling


Don't tell me you're too blind to see

Never gonna give you up


Never gonna let you down


Never gonna run around and desert you


Never gonna make you cry

Never gonna say goodbye

Never gonna tell a lie and hurt you

Never gonna give you up

Never gonna let you down

Never gonna run around and desert you

Never gonna make you cry

Never gonna say goodbye

Never gonna tell a lie and hurt you

(Ooh, give you up)

(Ooh, give you up)

Never gonna give, never gonna give

(Give you up)

Never gonna give, never gonna give

(Give you up)

We've known each other for so long

Your heart's been aching, but

You're too shy to say it

Inside, we both know what's been going on

We know the game and we're gonna play it

I just wanna tell you how I'm feeling

Gotta make you understand

Never gonna give you up

Never gonna let you down

Never gonna run around and desert you

Never gonna make you cry

Never gonna say goodbye

Never gonna tell a lie and hurt you

Never gonna give you up

Never gonna let you down

Never gonna run around and desert you

Never gonna make you cry

Never gonna say goodbye

Never gonna tell a lie and hurt you

Never gonna give you up

Never gonna let you down

Never gonna run around and desert you

Never gonna make you cry

Never gonna say goodbye

Never gonna tell a lie and hurt you
"
11,5 Million Gmail Usernames and Passwords Leaked,<praw.models.comment_forest.CommentForest object at 0x7fcfb1f77198>,ParanoiaNervosa,0,573,0,False,technology,,1410343633.0,2fzrdt,
12,How the presidential election of 2016 would look like if only millennials voted,<praw.models.comment_forest.CommentForest object at 0x7fcfb5a51da0>,gytn25,0,369,120,False,dataisbeautiful,,1478689812.0,5c0hoh,
13,Overworked game developer gets revenge by sneaking this past his boss and the Apple app review team. Wow. - [1:26],<praw.models.comment_forest.CommentForest object at 0x7fcfb54eae48>,bensjammins,1,118,28,False,videos,,1418399970.0,2p35gi,
14,Today is my Birthday. I turned 25. All I want for my birthday is an upvote.,<praw.models.comment_forest.CommentForest object at 0x7fcfb6daf940>,SmashPig,0,170,0,False,AskReddit,,1300982186.0,gajxc,
15,Every Man Is Responsible For His Own Soul,<praw.models.comment_forest.CommentForest object at 0x7fcfb6f19d68>,yishan,2,4652,1442,False,blog,,1410050377.0,2foivo,
16,Went skateboarding in an old Ford plant. Found this on the top floor.,<praw.models.comment_forest.CommentForest object at 0x7fcfaec80be0>,Supermotility,0,311,0,False,creepy,,1419020888.0,2ptja1,
17,How to throw your life away 101,<praw.models.comment_forest.CommentForest object at 0x7fcfb5382470>,TurqTurtle,0,452,283,False,funny,,1392311667.0,1xtdts,
18,TIFU by destroying my girlfriend's family :(,<praw.models.comment_forest.CommentForest object at 0x7fcfb631b1d0>,Ambinevolence,2,1434,0,False,tifu,,1415265547.0,2lgk2j,"I've been dating an amazing girl for a bit over a year now. She's pretty chill and progressive, but she comes from a VERY conservative protestant family. Frankly, it's amazing that she isn't disowned - her parents and siblings obviously love her very much, but every time we go to visit they are not shy about voicing their disapproval of her lifestyle choices. Thankfully they're all cordial and the concerns are voiced civilly so there's no raised voices or hurt feelings, but not being part of the family these lectures are quite uncomfortable for me. ESPECIALLY since I'm not spared from her family's criticism.

As you can imagine we don't visit them much. They were kind enough to extend a dinner invitation on Wednesday evening, and since we hadn't seen them in a month or so we took them up on it. Despite the occasional awkward disapproving interjection (which we're both used to by now) things were going well... that is, until I let slip that she and I were thinking about moving in together. At that point her father gave me the coldest gaze I'd ever seen. And he wouldn't stop fucking GLARING at me. From that point on he had no qualms about interrupting me every time I spoke, quoting bible passages to insult me or contradict every single thing I would say in some fashion. I may not have been on exactly the same page as her father before, but we'd gotten along okay nonetheless... it definitely seemed like he was just being rude, obnoxious, and particularly confrontational. Now I'm an extremely even-tempered guy, but he was bagging on me to the extent that I had to excuse myself four goddamn times during dinner because he was pissing me off and I needed to cool down. There were multiple instances where his daughter and wife would even comment on his mean attitude but he seemed to just totally ignore them. This guy obviously intended to goad me.

After dessert my girlfriend and her mother are washing dishes, leaving me and her father alone at the dining room table. After a brief awkward silence I decided to straight-up ask him why he was so upset with me. He revealed that he was wholeheartedly against the idea of his daughter living with an ""unscrupulous heathen"" (his literal words) as that pretty much guaranteed premarital sex. I'd had enough of his shit by this point and decided a dose of reality would straighten him out, but emotion certainly got the best of me and my delivery was incredibly crass. ""If you think it took more than a few weeks to twist your daughter into all kinds of kinky pretzels you can't even imagine and stuff various objects into every hole in her body then you're just being willfully ignorant."" In my defense, I was being honest... she's ridiculously kinky. I still feel bad for being so disrespectful, though.

I have never been punched out of anger before, so when this 64 year old man lunged across the table and struck me I was caught completely off guard. I'm a regular gym-goer and participated in martial arts in the past, but none of that mattered - the next thing I knew I was on my back with this previously-very-collected elderly fellow on top of me in a blood rage. Still dazed from smacking my head on the ground when my chair tipped over, it was all I could do to try and deflect his onslaught of wild blows. It seemed like a fucking eternity before his wife and daughter pulled him off me. I stood up and could feel the sting of blood dripping into my eye. I could taste it in my mouth. I was still dizzy and disoriented but it was obvious that I'd received some pretty solid blows. While I was slightly embarrassed that someone almost twice my age handed me my ass, I nevertheless felt like I won. Like I got him to snap even though he'd been working on me for hours.

My girlfriend ushered me into the bathroom and began to gingerly tend my wounds. Her mother and father were hollering back and forth incomprehensibly in the dining room downstairs; when I heard them say her name I assured her I was fine on my own and urged her to deal with her folks. More incomprehensible yelling ensued, though my girlfriend's voice now joined the chorus. Around the time I'd managed to staunch the bleeding from my eyebrow she returned with my coat and said simply, ""We're leaving."" She was angrier than I'd ever seen her yet managed to remain collected. Normally when we'd leave her parents' house there were fond farewells... warm handshakes, hugs, wishes for prosperity, and blessings abound. Not this time, though. This time there was only her mother crying alone at the dinner table; we didn't even stop to say good-bye. Her father was nowhere to be found. Nothing but silence while we got into the car and left the driveway. A few miles down the road I noticed tears in my girlfriend's eyes. I wanted to be there for her, to comfort her in some way, but I just didn't know how. ""Do you want to talk about it?"" I asked, feeling stupid that I couldn't come up with something more suave to break the silence. ""Not right now"" she said, her voice strained against the flood of emotion. I put one of my hands in hers and squeezed ever so slightly, letting her know without words that I was there for her when she was ready. She squeezed back, refusing to break down sobbing even as large, heavy tears rolled down her face. We rode the rest of the way without saying anything.

**TL;DR**: *SO's dad intentionally pushes my buttons HARD. I tell him I thoroughly fucked his daughter. He physically attacks me. Everyone loses.*



EDIT: minor editing; mostly punctuation.

EDIT 2: I wonder if the ~~person who's~~ people who are going through and down-voting all of my comments (even in other subs) ~~is~~ are the same ~~person~~ people who did the same thing in my last TIFU thread.

EDIT 3: Thanks for the gold, I'd imagine it's pissing off the downvote brigade. I'll be sure to pay it forward.  <3"
19,"my friend looks just like the ""Frozen"" cutout at Target!",<praw.models.comment_forest.CommentForest object at 0x7fcfb692ceb8>,hotcreamysex,0,370,166,False,funny,,1395791343.0,21da50,
20,"reddit changes: individual up/down vote counts no longer visible, ""% like it"" closer to reality, major improvements to ""controversial"" sorting",<praw.models.comment_forest.CommentForest object at 0x7fcfb87d6d68>,Deimorz,3,14170,0,False,announcements,,1403120379.0,28hjga,"""Who would downvote this?"" It's a common comment on reddit, and is fairly often followed up by someone explaining that reddit ""fuzzes"" the votes on everything by adding fake votes to posts in order to make it more difficult for bots to determine if their votes are having any effect or not. While it's always been a necessary part of our anti-cheating measures, there have also been a lot of negative effects of making the specific up/down counts visible, so we've decided to remove them from public view.

The ""false negativity"" effect from fake downvotes is especially exaggerated on very popular posts. It's been observed by quite a few people that every post near the top of the frontpage or /r/all seems to drift towards showing ""55% like it"" due to the vote-fuzzing, which gives the false impression of reddit being an extremely negative site. As part of hiding the specific up/down numbers, we've also decided to start showing much more accurate percentages here, and at the time of me writing this, the top post on the front page has gone from showing ""57% like it"" to ""96% like it"", which is much closer to reality.

(Edit: since people seem confused, the ""% like it"" is only on *submissions*, as it always has been.)

As one other change to go along with this, /u/umbrae recently rolled out a much improved version of the ""controversial"" sorting method. You should see the new algorithm in effect in threads and sorts within the past week. Older sorts (like ""all time"") may be out of date while we work to update old data. Many of you are probably accustomed to ignoring that sorting method since the previous version was almost completely useless, but please give the new version another shot. It's available for use with submissions as a tab (next to ""new"", ""hot"", ""top""), and in the ""sorted by"" dropdown on comments pages as well.

This change may also have some unexpected side-effects on third-party extensions/apps/etc. that display or otherwise use the specific up/down numbers. We've tried to take various precautions to make the transition smoother, but please let us know if you notice anything going horribly wrong due to it.

I realize that this probably feels like a very major change to the site to many of you, but since the data was actually misleading (or outright false in many cases), the usefulness of being able to see it was actually mostly an illusion. Please give it a chance for a few days and see if things ""feel"" better without being able to see the specific up/down counts."
21,"I'm Pieter Hintjens, and I'm here to discuss psychopaths and other stuff, AMA!",<praw.models.comment_forest.CommentForest object at 0x7fcfb196f0b8>,pieterh,0,767,0,False,IAmA,,1459016298.0,4c27ss,"**My short bio:** I'm a programmer and author of a few different books. My last book, [The Psychopath Code](http://thepsychopathcode.com), explains psychopaths. I've tried to keep it pragmatic and clean: what makes a person a psychopath, how this works, and how to deal with it (for the rest of us). The book is a handbook, not a medical text. Oh, and I just [rage-quit Twitter](http://hintjens.com/blog:114).

OK, thanks for the questions, it's been a fun many hours. For those who hate me for writing the book, shrug, have a nice day anyhow!

**My Proof:** http://hintjens.com/ (with link back to this IAmA)"
