,title,comments,author,guilded,num_comments,score,pinned,subreddit,author_flair_text,created_utc,r_id,body
86,"Science AMA Series: I’m Laura Salazar, associate professor of health promotion and behavior at the School of Public Health at Georgia State University. I’m developing web-based approaches to preventing sexual assaults on college campuses. AMA!",<praw.models.comment_forest.CommentForest object at 0x7fcfb48a3358>,Prof_Laura_Salazar,0,302,0,False,science,Professor of Health Promotion |Georgia State,1446724618.0,3rmapx,"Hi, Reddit. I'm Laura Salazar, associate professor of health promotion and behavior  at the [School of Public Health](http://publichealth.gsu.edu/) at Georgia State University.

I have developed a web-based training program targeted at college-aged men that has been found to be effective in reducing sexual assaults and increasing the potential for bystanders to intervene and prevent such attacks. I’m also working on a version aimed at college-aged women. I research the factors that lead to sexual violence on campuses and science-based efforts to address this widespread problem. I also research efforts to improve the sexual health of adolescents and adults, who are at heightened risk for sexually transmitted infections and HIV. 

[Here is an article for more information](http://publichealth.gsu.edu/2014/09/15/web-based-training-can-reduce-campus-rape/)

I’m signing off. Thank you all for your questions and comments."
87,"I’m Zoë Quinn, the indie game developer behind the Chuck Tingle game, Depression Quest, and a whole mess of other stuff. AMA!",<praw.models.comment_forest.CommentForest object at 0x7fcfb1e47c88>,zoequinn,0,1082,86,False,IAmA,,1478547871.0,5bobt6,"I'm Zoë Quinn. I'm primarily an indie game developer [currently working
on adapting niche amazon erotica darling Chuck Tingle's work into a
full motion video game with gyrating unicorn men that is currently on
Kickstarter](https://www.kickstarter.com/projects/703752115/kickstarted-in-the-butt-a-chuck-tingle-digital-adv?ref=user_menu), but I've also done various roles on games like Framed,
Fez, They Bleed Pixels, Read Only Memories, and Jazzpunk.
Additionally, I make a [lot other stuff](http://www.unburntwitch.com) like tiny comedy games like [Waiting For
Godot: The Game](http://www.unburntwitch.com/godot.html), tell weird jokes on twitter, mess around with
biohacking, and write books - my memoir will be out next year and is
being turned into a movie by Pascal Pictures. I most recently worked on the expansion for [Betrayal At House On The Hill: Widows Walk](https://www.amazon.com/Betrayal-House-Hill-Widows-Board/dp/B01EOA7Y1O). I've spoken at the UN
and the House of Representatives about online abuse after I became
someone that the internet had extremely strong opinions about, but
that subject has been talked to death at this point, especially compared to the gyrating unicorn butt cops. Let's talk!

Proof: https://twitter.com/UnburntWitch/status/794642310780764161

Edit: Thanks to all who participated and asked good questions (even some of the challenging ones that got downvoted that I tried to answer anyway if they seemed legit!) Be good to each other and PROVE LOVE IS REAL!! I need to go back to the Sexy Vampire Night Bus Mines and hope to create cool stuff that leaves you with even more questions. Bye for now!"
88,How we decided to announce we were expecting.,<praw.models.comment_forest.CommentForest object at 0x7fcfb72f6cc0>,jesfunshinebear,0,767,796,False,funny,,1398903726.0,24ey4l,
89,Joan Rivers,<praw.models.comment_forest.CommentForest object at 0x7fcfb4f25e48>,oakes_smnth,0,737,829,False,funny,,1391402016.0,1wv7v7,
90,"'Jews, Out of France!' Around 17000 March in Paris Chanting Anti-Semitic Slurs",<praw.models.comment_forest.CommentForest object at 0x7fcfb8539828>,official_TASKER,0,1389,414,False,worldnews,,1391058969.0,1wj89m,
91,Pokénatomy,<praw.models.comment_forest.CommentForest object at 0x7fcfb4f20f28>,Venau,0,111,50,False,gaming,,1465141674.0,4mny2f,
92,Selena Gomez,<praw.models.comment_forest.CommentForest object at 0x7fcfae89d208>,wxnderwall,0,328,729,False,funny,,1392742427.0,1y95ck,
93,Ladies: What non-sexual thing can make you want to bang a guy?,<praw.models.comment_forest.CommentForest object at 0x7fcfb0a62c18>,,0,1182,39,False,AskReddit,,1435229212.0,3b25v5,
94,What is happening in this subreddit?,<praw.models.comment_forest.CommentForest object at 0x7fcfb0a62c88>,tnvb,0,394,3,False,apple,,1477745038.0,5a09xt,"I am fairly used to the overbearing amount of troll negativity on this thread, but since this August 27^th event, it has been just stupid. The first day after, I scrolled down the entire first page of submissions, and not one substantive or even neutral submission could be found. I think that's pretty sad, because hate or love what they did, it certainly warrants an interesting discussion. 

Here are some of the genius points that made it to the top of the heap: 

* **I cannot plug my iPhone 7 into my new MBP:** That is as relevant as saying I cannot put my diskette into my electric shaver. That is neither mind boggling nor weird. The last phone that needed to be plugged into a computer was the iPhone 3G.

* **Apple priced me out, I am switching to Microsoft and getting a Surface Studio:** Never mind that Apple was always on the upper end of expensive, this one is truly mind numbing. First, inflation adjusted this is far from the most expensive MBP Apple has offered, but that is not even scratching the surface. The cost of ownership of Apple laptops has been shown over and over to be very competitive. Lower maintenance costs, high life expectancy and high residual values actually have made Apple laptops often cheaper than much of the competition during the time of ownership. And just as a side comment, the Surface Studio is more expensive than a MacPro, like twice as expensive than a 5K iMac and makes the new MBP look like Apple priced it to compete with the Raspberry Pi. 

* **Touch Bar is like the most gimmicky thing ever:** These must be the same people that complain about touchscreen phones. I mean it is just astounding that in 2016 people violently defend the notion of static function keys over an intelligently adaptable, multi touch screen. When I type a Zip code on my iPhone, I am glad when I get the NumPad keyboard and **NOT** the QWERTY, and on the flip side, I still get mad when I have to type in my credit card number and get the QWERTY keyboard. It's annoying. That is why digital keyboards on smartphones are genius. Smartphones can display the appropriate keyboard for the task! That makes sense and very shortly after 2007 has become the universal standard. If you want to go back to a BlackBerry Pearl (not a bad phone, by the way) you can, but I like multi-touch screens with adaptable software that uses the bottom 50% of my phone more intelligently than simply having static, plastic keys like in an old ass BlackBerry that can never change, and never adapt to anything. This is no different with TouchBar. Sure, typing is better on a physical keyboard, at least until haptic feedback is a little more advanced, but the function keys are surely an obvious place to start reclaiming a lot of real estate and making it smarter. It's not quite like reclaiming the bottom 50% of BlackBerries back in the day, but that is still a large strip of computer that is now inarguably superiorly used. You can still have the TouchBar mimic your old, static function keys, but to also make it this totally adaptable interface for the software you are using is actually really smart and the demos only showed a first attempt of what developers could do with it. This technology will absolutely make life easier and better. 

* **Nothing in Apple integrates anymore, nothing just works:** The usual example cited is that you need a dongle for something. I mean in a time when I can start writing an email on my iMac, continue on my iPad when going to the bathroom thanks to continuity, copy a relevant picture I find on my iPad, paste it back into the email on my iMac after my defecation without skipping a beat and in the meanwhile iCloud has synched every file, every contact, every Wifi password, every other password, my calendars, to-do lists, photos, videos, music, and made freakish backups of all of my devices that even restore the very website I was on to find that picture while pooping with my iPad should I have accidentally dropped the iPad into the toilette and destroyed it, requiring a new purchase, the statement that nothing works together in the Apple ecosystem anymore is just wonderful. 

There, I put into a million words what I have been thinking about this subreddit for a while now. Not sure what I tried to accomplish, but I feel better."
95,This is how the star quarter back and the half back came out on the last day of school in Alabama. So proud of them!,<praw.models.comment_forest.CommentForest object at 0x7fcfb161fb38>,,0,168,240,False,pics,,1431619260.0,35yi3l,
96,"Real WW1 footage: A rare video of a real front line clash, British Soldiers advancing from the right and German Soldiers from the left.",<praw.models.comment_forest.CommentForest object at 0x7fcfb160cda0>,LeWhisp,0,107,82,False,videos,,1431438128.0,35pkaz,
97,Stripper transformation - Before and After,<praw.models.comment_forest.CommentForest object at 0x7fcfb4f07ba8>,Dannydreadd,0,302,692,False,pics,,1393419631.0,1yzhmn,
98,Possibly the greatest selfie ever taken...,<praw.models.comment_forest.CommentForest object at 0x7fcfb4e909e8>,RyanCast1,0,1185,1096,False,pics,,1393628691.0,1z7x0s,
99,Justice,<praw.models.comment_forest.CommentForest object at 0x7fcfae6f5f28>,UFCWWF,0,63,0,False,pics,,1406566011.0,2byi1e,
