,title,comments,author,guilded,num_comments,score,pinned,subreddit,author_flair_text,created_utc,r_id,body
0,Seeking Additional Moderators!,<praw.models.comment_forest.CommentForest object at 0x7fcfb16ac898>,wedditmoderator,0,18,19,False,weddingplanning,,1535636125.0,9bjo63,"Hello,

/r/weddingplanning is in need of a few additional moderators. 

If interested, please respond to this post with answers to the following questions. This post will remain up through Friday, September 7th, with our goal being to announce new moderators by mid-month. Thank you.

**Questionnaire:**

How long have you been a part of this community?

What hours of the day are you most active on reddit? (please specify your timezone)

What changes, if any, would you make to the rules/sidebar?

How do you think you could improve the community?

Have you ever been, or are you currently, a moderator of a subreddit? Which ones?

What is your current relationship to the wedding planning community (still planning a wedding, a vendor, a maid of honor, recently married, etc.)?

"
1,"Daily Discussion Chat - September 05, 2018",<praw.models.comment_forest.CommentForest object at 0x7fcfb278bcc0>,AutoModerator,0,10,2,False,weddingplanning,,1536109802.0,9d1ltk,"Discuss anything on your mind with your fellow wedditors. Feel free to ask questions or submit topics for discussion here that may not call for an individual thread.

Don't forget to check out the latest weekly [Hashtag thread](https://www.reddit.com/r/weddingplanning/search?q=title%3Ahashtag+author%3Aautomoderator&restrict_sr=on&sort=new&t=week), the latest [Engagement Ring thread](https://www.reddit.com/r/weddingplanning/search?q=title%3Aengagement+sunday+author%3Aautomoderator&restrict_sr=on&sort=new&t=week) and this months [Check In thread](https://www.reddit.com/r/weddingplanning/search?q=title%3Amonth+to+month&restrict_sr=on&sort=new&t=week)""
"
2,We did the thing!💕 8.18.18,<praw.models.comment_forest.CommentForest object at 0x7fcfb67e8ac8>,peachieole,0,44,1643,False,weddingplanning,,1536094184.0,9czl4j,
3,Can't stop staring at our photos!,<praw.models.comment_forest.CommentForest object at 0x7fcfb12dbf98>,Kene92376,0,9,143,False,weddingplanning,,1536109174.0,9d1j0z,
4,I married the love of my life. So glad my bride could rock climb in her dress!,<praw.models.comment_forest.CommentForest object at 0x7fcfb67e70f0>,iamnotsam0428,0,5,113,False,weddingplanning,,1536099619.0,9d0c2g,
5,We had a rooftop brunch wedding and it was perfect (9/1),<praw.models.comment_forest.CommentForest object at 0x7fcfb12dbeb8>,mikuooeeoo,0,17,241,False,weddingplanning,9/1/18 ♥️ WI,1536081563.0,9cxqau,
6,Instead of a flower girl we had a bubbles girl! Best decision ever!,<praw.models.comment_forest.CommentForest object at 0x7fcfae941160>,unibarbcorn,0,7,190,False,weddingplanning,,1536085680.0,9cycrf,
7,We did it!!! September 2nd 2018!,<praw.models.comment_forest.CommentForest object at 0x7fcfb7fd8f28>,anaestaaqui,0,7,594,False,weddingplanning, 09.02.18 Southern OH,1536063020.0,9cv0m7,
8,"Wedding tip: Always check Craigslist/Facebook marketplace while your wedding planning. I found a $12,000 dress for $1200. Pc: cedricsphotography",<praw.models.comment_forest.CommentForest object at 0x7fcfb22cc7f0>,60SecondBoost,0,5,90,False,weddingplanning,,1536100279.0,9d0f4f,
9,I decided to use magnolia leaves as place cards and do the hand lettering myself. I’m really happy with how they turned out!,<praw.models.comment_forest.CommentForest object at 0x7fcfb8834d68>,alyssa-marie-,0,16,70,False,weddingplanning,,1536102358.0,9d0oma,
10,Yesterday he asked me if I'll be his otter half,<praw.models.comment_forest.CommentForest object at 0x7fcfb67e7ac8>,thecakewasintears,0,12,98,False,weddingplanning,,1536096152.0,9czv79,
11,I already shared a picture of me and hubby. But I wanted to share my girls because they were knockouts!,<praw.models.comment_forest.CommentForest object at 0x7fcfb88347b8>,Khal_Froyo,0,2,40,False,weddingplanning,,1536110763.0,9d1pzx,
12,"My custom engagement ring is finally done! It's definitely a little different, but I'm in love.",<praw.models.comment_forest.CommentForest object at 0x7fcfb8835b00>,testcasebeta,0,8,179,False,weddingplanning,,1536078116.0,9cx5ub,
13,"Next to the day we met, Saturday was the best day of my life.",<praw.models.comment_forest.CommentForest object at 0x7fcfaea84fd0>,ParticularPickle,0,2,102,False,weddingplanning,,1536087042.0,9cyjun,
14,"PSA: I got married on Saturday and we had no florals, minimum DYI and threw out a lot of tradition. Was still amazing.",<praw.models.comment_forest.CommentForest object at 0x7fcfb8802c50>,sweetoldetc,0,8,95,False,weddingplanning,1 September 2018 | Berlin,1536086601.0,9cyhlm,"I just wanted to say this because I know there are a lot of brides like me who wondered if they could skip elements like this and still hold a wedding that people enjoy / think was worth attending.

We said from the beginning that the most important thing to us was to throw an awesome party. So we focused our money on making sure people would be fed and plied with drinks, that the music would be great, and that we had a venue that would provide a good setting for a party.

I had no bouquet (and thus no bouquet toss). No flowers anywhere at the ceremony site or in the reception venue. We let his mom handle table decorations, which were pretty simple (but pretty!). We had no guest book, and did almost no DIY (basically just favors and name cards) and let the existing venue decorations dominate the setting. We didn't have any reception games (despite this being something heavily expected by his side of the family, as for them weddings are about the entertainment). 

And the end result was that we had a fucking blast, and so many of our friends and family did, too. The reception went from 6 pm to 2 am and it wasn't dull for a single second. In the days since our wedding on Saturday, my favorite thing has been hearing stories about who everyone talked to and what previously non-existant connections were made between people from different parts of our lives (like my parents finally getting to meet my husband's incredible friend circle or my US-based friends finally getting to meet my German-based friends). Our goal for this wedding was to surround ourselves with the people who loved us and whom we loved back, and give them a night to finally meet each other and socialize with us over food, drinks and music. And we achieved this goal a thousand times over.

I'll post a more thorough recap somewhere down the line, but for now, I just want to let those of you who are feeling similarly to how I was: if you don't want to care about things like flowers or centerpieces or making the perfect guest book, or anything else - you don't have to. I skipped so much, and I don't regret a single thing.

Anyway here's a bonus picture of us with an alpaca we ran into at the zoo where we held our ceremony: http://imgur.com/En8jplx"
15,Glam Shot ✨,<praw.models.comment_forest.CommentForest object at 0x7fcfb102ffd0>,ihavediabeetus,0,0,22,False,weddingplanning,"June 22nd, 2018 | Toronto",1536115153.0,9d29ex,
16,Will never stop admiring this ring,<praw.models.comment_forest.CommentForest object at 0x7fcfb102e390>,cheflaney,0,2,31,False,weddingplanning,,1536106880.0,9d1923,
17,Sneak peek from our perfect day! Recap to come after the honeymoon.,<praw.models.comment_forest.CommentForest object at 0x7fcfb0ffec50>,sdm4242,0,4,120,False,weddingplanning,"09.01.18 in Columbus, OH",1536078484.0,9cx80z,
18,Asking the bridal party to cover wedding expenses...,<praw.models.comment_forest.CommentForest object at 0x7fcfae9aa0f0>,SteelCityRunner,0,7,18,False,weddingplanning,9.23.16 | Raleigh NC | Wonderland,1536114792.0,9d27om,"A few weeks ago, the bride sent an email to the entire bridal party stating that they had secured two houses for the bridal party and their SO's for the wedding weekend, and sent an associated cost per couple. I happily paid assuming that the cost covered the price of the rental. The bride also mentioned that she and the groom would be providing alcohol, snacks, and transportation. Great! Sounds reasonable.

Well, shortly thereafter, we come to find out that the houses were a gift, and provided to the couple free of charge. Which basically means that the bridal party is covering all of the alcohol, snacks, and transportation, and also providing an enormous amount of extra money to the bride and groom. Without our consent or knowledge. 

I am so hurt and upset that after spending so much time and effort and money into hosting an engagement party, bridal shower, and bachelorette party, I'm also now covering expenses that I never agreed to because the free house was kept secret. 

Is this normal? Am I crazy for being furious? What would you do? "
19,I found my dress!,<praw.models.comment_forest.CommentForest object at 0x7fcfb27aaf98>,notsouth,0,8,49,False,weddingplanning,,1536094591.0,9czn41,
20,"I'm a guy trying to plan a wedding. I found this sub last week, and the only front page posts I get are pictures of dresses and rings. Am I in the wrong sub? Is there a sub for planning a wedding?",<praw.models.comment_forest.CommentForest object at 0x7fcfb102f6a0>,BCB75,0,32,66,False,weddingplanning,,1536088242.0,9cyq7e,
21,New to this sub (wish I knew about it earlier!) finishing up alterations and super excited about how my dress turned out!,<praw.models.comment_forest.CommentForest object at 0x7fcfb67bdeb8>,charleswhatnow1999,0,7,236,False,weddingplanning,,1536060072.0,9cup8x,
22,Thank you Weddit for this beautiful suggestion on what to do with cards!,<praw.models.comment_forest.CommentForest object at 0x7fcfb3695f98>,kbdrwhosher,0,0,17,False,weddingplanning,11.3.18 MO,1536110110.0,9d1n51,
23,"First fitting! Long time lurker, 1st time posting. Dress is Allure Bridal style 9502. I’m getting married October 20th in Detroit, MI at the Belle Isle Boat House to my honey and i can’t wait 😊",<praw.models.comment_forest.CommentForest object at 0x7fcfb67bd208>,naba_yo,0,12,104,False,weddingplanning,,1536075699.0,9cwrnk,
24,Got married Sunday and literally felt like a princess with this hair 😍,<praw.models.comment_forest.CommentForest object at 0x7fcfb3695fd0>,soontobien,0,6,197,False,weddingplanning,9.2.18 | Northeast Historic Garden,1536062515.0,9cuyjq,
25,8.11.18 the perfect day! I wish I had an excuse to wear my dress again!,<praw.models.comment_forest.CommentForest object at 0x7fcfb67bde80>,Pippopotamus,0,4,55,False,weddingplanning,,1536084558.0,9cy6zr,
26,Not at all what I expected to choose!,<praw.models.comment_forest.CommentForest object at 0x7fcfb278ba58>,timbertins,0,73,1689,False,weddingplanning,,1536017872.0,9cqdqq,
27,Found the dress of my little goth dreams! Does anyone have alterations advice?,<praw.models.comment_forest.CommentForest object at 0x7fcfb67bee48>,Redrrosa,0,3,11,False,weddingplanning,,1536114130.0,9d24u1,
28,Shout out to my FH who made these signs himself for our wedding! 😍,<praw.models.comment_forest.CommentForest object at 0x7fcfaea88f28>,sophtsocks,0,2,95,False,weddingplanning,,1536072760.0,9cwbl4,
29,Disappointed and confused about my bridal shower.,<praw.models.comment_forest.CommentForest object at 0x7fcfb2368da0>,bridalshowersadness,0,47,61,False,weddingplanning,,1536080473.0,9cxjt5,"throwaway so that I don't taint my main wedding account with this hurt and negativity. I know I might get some flack for this but I have to let it out to someone besides FH and my sister. TL;DR at the bottom.

&#x200B;

For reference we are all late 20's - early/mid 30's aged.

&#x200B;

On Saturday my sister (MOH) threw us a bridal shower. Since neither I nor FH have a ton of female family in the area, we decided to do a co-ed couples shower instead. My sister (and entire family) did an amazing job, everything was so well planned and looked amazing, there was SO much food, it was nice for our families to finally meet our friends and vice versa. I'm so incredibly thankful for everything our families did and have done, we totally felt their support and they were our rock the whole day.

&#x200B;

Our friends, not so much. 

&#x200B;

My sister asked different bridesmaids and groomsmen to bring different things, instead of having everyone chip in monetarily or split the cost of the party. She (IMO) very much undershot what she could have asked people to bring, and instead opted to make it easier on them by having them bring smaller (but still important) items. A card game we all love from one bridesmaid, two bouquets of simple grocery store flowers from another, a case of beer from each of the guys, small amounts of ice. 

&#x200B;

The best man, my FH's best friend in the whole world for almost 10 years, brought a medium-sized (like an 18 pack) case of the absolute cheapest beer you can buy. When we play beer pong we don't even use this beer - I had never drank it before, I never thought it was even on any of our friends' radar. And no we aren't talking Coors or PBR, think Naty Ice or Steele Reserve. He was the first of the groomsmen to arrive so for a while we only had that beer (plus wine and other drinks) for a while, and I was so embarrassed offering those to our other guests as they arrived. 

This happened quite a few times:

""Hey bridalshowersadness, is there beer?""

""Yes! It's in the cooler on the patio!""

""Oh, the \[cheap beer that most of us have never drank before in our lives\]?""  
""Yeah I think that's all there is at the moment, sorry!""

No one said anything about it of course, and I'm thankful that he did help us out by bringing drinks, it's just hard for it not to feel.... passive aggressive? Why now, of all times, bring this worst brand of beer, when he knew that he was going to be meeting some of our family for the first time, he knew this was our once-in-a-lifetime bridal shower not just a random summer potluck, and he had heard how much effort my sis was putting into this? He's brought over larger amounts of better beer for a regular old movie night. He makes good money and has a lot of disposable income so it's not a money issue. And like I said, I wasn't expecting him to bring a keg of the highest percentage craft IPA - even the same amount (although I don't get why you wouldn't bring a 36 pack if you're bringing the cheapest beer....) of Miller Highlife or Budweiser would have been totally fine. 

&#x200B;

There were also TEN no-shows, of people that had been saying how excited they were to go up until a few days before. One friend even messaged me on instagram last Thursday to confirm this was a shower and not just a party. Then he just doesn't show up. So he checked to make sure this is an important life event and not just a Labor Day BBQ, and he still flaked. 

&#x200B;

The worst part, and this is the brattiest part that I feel the worst about being upset over, is that we received three gifts out of almost 30 guests, and one of them was from my mom. Literally none of our bridal party brought a gift or card. I expected a few people to show up without, as a few are more immature for their age, but almost everyone? Numerous of the guests are married, have been married, or have thrown bridal showers themselves. We've given bridal and baby shower gifts for many of them within the past few years. They should have known - they MUST have known? Our registry info was on the invitation, clear as day. We have gifts as low as $3 on our registry. A signed card with no other gift inside would have been great!

&#x200B;

My mom and FMIL really wanted us to open gifts in front of everyone like a traditional shower, and now I'm so, so glad we didn't set time aside from that. That would have been humiliating. 

&#x200B;

I totally understand if you don't believe me, but I swear I am NOT a materialistic person AT ALL. Sure I was excited at the thought of getting new things for our home, but the party itself IS what I was excited for. I actually had an amazing time at the party and wasn't upset at all until after everyone left; my sister told us to open our presents and relax, and there were only three sitting there. Even then I was like ""oh, weird"" and it wasn't until we were driving home that it hit me how little I felt cared for. Sure, the people who love us most showed up for us, celebrated with us, ate and drank. That is nice, it makes my heart happy. But it just feels like we aren't deserving of the same effort and courtesy that other people receive. Like we're more than good enough to plan parties for other people, and give them thoughtful gifts, and be there to listen to all of their problems, and help them move and give them rides. But we aren't good enough to have those people throw us a semi-traditional event before a huge milestone in our lives. 

&#x200B;

These are people we've known for years and years. If it wasn't a BBQ with alcohol, but a more standard ""stuffy"" bridal shower, I wonder if any of them would have even come at all. It's the lack of effort that hurts, not the amount of physical things we can hold. I feel like everyone was excited at the thought of me throwing a party (I used to throw huge, fun themed parties before we moved into a smaller place) and didn't even think about the reason FOR the party.

&#x200B;

Thank you for letting me vent you guys. I really do know that gifts are optional and not a requirement, etc etc etc. I swear I do. I just feel so weird because I can't even vent to my best friends and bridal party about this, so I'm very thankful to have this community. Hopefully you can understand the odd feeling of being so appreciative and so hurt at the same time. It's confusing and shocking and I feel so stupid for even making a registry or for getting so excited for the party. Which then makes me feel terrible cause my sis and family did such a great job. I'll get over this in a few days, but for now it still stings. 

&#x200B;

For the people who were no shows: I'm thinking about calming down a bit more, and then revisiting the wedding guest list in a few weeks. These are people we considered close friends, who all found something better to do this weekend (and no, none of them had emergencies or anything that came up. They posted on instagram while they drank at local restaurants during the shower.) Thoughts?

&#x200B;

TL;DR: We received almost no gifts at our shower and we feel unloved by our guests' lack of effort. Now I'm feeling confused, hurt and embarrassed, and unsure where to go from here.

&#x200B;

&#x200B;"
30,Am I glitching or did this sub remove the downvote button?,<praw.models.comment_forest.CommentForest object at 0x7fcfb236fdd8>,Jinxwinks,0,15,94,False,weddingplanning,Oct 1 2018 - Monterey CA,1536072461.0,9cw9w2,"It’s not like I love downvoting, but it seems.. odd. "
31,I’m so glad I found my perfect tea length dress!,<praw.models.comment_forest.CommentForest object at 0x7fcfae90a2b0>,CharisAnthos,0,4,46,False,weddingplanning,11/11/18 ,1536084566.0,9cy71i,
32,Stunning Catholic Chapel we found for Mexico Wedding!,<praw.models.comment_forest.CommentForest object at 0x7fcfb23668d0>,destinationshd,0,2,10,False,weddingplanning,,1536113101.0,9d203d,
33,Married 8.18.18 & still dress obsessed,<praw.models.comment_forest.CommentForest object at 0x7fcfae904c88>,bananahammock9,0,4,137,False,weddingplanning,,1536061310.0,9cutwl,
34,No longer a bridesmaid... I'm a bride!,<praw.models.comment_forest.CommentForest object at 0x7fcfae92cc50>,atom91190,0,1,71,False,weddingplanning,,1536071844.0,9cw6kl,
35,When you can’t walk in heels but want to be tall at your wedding: Nine West Nina 😍 (ft. Birkenstocks),<praw.models.comment_forest.CommentForest object at 0x7fcfb236f710>,Yosemitayyy,0,6,13,False,weddingplanning,July 2019 | NorCal,1536106760.0,9d18he,
36,No longer just a lurker!! Engaged on 08/31 😁💍❤️,<praw.models.comment_forest.CommentForest object at 0x7fcfaea860b8>,elyseonlife3,0,8,131,False,weddingplanning,,1536059340.0,9cumld,
37,Need suggestions for shoes and hair to go with my wedding dress!,<praw.models.comment_forest.CommentForest object at 0x7fcfb67e77b8>,cecilyhughs,0,2,8,False,weddingplanning,,1536112789.0,9d1yq7,
38,I debated for a while but kept coming back to this dress. On Friday I pulled the trigger and said YES to this beautiful BHLDN dress!,<praw.models.comment_forest.CommentForest object at 0x7fcfb236f9b0>,forensikat,0,16,39,False,weddingplanning,"6.29.19 ♥ Boston, MA",1536078829.0,9cxa27,
39,Guest Perspective: Casino,<praw.models.comment_forest.CommentForest object at 0x7fcfaea86048>,ELA7thgrade,0,9,26,False,weddingplanning,,1536086751.0,9cyic5,"This might be a little confusing, but the background information impacted my guest experience. I had met the bride once at a party, never met the groom. My FH went to high school with both, and was good friends with the bride for years. So when she messaged me asking for our address, I was really excited! A few weeks pass and we recieved a STD addressed only to our roomates, A & D, who are also friends with the bride (neither have met the groom either). So we were confused, as the bride specifically reached out to me for our address. We waited for the invited to see what the final decision was. Our roommates again recieved formal invites, and we did not get anything. Three weeks later we get an invite for ""drinks and dancing"" after the reception. So our feelings were hurt because we understood we were the B list. I understand that the bride was in a hard position because we have roommates she wanted to invite too. But I think it would have been more appropriate to reach out to the other couple instead of me for the address. In the end, with bride approval, I went with my roommate A to the ceremony & reception, and my FH and D joined us after for drinks and dancing (they had a prior commiment). 

&#x200B;

Overall, it was a cute wedding. The couple looked very happy, their love was obvious! So more of a breakdown: 

**Ceremony:**

* It was at a casino, so we had to drive a bit to find a parking spot. We also weren't sure what door would be the best to enter so we just guessed and then followed signs once we were inside. 
* Once we found the correct event room, we had no idea what to do. Bridal part were walking in and out, some people were sitting inside, some outside the room. We decided to go get a drink to kill time. Once we got back we talked with a few other friends outside the room. There was a miscommunication as to if drinks were allowed in or not. We were told to finish ours before entering. Yet once we went in, about half the people in there had drinks. Very confusing. 
* The room was a standard event center room. They put up curtains behind them in their bridal colors and some string lights. 
* Chairs were comfortable and spaced well. Didn't feel cramped or too close to the person next to me. 
* The music didn't have the fade out, so noticeable silence as we waited and during the processional. 
* Ceremony was sweet. A lot of puns/metaphors which the couple seemed to enjoy. They had a sand unity ceremony. The vows were the repeat after me, but sounded like they still incorperated their own ideas into. It didn't sound like ones I've heard before. 
* Recieving line was right at the end of the aisle. Ushers dismissed by rows. It look a while because it was a large wedding. Bride told us later that 240 invited. 

**Reception:** 

* After the recieving line, we were ushered into the connected room where the reception was. 
* We didn't know if, or how long, the cocktail hour was. There was no seating chart/table assignments. No signs for what was available at the bar, or cost. Literally no signs. Please have something, as 240 is a large group of people who need directions. Maybe a smaller wedding could have done without. Or have someone announce information. 
* Buffet dinner was good, normal spread of chicken, prime rib, potatoes, salad, and bread rolls. The prime rib had a sauce next to it that didn't have a sign, people were guessing if it was anything from gravy to pudding. Turns out it was a horseraddish sauce. Please have a sign. 
   * Another hiccup - the person responsible for releasing tables for the buffet was late. And then she released us in a strange order. Our table was skipped/missed. We flagged down another worker and he said we should just get in line. Half of our table did, half stayed. The other half tired to join the line a few minutes later and the table-release woman yelled at them to sit back down until released. Once she was far enough away (on the other side of the dance floor) they got up and got in line. We felt bad but every table within 3 rows already had food. We were starving and buzzed. 
* Speeches were lovely, heartfelt, and hilarious. MOH and best man were only bridal party members who gave speeches. MOG and FOB gave quick 30 second thank you speeches. 
* Dances were next - a little delay as the bridal party scattered after speeches. Took a few mins to round them all up again. Dances were cute, the couple sang the song to each other. They laughed and it was very sweet! Father/daughter dance was to the impeial march, it was so cool! 
* They did the dollar dance and then opened up the dance floor for everyone. 
* They did the garter belt, bouquet toss, and something I had never seen before: a literal ball and chain attached to the groom and they auctioned off the key. I don't know if that is a thing, I've never seen it. Maybe a family tradition? 

**Overall:** The wedding was sweet, and you could really tell how excited the bride and groom were to marry each other. My biggest issue was the lack of communication - we didn't know what, where, when anything was. "
