,title,comments,author,guilded,num_comments,score,pinned,subreddit,author_flair_text,created_utc,r_id,body
40,I am so damn short and not looking forward to go dress shopping.,<praw.models.comment_forest.CommentForest object at 0x7fcfb366d080>,marichipini,0,22,14,False,weddingplanning,,1536095101.0,9czptc,"I am 151cm (4′ 11"") and 26 years old. I am frequently told that I look ""young"" (as in I look like a high schooler...) even though I try so hard to look older, or at least my age.. My height has been commented on my whole life by pretty much everyone. Anyways, I am planning on going shopping for my wedding dress this month and I am dreading it so so much. I just feel like everything will look horrible on me. Just big and long. It makes me so insecure. And I get angry at myself for having these thoughts because dress shopping is supposed to be fun and you know... I hate that I still feel insecure about my height. I feel like I should just accept myself. My MoH told me that the dress I pick will be tailored to me, so it will look amazing and that I shouldn't worry. Well, I will always look short next to anyone else so... I am sorry guys, I'm just frustrated that I feel this way. Anyone else scared of trying on dresses for the first time?"
41,Invites mailed on time!,<praw.models.comment_forest.CommentForest object at 0x7fcfb3659e10>,Babblingsquirrel,0,0,24,False,weddingplanning,"11.3.18 | Blanco, TX",1536085854.0,9cydoc,
42,Tiny bit of jealousy over other couples...,<praw.models.comment_forest.CommentForest object at 0x7fcfb3665940>,pretend_adulting,0,14,28,False,weddingplanning,,1536080711.0,9cxlb6,"I never ever ever ever would have expected to feel this way. My brother got married recently and I was sooooo happy for him. I'm getting married soon and it's honestly been really fun getting to know his fiance better and being able to bounce ideas off someone. She's wonderful :) So, this isn't about that.

They are the type of couple that are attached at the hip, always together, always having fun. The hashtag was created for them. My fiance and I are are much more independent. We trust and support each other 100% and we give each other a lot of freedom when it comes to event obligations. (You don't want to go to my cousins party? that's cool, I don't really want to go to your uncles housewarming.)

Anyway, my brother and his fiance just looked SO IN LOVE. Also because they are always together the families are super close. My parents and her parents have become friends. It's just so nice. And you could just feel it in the room. And the wedding was PERFECT.

I just felt myself getting kinda jealous. And a little freaked out that I'm not going to be able to help comparing their wedding to ours. Just need some reassurance on the day of none of this will matter :)"
43,My wedding is four weeks away. My Mom was just diagnosed with breast cancer and needs to start chemo ASAP. My heart is broken.,<praw.models.comment_forest.CommentForest object at 0x7fcfae91c978>,tipsyandfierce,0,2,4,False,weddingplanning,,1536117651.0,9d2kta,"I debated posting this to this sub but I feel like other brides-to-be can understand the momentum of the wedding being so close and then receiving such heartbreaking news. I just want my mom to feel like herself, feel beautiful and be able to enjoy the wedding. The doctor said they can try to time the chemo so her hair won’t be falling out yet and she won’t feel sick yet but I’m just so heartbroken that this is happening right now. After all the planning and thought and effort, there is a cloud hanging over me that my mom is not well. She is taking it so well so far but I just don’t know what to do or how to feel like it’s going to be okay."
44,"I should’ve expected it from all the posts here - I got exactly what I wasn’t expecting, but I feel like a princess!",<praw.models.comment_forest.CommentForest object at 0x7fcfb3667b70>,Baxter_YourChinaDoll,0,5,19,False,weddingplanning,"08/17/2019 | Madison, WI",1536083397.0,9cy0jf,
45,Engagement Party Etiquette,<praw.models.comment_forest.CommentForest object at 0x7fcfb3667358>,ChickenLovesCat,0,5,4,False,weddingplanning,,1536111113.0,9d1rig,"So my parents would love to throw FH and I an engagement party at their home. We are having a smallish (70 person) wedding, and in an ideal world, I would love the engagement party to be a chance to celebrate with people we can't invite to the wedding (family friends, friends of my parents I am not super close with, etc). 

Is there a polite way to do this? The last thing I want is for it to feel like a money grab. Perhaps if the invite came from my parents and included something that said ""no gifts""?

Is there a way to do this that might let people know that we can't invite them to the wedding, but it's still important that thy can celebrate with us in any way? I would hate to have to converse with someone asking me when their invite will come when they aren't on the guest list. 

&#x200B;"
46,Prop-less photo booth: yay or nay?,<praw.models.comment_forest.CommentForest object at 0x7fcfb376fa20>,opuntialantana,0,8,11,False,weddingplanning,May 2019 | ATX,1536097394.0,9d01ai,"We've been waffling back and forth on whether to have a photo booth at our wedding. I do really love that a photo booth would allow us to get more photos of our guests than we're likely to get from just our professional photographers, and I can also see how they can be a fun interactive element of a reception (especially for people who aren't into dancing). But FH and I are both pretty turned off by the standard kitschy photo booth props. They feel played out and those kinds of pictures aren't really our thing. We could maybe come up with a few fun props that suit our wedding vibes (like flower crowns or giant paper flowers since the wedding is at a wildflower center, maybe some paper cutouts of our cats) but we really don't want the usual over-sized glasses, costume hats, and feather boas. Do you think it would be lame to have a photo booth without those props or with a limited selection of not-very-kooky props? Would people still have fun with it? I need some honest opinions!"
47,Yesterday I married my best friend underneath the arbor my dad built and with a view of the mountain we both grew up together on! Everything was PERFECT! 😍🎉💗🥂,<praw.models.comment_forest.CommentForest object at 0x7fcfb376fe10>,hollyisspesh,0,8,151,False,weddingplanning,,1536043660.0,9ct6v4,
48,Finally able to post my dress!,<praw.models.comment_forest.CommentForest object at 0x7fcfaea15390>,virally_infectious,0,12,393,False,weddingplanning,September 1 Melbourne,1536024356.0,9cr6ml,
49,Would your husband change his last name?,<praw.models.comment_forest.CommentForest object at 0x7fcfaea135f8>,bayslay,0,49,9,False,weddingplanning,,1536102010.0,9d0my7,"After seeing a lot of name change posts here, I am curious. I've seen a few posts about men changing their last names, or both people changing their last names, but for heterosexual couples the majority of the time (both on Reddit and in real life) it's still just the woman changing her name after getting married.

Has/did your boyfriend/fiance/husband consider changing his last name? Did he end up doing it, or did he just consider it and ultimately decide not to? Whether it's taking your last name, hyphenating, or combining or making a new last name for for the two of you. Or was he completely opposed to changing his name at all? 

And while it seems like the majority of this sub is female, if any males here want to contribute their reasons for changing or not changing their names, feel free to.

"
50,"I’m thinking of making this my wedding day makeup! I need to add foundation and I’m doing eyelashes, but I like the simple eyeliner and red lips! Thoughts?!",<praw.models.comment_forest.CommentForest object at 0x7fcfb327df98>,sophtsocks,0,17,42,False,weddingplanning,,1536068268.0,9cvoe3,
51,So last night I really classed it up,<praw.models.comment_forest.CommentForest object at 0x7fcfaea19668>,lezdoit1331,0,19,227,False,weddingplanning,,1536032962.0,9cs5mk,
52,"Hey Weddit! This is my first post, just wanted to share with you my wedding dress.",<praw.models.comment_forest.CommentForest object at 0x7fcfb329cfd0>,KatvanG,0,35,1295,False,weddingplanning,,1535998945.0,9cnutg,
53,What did you take to the venue in your personal bag?,<praw.models.comment_forest.CommentForest object at 0x7fcfb32af0b8>,Shmallygirl,0,8,8,False,weddingplanning,,1536100735.0,9d0h65,"Ok makeup, change of shoes, jewelry, wallet, other than decorations, what did you pack in your bag to take to the venue for just you? I’m having a hard time thinking about what I will need...."
54,Has anyone ever had to ask a bridesmaid to step down?,<praw.models.comment_forest.CommentForest object at 0x7fcfb32a8898>,agoodnightssleep,0,5,3,False,weddingplanning,,1536111582.0,9d1tk9,"I think I may have to ask one of my bridesmaids to step down, but I’m not sure how to bring it up. It seems like it’ll be the most awkward situation. 

A little back story...this person has been one of my really good friends for the last 10 years, but unfortunately has struggled with alcoholism the last few years. She’s done multiple trips to rehabs and continues to relapse. When I asked her to be a bridesmaid, she had recently gotten out of rehab and actually seemed like she was going to be sober this time around and actually wanted to be. 

Fast forward 3 months later and I set up my first dress appointment. She said she was going to come to the appointment, but never shows up. I text her afterwards and she claims she forgot she had to pick up a family member at the airport. I thought this was a little weird that she wouldn’t have just texted me that she couldn’t make it anymore, but I overlooked it. 

Two weeks later, I schedule 2 more dress appointments on the same day. She was supposedly coming to both, but I didn’t expect much. She texted me right before the first one saying she had a surprise birthday lunch, but would be at the second one. She shows up late to the second appointment and is hammered. Hair and makeup all disheveled, she immediately starts crying to another bridesmaid that her and her boyfriend broke up. Then for the whole appointment, she sat in the corner and didn’t say a word. When we go to leave, I go up to her car and it wreaks of alcohol. I can’t even believe she drove that far in that condition. She can barely even talk to say bye. 

Now I’m at the point where I don’t know if it’s a good idea for her to be a bridesmaid. But how do you ask someone to step down without ruining a friendship? I brought up her being drunk at the appointment and she swore to me it was a one time relapse and she thought she could have a drink for her birthday. I don’t honestly believe this because I know how addicts lie. 

I’m just looking for any advice or if anyone else has had to do this before. Thanks in advance!

TL;DR - one of my bridesmaids is a struggling alcoholic and I think I need to ask her to step down, but don’t know how. "
55,Best picture from our first dance,<praw.models.comment_forest.CommentForest object at 0x7fcfb32a9dd8>,queencatmother,0,5,26,False,weddingplanning,,1536073189.0,9cwdvh,
56,I think I found the one!!,<praw.models.comment_forest.CommentForest object at 0x7fcfb1958c88>,lilsebastian047,0,8,358,False,weddingplanning,,1536023332.0,9cr23v,
57,Family friend asked if my fiancé is an orphan when we showed her our invitations - do I have to include my fiancé's parent's names in the formal invitation if they are not contributing to the wedding?,<praw.models.comment_forest.CommentForest object at 0x7fcfb3282f98>,youngsailor,0,16,10,False,weddingplanning,Dallas Feb. 2019,1536092688.0,9czdhy,"Formal invitation reads:
""MR. & MRS. JOHN SNOW
request the honour of your presence
at the nuptial mass of ....""

(Mr. & Mrs. John Snow being my parents).. Any reason we need to include my groom's parent's names in this? They are not contributing financially to anything for the wedding and are in no way hosting this event. They are, however, 100% hosting the rehearsal dinner. Similarly, the rehearsal dinner invitation will only have their names as they are the hosts. Is this correct etiquette? Love my family friend's parent who made this silly comment - she was mother of the groom in a recent wedding, however, contributed 20K to their affair. I understand why this would be different if we were paying for the wedding ourselves, or if both sets of parents were helping, but my parent's are paying for all of it. Thanks for any and all advice!
"
58,To have a bridal shower or not?,<praw.models.comment_forest.CommentForest object at 0x7fcfb1958ba8>,hannibal_cannibal,0,8,7,False,weddingplanning,,1536105812.0,9d142b,"Hey everyone! Im still trying to decide on whether or not to have a bridal shower and wanted to hear from y'all about your feelings on the pros/cons of bridal showers. 
All of my bridesmaids are scattered throughout the country; only 2 out of my 7 bridesmaids live in the same city as me. I feel weird asking all of my bridal party to fly down for a bridal shower in addition to flying to my city for the wedding itself and another one for the bachelorette. My MOH approached my mom about wedding shower planning and my mom already feels ""overwhelmed"" and will need help from other family members so I'm worried it'll just be a lot of hassle and don't really see the point of having a shower. Any thoughts/opinions are welcome! Thanks!"
59,Azazie mishap...,<praw.models.comment_forest.CommentForest object at 0x7fcfb193db38>,RonnyTwoShoes,0,6,4,False,weddingplanning,"October 13th, 2018!!",1536109433.0,9d1k6x,"We ordered our three bridesmaid dresses from Azazie and I ordered them two inches bigger than the girls' measurements because reviews said they come exactly to your measurements so add ease in. They are custom sizes, so they aren't returnable now that we got them and it turns out they are 2"" too big on all the girls. One of my ladies brought her dress to a tailor's (our first plan of attack) and they said it was 4 sizes too big and it would cost over $100 to tailor it down, which is more than we paid for the dress. I'm thinking we'll just have to eat the cost of the three dresses and buy new ones, since tailoring doesn't seem like our best option. Any other ideas? I'm kicking myself for buying them too big, but it was based off other people's reviews and we thought too big was better than too small... Maybe I can sell them somewhere to make back some of the costs? At least this is the first thing that's gone ""wrong"" with our wedding planning so far! \*knock on wood!!\* "
60,Rant: Guest RSVP'd for uninvited child,<praw.models.comment_forest.CommentForest object at 0x7fcfb19695c0>,weddingthrowaway1000,0,17,6,False,weddingplanning,,1536101191.0,9d0j8f,"A couple who I'm close friends with RSVP'd to my wedding, which is on Sept 22. The deadline to RSVP was Aug 15. On Sunday, they RSVP'd for their young child to attend as well. The invite was addressed to the couple only (Mr. & Mrs. X). We did online RSVPs and I guess I should have disabled that option after the deadline, but it didn't occur to me that anyone would try to do this (I guess lesson learned for anyone reading this). I only noticed it today when I checked my email and saw the reservation notification.

The only children we invited to our wedding are my brother's, because he and his wife are traveling from out of town and have two very young children they don't want to leave behind. (This couple lives in the same town as the wedding, if it matters.) No other guests are bringing children. It will not be a particularly child-friendly event (lots of alcohol and lots of wild dancing is the vibe we're going for). 

I've known this couple for a very long time and they are wonderful people. I'm so shocked that they would do something so rude (or not know that what they did is rude?) and I'm now really upset that I'm going to have to make a super awkward phone call to tell them that their child can't come. I'm worried that this could damage my relationship with these people, but I did not budget or plan for their child to attend. On the other hand, I feel like maybe I'm over-reacting due to wedding stress, because I'm so upset by this and maybe I shouldn't be. 

Am I over-reacting? Has anyone had to handle a similar situation? How did it go? "
61,Bachelorette Party Help,<praw.models.comment_forest.CommentForest object at 0x7fcfb194a828>,Velma52189,0,3,3,False,weddingplanning,,1536114657.0,9d272o,"Hey guys! Posting on mobile, so sorry for formatting. Not the bride, but MOH. The bachelorette party is next week in New Orleans. Now, I have never been to one before, neither has the bride, so that kind of helps with expectations in that she doesn't have anything to compare it to. It's a small group, just four girls total. So far I got decorations and custom shirts. I think I'm looking for advice on games to play, places in French Quarter to put on the party list, a nice restaurant to eat at. Any bachelorette party advice is appreciated!"
62,I’m going to the boutique tomorrow to officially order my wedding dress!! I’ve been thinking about it non-stop since I tried it on.,<praw.models.comment_forest.CommentForest object at 0x7fcfb67322b0>,weddingthrowaway112,0,9,285,False,weddingplanning,,1536024312.0,9cr6fk,
63,Our photographer is editing our photos and shared this very raw moment between my dad and I. 6.14.18,<praw.models.comment_forest.CommentForest object at 0x7fcfb37614e0>,Love_and_Light,0,5,310,False,weddingplanning,,1536022743.0,9cqzdw,
64,CC needed - help me with my post wedding brunch invite wording,<praw.models.comment_forest.CommentForest object at 0x7fcfb6713f98>,Essie888,0,7,5,False,weddingplanning,6.29.2019.Massachusetts,1536106828.0,9d18sp,
65,How should I do my hair? I have a simple floral crown.,<praw.models.comment_forest.CommentForest object at 0x7fcfb6715c50>,PloupPloup83,0,5,7,False,weddingplanning,,1536095107.0,9czpu3,
66,Did you walk down the isle alone even though you have a good relationship with your dad/parent?,<praw.models.comment_forest.CommentForest object at 0x7fcfb67320b8>,Rigma_Roll,0,22,7,False,weddingplanning,,1536092064.0,9cza6m,"Did you regret it later? I've been wrestling with this for the WHOLE 5 months I've been engaged... I still have a year to make this decision but... I can't decide whether I want to walk down alone or with my dad.  


I have a solid relationship with my dad. He's not perfect, neither am I, but we love each other and have a good connection. I feel like when I was a little girl and imagined that moment it would be with my dad walking me down. As I grew older and had friends whose fathers passed away, them missing out on that moment always came up in discussion.  


However, as I grow into my own person, learning about the unpleasant histories of marriage and how the father was basically handing off property to this other man.. As well as just generally being very independent...  Walking down alone feels more appropriate for me.  


But it would be nice to thank my dad in this way... but what about my mom? How is that fair? I know he'd support whatever I decided and would be perfectly content to not have to parade himself in front of damn near 200 people... But am I going to regret not sharing that moment with him.... GAH!"
67,VENUE HELP,<praw.models.comment_forest.CommentForest object at 0x7fcfb3773898>,AngelyGabriela,0,2,2,False,weddingplanning,,1536115731.0,9d2bx3,"I just want a private secluded field where my guests can stay the night and we can have a fire pit and late music for under $3000 in British Columbia. Is that too much to ask? 

Most places I’ve noticed and liked charge 6000+

Would love some input! Thank you! "
68,Bridals or No Bridals,<praw.models.comment_forest.CommentForest object at 0x7fcfb66fb0b8>,coulcobu,0,5,2,False,weddingplanning,,1536114879.0,9d284u,"I am trying to decide whether or not bridals are worth the money! Essentially, my photographer offered to knock $250 off the price of my upcoming November wedding if we don’t schedule bridals. We’re getting to the end of a tight budget so it would help but I’m so torn! We’re your bridal pictures worth it? Did you get enough pictures of yourself the actual day of the wedding? Please send pros/cons and pictures to help me decide! "
69,How to incorporate cultural traditions/music into American wedding?,<praw.models.comment_forest.CommentForest object at 0x7fcfb1969710>,mg0714,0,13,13,False,weddingplanning,,1536078925.0,9cxam7,"I’m so sorry if this is super long. Typed during my break on my phone & my anxiety might have made me ramble a bit. 

I am having trouble incorporating my traditional/cultural ceremony aspects into our wedding. I’m Bosnian, and my FH is American. Our wedding is going to be pretty standard to an American wedding, in the sense that I will be walking down the aisle, my dad will give me away, and the ceremony will be at our venue not in a mosque (unlike a traditional Bosnian wedding). Neither of us are religious and have already decided to have a friend officiate and keep things neutral there. The issue is, I have no idea how to make a few traditions happen in the way I want it to, and was wondering if anyone else is in a similar situation.
 
We have lived together for 2+ years, and are not doing a registry, or even asking/expecting gifts. This first situation is more so not wanting guests to feel uniformed or like they are not doing something right. In traditional Bosnian weddings, the couple is gifted cash during different times of the event rather than a full amount in a card or something. One tradition is 2 cousins are going to walk around pre-ceremony and pin small boutonnieres on each guest. It is a way to make each guest feel like an important part of the celebration. One holds a basket of the boutonnieres, and one holds and empty basket. As one pins the boutonniere, it is expected that the guest put a small amount of cash in the other basket. There are many other moments like this in a Bosnian wedding, but this is the only one we are doing/makes sense with our actual wedding. My Bosnian wedding guests will know this, but I don’t want my other guests to see this and feel awkward/obligated, but I also don’t want them to feel like they missed out on a tradition because they didn’t know.
 
The next is music: Music is SUPER important to my side of the family (Bosnian music). My FH suggested having an American DJ, and a Bosnian musician/singer alternate during the reception. Has anyone ever done this before? I worry about the logistics of things a lot. Also, there is a traditional Bosnian dance that I would love my guests (who are comfortable) participate in. How can I inform my guests of the music/dancing situation beforehand? 

Do I even need to? I really want my friends to get a feel for my culture and traditions without making it too confusing.
"
70,I'm making my engagement party invites for the host (she didn't want to and I love stationary so I was happy to!). Can I get a little feedback on these?,<praw.models.comment_forest.CommentForest object at 0x7fcfaea51fd0>,Britneeswedding,0,18,20,False,weddingplanning,"11/9/19 | Grafton, IL",1536069600.0,9cvv3x,
71,Guys....I found my dress!,<praw.models.comment_forest.CommentForest object at 0x7fcfaea54cf8>,Otterlyinlove,0,17,510,False,weddingplanning,,1536005157.0,9coq9l,
72,Hire that photographer you love. They are absolutely worth the money! That’s my biggest piece of advice.,<praw.models.comment_forest.CommentForest object at 0x7fcfb374c978>,Domino619,0,6,199,False,weddingplanning,,1536023267.0,9cr1sw,
73,Two bachelorettes accidentally getting planned,<praw.models.comment_forest.CommentForest object at 0x7fcfaea69f98>,totallypregnant,0,24,7,False,weddingplanning,,1536088424.0,9cyr42,"I’m a bridesmaid. Wondering if I should raise my hand in our group! 

We have a surprise bachelorette planned for the bride this month. We know she has no faith in us and thinks we’re doing nothing. We’re nice people, she really doesn’t have a good reason to think that but we didn’t mind cause it’d make the surprise better! 

Now the bride is attempting to organize a sleepover the night before the wedding but mentioned she’s renting a villa and stuff to do it. Whether she pays or it’s a group share on the cost, I’m pretty sure she wouldn’t have started planning this extra cost for her or us if she knew we do have a whole shebang planned. 

Should/how would we let her know? I’m not sure what to do. "
74,Feeling disappointed in my engagement a year ago...But feel bad for it,<praw.models.comment_forest.CommentForest object at 0x7fcfb6724b00>,SmoothDeadpool,0,19,20,False,weddingplanning,,1536067850.0,9cvmed,"Basically September the 1st 2017, my partner 
Got a little tipsy and asked me to marry him. He didn't have a ring and didn't do anything special that led up to it. 

When he asked me I replied with you're just saying that cos you've had a few. He then looked me dead in the eyes and told me that he meant it. Went on to saying how much I do for him and that he's the luckiest guy alive and wants time rest of his life with me... I said yes. 

We didn't really do anything to celebrate apart from buy take out. My parents came over with cake and for a cuppa the weekend after and that was it. 

He's not really romantic in any way. 
Didn't get anything or do anything  for our 2nd year anniversary of just being together. 

I feel bad but I can't deal with the disappointment of how it happened. 

I love him and he does keep say it ""can't wait to marry you"" but feel like it could have been something more... ? 





"
