,title,comments,author,guilded,num_comments,score,pinned,subreddit,author_flair_text,created_utc,r_id,body
71,I really don't know what to feel/think. I don't even know if he's an nparent. Is this the right sub?,<praw.models.comment_forest.CommentForest object at 0x7fcfb2042198>,Milkshaketurtle79,0,3,3,False,raisedbynarcissists,,1536085221.0,9cyafp,"I've posted here on and off. I have a lot of difficulty telling whether or not I belong here. My dad isn't as blatant as a lot of the people described here. In other ways, he fits the definition perfectly.  
He'll tell me to do something I've never done, and yell at me if I don't do it perfectly. He gets off on bossing me around. Even though I'm 19, he's always trying to control how I look, how I do my hair, how I act. He's always got some snide or sarcastic remark about what I'm doing or how I look, but blows up at the smallest criticism.  
I'm trans. He doesn't know it, because he's said he'd disown me ""if"" I were gay or trans. I listened to him go on about how disgusting trans people are.  
We go fishing each summer and stay in a cabin. Instead of changing in the bathroom and wearing pants or even underwear, he sleeps naked and changes out in the open, even when I tell him how uncomfortable it makes me. I know it sounds petty, but it's violating my boundaries.  
He yells at me if I'm using the bathroom when he wants it, even though we have two bathrooms. Until I started locking the door (because he'd yell at me for doing that), he'd always go in and use the bathroom (not just taking a piss either) while I was in the shower. He lies about a lot of small and pointless things if he can take credit for it. For example, I remember learning some fact from tv and telling him, only for him to tell me he told me/that I was trying to take credit for him. He'll do dangerous things and basically insist that they're okay/safe because he's doing it- for example, texting and driving, or burning the garden down to get rid of weeds without putting out the fire.   



But I guess the reason I'm confused is because he's not directly manipulative? Like, at least from what I can remember, he's never done anything like breaking something explicitly so he can blame me. But he's definitely verbally abusive. Whenever he's around, I try to avoid him. And a lot of times, I don't feel safe around him, both because of his recklessness, and his obsession with being this tough, toxically masculine guy with a gun on him 24/7.  
"
72,Chronic illness & trapped,<praw.models.comment_forest.CommentForest object at 0x7fcfb2c2d0b8>,bizkitba,0,1,2,False,raisedbynarcissists,,1536092886.0,9czeji,"I used to be very independent with a high paying job beautiful home and lots of options. But I became very ill with a neurological disorder plus Lyme. And was bedridden. I had to quit work and continue paying my mortgage bc it was the beg of housing crises and it didn’t sell for 2 yrs. I blew through my savings to pay for 12k a month treatment insurance stopped covering for a year plus every and any treatment that logically made sense to try. I did pretty well surviving in my home as long as I did and was lucky to get a short sale approved before a foreclosure. I left with about 100 in my bank account as disability was denied for years. Now 15 yrs later I have been living with living with my mom and narc Gma ( had no idea she was a narc) bc she treated me better when my illness and it’s inconveniences weren’t in her personal space. Basically my breathing is too much for her and she has told me I’m stupid, useless almost ever day I have been here. My mom and I walk on egg shells which she fucking loves and my nerves are shot. She looks for problems and if not found invents them and complains to the rest of the family how we take advantage of her and she feels put upon over things like missing a spot on the countertop or once bc I put a wet towel in the wash. Completely illogical stuff. I am doing al I can to get well so I can feel well enough to not live here and have my life back . I am sadly approaching 50 and so tired with no savings or home of my own anymore. narc feels she has a right to abuse me bc it’s her house and I’m an ingrate when I draw a boundary requesting respect. I am made to feel like a child here well actually worse. How do you cope when you are financially stuck living with these beasts? My dad was a malignant narc and I was so happy to get away and never have to call him for help and I am back in a similar nightmare I never envisioned for my life thanks to an illness. These people are demonic and I’m scared it’s going to rub off on me. Even if I get well and getaway I’m not sure I’ll have any life left in me at this age to be excited about life again. Some days I just hate that I even wake up again.(I’m not suicidal just don’t want to face another day) any advice on thriving when stuck living with them?"
73,"3 years abroad, rant about Ndad on return home",<praw.models.comment_forest.CommentForest object at 0x7fcfb2c32b00>,DaemonTrials,0,8,8,False,raisedbynarcissists,,1536070511.0,9cvzs7,"I'm mid 20's, been living abroad for 3 years. Only been 2 days back...



1) talked none stop about his friend's girlfriends drama between parents and cousins of people I've never met, will never meet, and not related to for probably 2 hours hours non-stop over lunch. Not like I hadn't seen him in 3 years or have interesting stories myself from living abroad..... Never got a word in.



2) Made fun of me when I yawned (baby voice d'aww somewons tired..) Me: ya I had a 14 hour flight and I'm still jet lagged. Not to mention I just had surgery yesterday. Him: sounds like someone's a bragger now! Me: no, you don't get to make fun of me then when I explain myself say I'm bragging... 


3) complaining that I never call... I told him to get a webcam and setup Skype 3 years ago. His excuse.. He needs help because he couldn't figure It out. (I bet he didn't even try!!!!!) You had 3 years... Surely you could have figured it out or asked someone.. But yes, it's my fault I didn't fly home to set up Skype for you.



4) parents divorced. Spent first day back having surgery and at my moms place. I had ZERO plans with him that day and that was on purpose. He sent an email saying if I didn't reply in 10 minutes he was gonna come over to my mother's house... Which we were having a big family meal with my brothers and sisters that flew in from around the world on that day. No, he wasn't invited or even knew about it. Just has no boundaries.



Said he was gonna show up at my workplace where I'm working abroad. Thank GOD he has  felony and the country I'm living in doesn't allow foreign felons in or he probably literally would. No boundaries!! 


Sorry for this rant. I've been living mentally free for 3 years and wasn't prepared for this on my arrival home."
74,I'm 14 and I don't know what to do,<praw.models.comment_forest.CommentForest object at 0x7fcfb2b7b630>,Hamfan1907,0,5,5,False,raisedbynarcissists,,1536073431.0,9cwfeq,"I've lived most of my life thinking what my parents do are right. It was about 13 or 14 when i released there ways of raising me were hurting me and causing me endless torment. They hit me (Harder and harder as I grew up and they don't care where they hit) They emotionally abuse me by calling me stupid and retarded they break my things without care. They constantly find ways to mock me about 1 past relationship and say that I'm not a real man. more recently I've been trying to reason and talk back at them but it doesn't work. It's gotten to the point where two times out of rage I've tackled my mom or pushed her backwards because she broke my headset and was slapping me in the face in a corner, by this point I don't care much for the hitting and constant punishments so I just talk back cause I've got nothing more to lose. she's also with a terrible abusive man that is my step father and constantly true to make me hate my father who lives in Virginia"
75,Have you ever dealt with a situation where Narcs completely rewrite your memory with their own narrative?,<praw.models.comment_forest.CommentForest object at 0x7fcfb2050860>,SkepticSheeple,0,19,77,False,raisedbynarcissists,,1536018965.0,9cqimk,"I tend to block out every bad experience I have, and have almost no recollection of it. I was confronted by my Nsister today who made outlandish claims that never happened but I could not rebuke her because I completely blocked out that part of my life because of how traumatizing it was and I am unable to recall how they happened exactly. How do I remember those bad events? I know that I keep falling in the same traps because of these memory lapses. It's as if I forgot completely what a red light stand for, cross the street, get hit by a car, remember I should never  cross on red, then start all over the next day."
76,Narcissist are like hurricanes. They must be the center of the attention and careless the damage they bring upon others.,<praw.models.comment_forest.CommentForest object at 0x7fcfb20a9e10>,nv1793,0,2,6,False,raisedbynarcissists,,1536067736.0,9cvlsa,
77,Inevitable no contact with narc,<praw.models.comment_forest.CommentForest object at 0x7fcfb2b7bbe0>,PrincessLumpySpace94,0,23,16,False,raisedbynarcissists,,1536051745.0,9ctx0g,"Does anyone here feel as if their life will never progress in anyway as long as they are in contact with their narc? I ask simply because every time I feel like I’ve gotten a hold of my life. My narc says something and I listen and there I am once again at rock bottom. 

I mean this person manipulates so stealthy that it’s not noticeable till the end. And I’m a firm believer in taking accountability for your actions. So it’s hard to figure out what we’re my actions and what was their influence. 

And when the narc is someone vulnerable that you feel if you abandon it will be your fault. Creates a feeling of selfishness and regret because you know you shouldn’t have listened. 

So how does one go about going no contact with a narc who depends on you? Any advice? "
78,Abusive parents thinking about your own sake just when it reflects on their reputation,<praw.models.comment_forest.CommentForest object at 0x7fcfb205e668>,captaiNB_Rolex,0,2,2,False,raisedbynarcissists,,1536088278.0,9cyqdp,"Like all or most of you, I grew up in an abusive household.
My parents are divorced, then I live with my mother in a house where my grandmother, grandfather and uncle live upstairs.

*Grandmother* was the dragon: the annoying one nobody stands up against because she knows how to stress you out til you implode; arrogant and judgemental, obsessed by reputation, and also the most relevant figure of my childhood.
Best quote: “Someone like you can only end up being a prostitute or a drug addicted”. Why? Because I sucked at school when I was 12. Y’know, I was depressed thanks to the nice words they used to tell me everyday!

*Mother* was the ghost: there, but not really there. She won’t play with little me and seemed to be very bothered by my presence. She would side my grandmother because faulting me was way easier.
Best quote: “You are no longer my son”. Why? Because I got a reprimand note in third grade.

Other relatives are not relevant.

What triggered the abuse was one thing: school. Both of them were obsessed by school grades and I _had_ to be the top student.

The abuse started when middle school started.
At elementary school I was considered some sort of “””prodigy child”””, they said I had a talent for writing. Maybe that’s why they wanted me to be the best in school so badly.
The summer before the beginning of middle school, I discovered the internet and drowned in it like... completely. So much that, after the first school term of four months, which I perceived as the end of an age and the beginning of a new one, I looked back and realized I didn’t remember a thing about what had happened in real life. I was literally living exclusively in the internet, neglecting anything real.
Then I got worse at school.
Ghost and Dragon didn’t like it.
They would insult me, yell at me and quit talking to me for days. I remember clearly the feeling of uneasiness that was always inside of me, it was heavy on my chest, head and shoulders. I kept having hysterical attacks and I was called “psycho” for them. My whole family was against me and gave me the fault for the hell-like family situation. I would bite the inside of my cheeks to feel some physical pain and every night I wished I wouldn’t wake up the following morning.

At school my teachers noticed I was no longer behaving as myself. They tried to talk to me in private many times, but I couldn’t say a word.
I knew my family was the one making me suffer so much, but I used to think it was my fault since that was what everyone told me; then I knew my mother would have told the teachers that I was the one making things up and that I was bad, and I didn’t want my teachers to dislike me as my family did and as I did myself.

Before the whole of this happened, my mother had already hurt me a lot being a Ghost who gave me the impression of not wanting to be around me, and excluded me from her life. And my grandmother always made me self-conscious about something. She always made me feel wrong. She never wanted me to be myself, she wants the prototype of a perfect grandchild, so that she can show off.

The two of them no longer abuse me as they used to, but often they still are hurtful and I generally get upset around them. Though I act friendly most of the time, but I have difficulties with grandmother.
Sometimes I’m rude and this is bad, I’m trying to change it. This happens because many times I want to tear away my own skin, when I happen to be involved with them in any way.
However, they are still the same people. The only one who has changed is me, that’s why I don’t get abused that much anymore.

I’m afraid to bring it up with my psychiatrist because I fear she’ll tell me I have to get along with my family, and that would destroy me.

However, my grandmother always told me she did it for my own sake. She compliments me when I get good grades, but I never felt happy for her compliments. I’m not sure why. Maybe I never cared to get compliments out of her. She would still tell me: “I love you” and this kind of things, but it just feels sickening. It’s always been like this. I’ve never wanted to hug her or so, I never wanted love from her, never liked her. Never found pleasure in anything she did for me.
Though this confuses me. Here I read stories about Npeople always belittling their children, etc., but my grandmother would actually compliment me when I got the best grades. Only in those situations, but they would. Though my mother also says she is embarrassed of me when I’m bad at school, so much she always tells me she doesn’t want to go to the meetings with professors. I think she has no interest in actually helping me to become good, she wants me to be good without putting any effort into it herself. I really think she wants me to be good at school for a matter of reputation. It’s probably the same with grandmother.

This is mostly a rant, but what do you think?"
79,"Mother won’t stop talking about her Nmom, should I be worried?",<praw.models.comment_forest.CommentForest object at 0x7fcfb2baacf8>,billNyealism,0,1,2,False,raisedbynarcissists,,1536088201.0,9cypzr,"Her mother was always manipulative and destructive, and tried to get me and my siblings taken away from her at one point. 
Constant streams of abuse from my mother’s Nmom was all we’d ever get, and now my mom keeps talking about her. 
Every chance she gets it’s “oh, your grandma did this” etc.
Should I be worried about her? This is the first time she’s really brought it up properly and I’m not sure if there’s anything I should be doing to help her.
"
80,When you ask your Nparent a short question about their day and end up listening to an hour-long monologue 😬,<praw.models.comment_forest.CommentForest object at 0x7fcfb2b81b70>,antediluvian5,0,9,29,False,raisedbynarcissists,,1536035883.0,9csg8w,"Sometimes I try to make conversation with my Nmom just to be nice, but I know it’s kind of a gamble every time. I run the risk of listening to a long rant about how everyone but her sucks and how overwhelmed she is because she’s taken on too many commitments. She has so little awareness of how self-centered she sounds that it’s sort of comical to me at this point. It literally doesn’t occur to her to really even ask what’s going on with me. If I try to bring it up, she blows me off and finds a way to bring the conversation back to what she wants to talk about. 

And it’s not like I can really interrupt her or just get up and leave because she’d interpret that as a slight. I mean, I *could*, but I have trouble establishing boundaries with her and I just want to avoid conflict."
81,Mom Just Called After NC For A Month,<praw.models.comment_forest.CommentForest object at 0x7fcfb2b85048>,LochNesstle,0,10,2,False,raisedbynarcissists,,1536087290.0,9cyl4h,"EDIT: I didn't read the Facebook message until just now. She said she had something really important to talk to me about and she'd even come to my work if she had to. She said ""after the talk, you can go to hell if you want."" So clearly this is something outrageous. I'm so done. I'm telling our front desk secretary not to allow my mom in.

 And I'm freaking out internally. She and my dad are on an information diet, and have no idea my SO and I are moving in together. They don't know I have a dog, etc. And after I returned to my desk from my lunch break I see the one missed call and voice mail. A voice mail I'm not going to listen to. And then I see the FB message that says, in a different language, ""LochNesstle you better answer, do not make me come up there and find you.""

My heart won't stop racing. I do not want to speak with her. I am scared. Do I just answer the Facebook message with something along the lines of ""I'm not ready to talk to you yet""? My biggest fear is her showing up at my job and making a scene. Advice please. "
82,"Email from Nmom, CLUELESS",<praw.models.comment_forest.CommentForest object at 0x7fcfb2c32710>,VikBoup,0,1,2,False,raisedbynarcissists,,1536085875.0,9cydsr,"This is the email I got from my nmom who after a lot of manipulation and inappropriate behavior send me this....for those of you who haven't read some of my posts, my ndad stalks/obsesses over young girls close to both my daughters and when I was younger he did the same to my friends:

""I don’t even know what to say. We love you. I’m sorry, we don’t understand how we got here. We will not chase after you. We miss the girls. I’m assuming you have changed all phones etc. as no one responds to me. 

 We have never felt so much heartache. I hope you come to grips with whatever you believe we have done. We came to help and show you we love you. Apparently you will never believe we love you. I don’t know what else we can do.

 We are making plans to move back home so you can live in peace. I don’t regret the time, money, love and support we have shown you.

 I only regret you cannot accept our love for you.

 Mom and Dad""

SIN BYE!!!!!eriously?  First you would have to know what love is!  It has boundaries and no manipulation by anyone.  Second, you hope i come to grips with whatever I believe that they have done?  Holy Shit!  Is this for real?  Third, the quicker you go back to NY the better!  GOOD FREAK"
83,My Nmom found a vent letter I wrote over a year ago. She was practically shaking with rage.,<praw.models.comment_forest.CommentForest object at 0x7fcfb20039b0>,HughMungusIsMyGod,0,30,141,False,raisedbynarcissists,,1536002081.0,9coaw2,"Basically, a while back, my best friend was visiting for a short while and we wanted to play computer games but I only had my one computer. I asked my Nmom politely if I could borrow one of her two laptops when she was done with them for the night. She yelled at me and belittled me in front of my best friend for having dared to even ask. She takes my things without asking all the time, by the way and if I say anything about it, like ""can you please ask before taking my things?"" She yells at me about how selfish I am and she shouldn't have to ask, I should just be fine with it.

Anyway, afterwards, I grabbed some paper and crayons that happened to be laying on a table in the living room and vented in the form of a comic strip, which I titled ""The Angry Potato"". Yes, I drew her as a potato. While it was exaggerated, the essence of it was honest and it's a venting mechanism so who really cares anyway? It depicted her screaming at me and everything but with more vulgarity and I wrote in all the things she has said or implied in the past but would never admit to saying. For example, saying how she treats my brother better or that how I feel is not important. It also highlighted how suicidal I felt and how much she destroys my self worth every day.

Fast forward about a year and a half. I'm 20 and living with her out of necessity and convenience with my 2 year old son. That little comic had ended up crumpled and shoved behind some furniture and I'd totally forgotten about it by then. Somehow, she found it and her very first instinct was to fly into a rage about how I depicted her as the ""bad guy"" and it makes HER feel like shit and ""what if someone else had found it and thought differently of me"". I was not surprised that she was primarily concerned about her image and upholding the façade that's she's a loving mother who actually gives half a shit about me as a person. 

She did not once mention or show any sort of concern about the parts that displayed my clear emotional devastation and suicidal thoughts. The whole rampage was about her and how dare I write such a thing. As if I'm not even allowed to have feelings or write them on paper and discard them. I was disgusted by her reaction but I said nothing and kept my face as neutral as possible, as I've learned to do most of the time she speaks to me. 

I guess that's all for this time. As always, thank you for reading and being such a good support community. You're all wonderful and I wish you the best possible lives. "
