,title,comments,author,guilded,num_comments,score,pinned,subreddit,author_flair_text,created_utc
0,Buster (19) enjoying his favorite spot on the couch,<praw.models.comment_forest.CommentForest object at 0x7fcfb413ce48>,kerrinrin,0,2,17,False,seniorkitties,,1536032446.0
1,DODGERS LOSE ROCKIES SOLE POSSESSION OF FIRST UPVOTE PARTY,<praw.models.comment_forest.CommentForest object at 0x7fcfb4155f60>,CrashRiot,0,14,37,False,ColoradoRockies,:DingerBitmoji: What hath God wrought?,1536032504.0
2,"Rape survivor, McKenna Denson’s face-to-face confrontation with her rapist, Joseph Bishop, in Mormon Church fast and testimony meeting [redacted]",<praw.models.comment_forest.CommentForest object at 0x7fcfb4118eb8>,NewNameNoah,0,30,123,False,exmormon,,1536030389.0
3,There needs to be a universal label for this,<praw.models.comment_forest.CommentForest object at 0x7fcfb425b5c0>,StellarBlitz,0,0,26,False,tumblr,An Artist on Tumblr™,1536031500.0
4,Ficus Elastica Ruby,<praw.models.comment_forest.CommentForest object at 0x7fcfb417fa20>,homme_gris,0,1,8,False,IndoorGarden,,1536031650.0
5,Had some “school photos” taken of Huxley for my husband’s Birthday and this is the result!,<praw.models.comment_forest.CommentForest object at 0x7fcfb41222e8>,ktwebr,0,0,37,False,pitbulls,,1536028507.0
6,This is literally the dumbest thing I have ever seen in my entire life.,<praw.models.comment_forest.CommentForest object at 0x7fcfae577cc0>,PURPLE_ELECTRUM_BEE,0,12,34,False,TheRightCantMeme,,1536028233.0
7,A lovely cat family.,<praw.models.comment_forest.CommentForest object at 0x7fcfb418d0f0>,beingjac,0,0,17,False,Eyebleach,,1536032744.0
8,When you are developing a clone army,<praw.models.comment_forest.CommentForest object at 0x7fcfb43975f8>,Skylord_Zantharan,0,6,27,False,PrequelMemes,,1536032038.0
9,Me appreciating the 3 upvotes I get from this,<praw.models.comment_forest.CommentForest object at 0x7fcfb411c2e8>,ebbanflo,0,5,35,False,memes,,1536032411.0
10,This kind Thai police officer.,<praw.models.comment_forest.CommentForest object at 0x7fcfb40c5fd0>,beingjac,0,9,65,False,HumansBeingBros,,1536030974.0
11,PSA - be aware on trails - the guy in this car would get out and follow me onto the trails. Details in post,<praw.models.comment_forest.CommentForest object at 0x7fcfb40cafd0>,McCrockin,0,2,10,False,sandiego,Pacific Beach,1536032398.0
12,FSU GETTING THAT ASS SMACKED UPVOTE PARTY!!,<praw.models.comment_forest.CommentForest object at 0x7fcfb4139860>,kylebucket,0,154,242,False,FloridaGators,GO GATA,1536030197.0
13,“I’m boycotting Nike” starter kit.,<praw.models.comment_forest.CommentForest object at 0x7fcfb409d400>,carlos_spicy_wiener,0,1,30,False,PoliticalHumor,,1536031651.0
14,Got this poster for free at a record store,<praw.models.comment_forest.CommentForest object at 0x7fcfb40c5f98>,The_Color_Beige,0,1,8,False,AliceInChains,,1536031759.0
15,Just High Lord problems,<praw.models.comment_forest.CommentForest object at 0x7fcfb40ca470>,Reactiveisland5,0,0,23,False,Grimdank,,1536030141.0
16,"My friends’ house puma. Her name is Noodle, and she requests boops.",<praw.models.comment_forest.CommentForest object at 0x7fcfb4139240>,hitherehillhere,0,1,7,False,curledfeetsies,,1536032565.0
17,Do not try this at home,<praw.models.comment_forest.CommentForest object at 0x7fcfb416d080>,pp0787,0,0,20,False,nonononoyes,,1536032616.0
18,Not A Good Look for Nike,<praw.models.comment_forest.CommentForest object at 0x7fcfb40c0fd0>,ooh_its_a_snake,0,1,12,False,LightsCameraPodcast,,1536030153.0
19,cursed_peppa,<praw.models.comment_forest.CommentForest object at 0x7fcfb4160e10>,shinxanta,0,8,10,False,cursedimages,,1536031261.0
20,"This is a problem. Texas, Beto can’t win if you don’t actively volunteer. Everyone needs to show courage and commitment. Knock on doors and phone bank, talk to people about health care.",<praw.models.comment_forest.CommentForest object at 0x7fcfb4206160>,Equestriaguy,0,0,28,False,BlueMidterm2018,Connecticut,1536031994.0
21,Big if true,<praw.models.comment_forest.CommentForest object at 0x7fcfb4087048>,Bendon32,0,2,48,False,DeepFriedMemes,,1536029040.0
22,"Petition to have our logo still be the planet, but with big muscle arms with tribal tattoos and a silver Figaro chain link necklace",<praw.models.comment_forest.CommentForest object at 0x7fcfae9397b8>,Pork_Chops_McGee,0,0,19,False,iamverybadass,,1536032547.0
23,luigi irl,<praw.models.comment_forest.CommentForest object at 0x7fcfb43ad320>,ItsyaboiDemo,0,0,30,False,luigi_irl,,1536029058.0
24,2meirl4meirl,<praw.models.comment_forest.CommentForest object at 0x7fcfb4397ef0>,mousa97,0,3,17,False,2meirl4meirl,,1536029960.0
25,DODGERS AND DBACKS LOSING UPVOTE PARTY!!,<praw.models.comment_forest.CommentForest object at 0x7fcfb4082e80>,JediHotcakes,0,31,44,False,ColoradoRockies,,1536031614.0
26,I feel like this sums up the general feeling of being an INFP,<praw.models.comment_forest.CommentForest object at 0x7fcfb438e128>,bribotronic,0,0,14,False,infp,,1536030383.0
27,How beautiful is our city?,<praw.models.comment_forest.CommentForest object at 0x7fcfb4139390>,Stalewine,0,1,9,False,Edmonton,,1536031546.0
28,My sweet boy Winston taking a nap,<praw.models.comment_forest.CommentForest object at 0x7fcfb437fac8>,ItsNatural,0,0,19,False,chinchilla,,1536029346.0
29,This person spoke the truth,<praw.models.comment_forest.CommentForest object at 0x7fcfb43a0860>,dem0lecule,0,0,24,False,Anarchism,,1536029880.0
30,Just got a job at the local paper.,<praw.models.comment_forest.CommentForest object at 0x7fcfb43a6198>,Serren-,0,1,20,False,CatsInBusinessAttire,,1536030950.0
31,Defend the healer at all cost,<praw.models.comment_forest.CommentForest object at 0x7fcfb4433c50>,solarboy14,0,3,39,False,NarutoShinobiStriker,,1536028076.0
32,Princess Tiabeanie for Fan Expo Canada,<praw.models.comment_forest.CommentForest object at 0x7fcfb4087518>,setoxxx,0,4,20,False,disenchantment,,1536030271.0
33,furry_irl,<praw.models.comment_forest.CommentForest object at 0x7fcfb437fc18>,uncommonfurry,0,8,21,False,furry_irl,,1536030283.0
34,gay irl,<praw.models.comment_forest.CommentForest object at 0x7fcfb4211940>,wallbuster1,0,0,18,False,gay_irl,,1536030624.0
35,Everyone’s favorite Ocean Man,<praw.models.comment_forest.CommentForest object at 0x7fcfb43a60b8>,Shaderu,0,0,11,False,JojosBizarreMemePage,,1536028807.0
36,difference between getting hit on by girls than by guys,<praw.models.comment_forest.CommentForest object at 0x7fcfb4285908>,studiojibblys,0,0,60,False,niceguys,,1536030749.0
37,When fortnite is in you recommendations,<praw.models.comment_forest.CommentForest object at 0x7fcfb425b208>,TheGamingFate,0,0,9,False,MiniLadd,,1536031653.0
38,Giving a hug to an attacker.,<praw.models.comment_forest.CommentForest object at 0x7fcfb442ada0>,beingjac,0,4,63,False,MadeMeSmile,,1536030940.0
39,My friend's precious baby girl died as a result of the inadequate medical care she received in an overcrowded ICE detention center. Please join us in a vigil to demand #justiceformariee,<praw.models.comment_forest.CommentForest object at 0x7fcfb41df9e8>,i_c0ntain_multitudes,0,0,15,False,DrawTheLine,,1536029817.0
40,Bodega kitty,<praw.models.comment_forest.CommentForest object at 0x7fcfb4240ef0>,catfartzzz,0,0,22,False,Catswithjobs,,1536028945.0
41,Proving it to your father,<praw.models.comment_forest.CommentForest object at 0x7fcfb45d6940>,nunkjo,0,6,37,False,WhitePeopleTwitter,,1536031332.0
42,Disenchantment confirmed?,<praw.models.comment_forest.CommentForest object at 0x7fcfb45ec278>,hollyhock_,0,0,23,False,futurama,,1536028674.0
43,"Crab Rave hits 2 million views just one month after it hit 1 million views, which took it 4 months to get. (Thank you memes!)",<praw.models.comment_forest.CommentForest object at 0x7fcfb408e0f0>,Son_of_Neptune_,0,0,9,False,Monstercat,Aero Chord,1536031155.0
44,Iva Noidea,<praw.models.comment_forest.CommentForest object at 0x7fcfb416dba8>,Ohm_eye_God,0,1,23,False,BeautifulFemales,,1536028742.0
45,"Trying a mustache for the first time, what do you think?",<praw.models.comment_forest.CommentForest object at 0x7fcfb40b7fd0>,Tandemduckling,0,2,25,False,gaybrosgonemild,,1536028544.0
46,She is one of the hottest MILFs around 😍🔥,<praw.models.comment_forest.CommentForest object at 0x7fcfb42b08d0>,MK1807,0,0,10,False,KourtneyKardashianPic,,1536031503.0
47,Found this in my childhood collection booklet. Best way to go about selling or finding its value?,<praw.models.comment_forest.CommentForest object at 0x7fcfb4249940>,Phoenix2700,0,6,9,False,PokemonTCG,,1536029407.0
48,Cyclops Courtney,<praw.models.comment_forest.CommentForest object at 0x7fcfb41d0fd0>,Nobuscus15,0,0,7,False,CourtneyMiller,,1536031003.0
49,"Defying anti-Hindu regime, West Bengal celebrates Janmashtami",<praw.models.comment_forest.CommentForest object at 0x7fcfb418de48>,xdesi,0,1,18,False,IndiaSpeaks,,1536030818.0
50,Best of luck to everyone tomorrow!,<praw.models.comment_forest.CommentForest object at 0x7fcfb41d0630>,throwaway84556,0,3,16,False,McMaster,,1536029456.0
51,My brother just killed himself,<praw.models.comment_forest.CommentForest object at 0x7fcfb43a6ba8>,ihavecorrectopinions,0,9,78,False,Cumtown,"David ""Goodluck"" Geffen | Nick is Diddy Kong",1536028153.0
52,Rip,<praw.models.comment_forest.CommentForest object at 0x7fcfb416ddd8>,EatUrSoup,0,0,15,False,trebuchetmemes,,1536031469.0
53,Her little box thing she's slept in since she was as big as my hand,<praw.models.comment_forest.CommentForest object at 0x7fcfb41cafd0>,WumboJamz,0,0,14,False,catsinboxes,,1536028340.0
54,A cozy room in the Alps,<praw.models.comment_forest.CommentForest object at 0x7fcfb4198470>,help8adam,0,0,15,False,CozyPlaces,,1536032209.0
55,Anon sends a dick pic,<praw.models.comment_forest.CommentForest object at 0x7fcfb42b0c18>,IxSquishxYou,0,2,14,False,ToddRolls,,1536028452.0
56,Just be happy,<praw.models.comment_forest.CommentForest object at 0x7fcfb418da90>,Amadon29,0,0,10,False,wowthanksimcured,,1536031261.0
57,My friend found this cursed object at GoodWill,<praw.models.comment_forest.CommentForest object at 0x7fcfb418d978>,RosieRiveterDinosaur,0,3,6,False,WTFgaragesale,,1536031383.0
58,Moments before disaster,<praw.models.comment_forest.CommentForest object at 0x7fcfb4260f98>,L_Dungeon,0,1,9,False,PewdiepieSubmissions,,1536032357.0
59,I still cant believe that you still cant believe it,<praw.models.comment_forest.CommentForest object at 0x7fcfb4198940>,BeezHappy,0,0,25,False,tumblr,,1536031225.0
60,My favorite derp,<praw.models.comment_forest.CommentForest object at 0x7fcfb417f9e8>,PrincessYumYum726,0,0,6,False,labrador,,1536028196.0
61,"Hallway at the Stanley Hotel, Estes Park, Colorado.",<praw.models.comment_forest.CommentForest object at 0x7fcfb41d0710>,Kubricksmind,0,0,22,False,AccidentalKubrick,,1536028867.0
62,We met on CMB over a year ago and we are getting married in November😍 We decided to serve coffee and bagels during the cocktail hour!,<praw.models.comment_forest.CommentForest object at 0x7fcfb4198da0>,slowrunner813,0,1,14,False,coffeemeetsbagel,,1536028698.0
63,"Greetings from Chicago. I haven’t driven it much lately as it’s no longer a daily, but I smile every time that I do.",<praw.models.comment_forest.CommentForest object at 0x7fcfb40b7d30>,jeffuhwee,0,4,17,False,S2000,,1536029398.0
64,This is what he does when I'm looking at my phone and he wants to get my attention,<praw.models.comment_forest.CommentForest object at 0x7fcfb41c5b38>,LaLaLaLeea,0,0,14,False,parrots,,1536028213.0
65,"Does Aimee give you guys a ""grown honey boo boo"" vibe?",<praw.models.comment_forest.CommentForest object at 0x7fcfb4179fd0>,theuncledenden,0,4,21,False,Floribama,,1536028601.0
66,"A young wasp helping an elder, despite their differences",<praw.models.comment_forest.CommentForest object at 0x7fcfb4103160>,the-really-real-one,0,2,35,False,RealBeesFakeTopHats,Thanks the Buzz Driver,1536028809.0
67,"PSA for Bikers: For Pete's sake, Get yourself a damn headlight!",<praw.models.comment_forest.CommentForest object at 0x7fcfb4179da0>,Raelah,0,4,30,False,FortCollins,,1536028746.0
68,Strike a Pose!,<praw.models.comment_forest.CommentForest object at 0x7fcfb40b7cf8>,musclemann79,0,2,18,False,asianbabes,Contributor,1536030943.0
69,Just Monika🧡,<praw.models.comment_forest.CommentForest object at 0x7fcfb423dcf8>,GypsyDagger77,0,2,12,False,DDLC,,1536031302.0
70,LOONATV #387,<praw.models.comment_forest.CommentForest object at 0x7fcfb41d0d68>,CanIRaveWithAOA,0,7,12,False,LOONA,"JinSoul, Chuu & HaSeul <3",1536030339.0
71,"Finally got my Sly tattoo done, adding Bentley and Murray at a later session.",<praw.models.comment_forest.CommentForest object at 0x7fcfb41a4cf8>,Coolwick,0,1,22,False,Slycooper,,1536028982.0
72,Helen Stifler,<praw.models.comment_forest.CommentForest object at 0x7fcfb4272588>,Milhouse_is_a_meme,0,1,11,False,geekygirls,,1536032126.0
73,While I blow away the record for this obstacle course.,<praw.models.comment_forest.CommentForest object at 0x7fcfb4276f98>,ImaginingDragon,0,7,63,False,holdmyredbull,,1536028917.0
74,I sketched a baby giraffe for you in case you needed some cheering up,<praw.models.comment_forest.CommentForest object at 0x7fcfb42abda0>,Shlylockfox,0,2,6,False,drawing,,1536032497.0
75,Tuesday's show is going to be epic.,<praw.models.comment_forest.CommentForest object at 0x7fcfb41b3c18>,jackasstacular,0,7,36,False,DanLeBatardShow,Are you a leg man?,1536029453.0
76,The last moments of Claire Wineland before she went into surgery for a 2x Lung Transplant. An inspirational woman who started a CF non-profit as well.,<praw.models.comment_forest.CommentForest object at 0x7fcfb423db00>,Sugarcola,0,2,20,False,lastimages,,1536030066.0
77,Titans take down (Lasiodora parahybana),<praw.models.comment_forest.CommentForest object at 0x7fcfb41037f0>,shesdownforthe_T,0,1,13,False,tarantulas,,1536028354.0
78,Däy Børk,<praw.models.comment_forest.CommentForest object at 0x7fcfb41a4fd0>,TheGnudist,0,0,7,False,DankMemesFromSite19,COGNITOHAZARD,1536030197.0
79,r/GolfGTI Survey Results,<praw.models.comment_forest.CommentForest object at 0x7fcfb41c5b70>,stillusesAOL,0,8,9,False,GolfGTI,"‘16 Golf R (DSG, DCC, JB4, RSe10)",1536031531.0
80,My boy. ❤️,<praw.models.comment_forest.CommentForest object at 0x7fcfb4103a20>,tpot04,0,1,10,False,bengalcats,,1536027997.0
81,My mom's 30 year old Jade is goals,<praw.models.comment_forest.CommentForest object at 0x7fcfb42723c8>,river1744,0,0,17,False,houseplants,,1536028353.0
82,We did it Reddit. 20k with Forsaken on the Horizon,<praw.models.comment_forest.CommentForest object at 0x7fcfb414b0b8>,QuantumVexation,0,4,8,False,DestinyFashion,Mod - Warlock Overlord,1536031438.0
83,"Gencyn: ""6 year olds aren't capable of knowing the names of their genitals, but they are capable of knowing if they have the wrong ones and are trans!""",<praw.models.comment_forest.CommentForest object at 0x7fcfb41d1470>,MossWolf,0,0,6,False,GenderCynicalCritical,,1536028532.0
84,Thought this belonged here,<praw.models.comment_forest.CommentForest object at 0x7fcfb429f208>,NlCK3Y,0,1,12,False,alaska,,1536029187.0
85,Nonononononono,<praw.models.comment_forest.CommentForest object at 0x7fcfb4272eb8>,Tubby-Chubby487,0,0,6,False,FactsAboutWasps,,1536031210.0
86,Zach’s great grand-uncle,<praw.models.comment_forest.CommentForest object at 0x7fcfb41a4c50>,Maxothy,0,0,25,False,OneyPlays,,1536028233.0
87,Anon doesn't have a partner,<praw.models.comment_forest.CommentForest object at 0x7fcfb414be80>,asidopo,0,3,31,False,greentext,,1536030993.0
88,Rectangle pizza from school lunches in the 80s and 90s,<praw.models.comment_forest.CommentForest object at 0x7fcfb41d7940>,defactosithlord,0,13,54,False,nostalgia,,1536028958.0
89,Stefan/Robbie Rotten will always be #1..,<praw.models.comment_forest.CommentForest object at 0x7fcfb428bf98>,Mr_Woop_Woop,0,0,14,False,upvoteexeggutor,,1536030707.0
90,"We got engaged in January, but I never shared my opal beauty!",<praw.models.comment_forest.CommentForest object at 0x7fcfb4103e80>,marshmallowchaos,0,0,8,False,wedding,,1536028307.0
91,toma no cu palmera,<praw.models.comment_forest.CommentForest object at 0x7fcfb42a05c0>,gabbfx,0,4,14,False,DiretoDoZapZap,,1536028909.0
92,"My cat, in a (witches tower) hat",<praw.models.comment_forest.CommentForest object at 0x7fcfb422efd0>,rayro23,0,1,28,False,Minneapolis,,1536029781.0
93,1980 2wd SR5 Longbed to 4wd.,<praw.models.comment_forest.CommentForest object at 0x7fcfb4155a58>,wsanburg,0,2,11,False,ToyotaPickup,,1536028290.0
94,Cheetah,<praw.models.comment_forest.CommentForest object at 0x7fcfb413c860>,GiantWithDwarfism,0,0,12,False,LizKatz,Keeping the sub alive,1536029944.0
95,"My take on The Temple of Gozer. Yes, it’s fully CGI.",<praw.models.comment_forest.CommentForest object at 0x7fcfb422ec18>,avetiamat,0,3,13,False,ghostbusters,,1536028980.0
96,Very disappointed in taggart.,<praw.models.comment_forest.CommentForest object at 0x7fcfb41fffd0>,inputmethod,0,12,13,False,fsusports,,1536031251.0
97,And make it double,<praw.models.comment_forest.CommentForest object at 0x7fcfb4155e10>,Mavonac,0,1,10,False,mathmemes,,1536028063.0
98,Update,<praw.models.comment_forest.CommentForest object at 0x7fcfb414bd68>,lilnigcloutedmartian,0,7,19,False,hamptonbrandon,,1536029943.0
99,This fucking “Vegan Toona”. I couldn’t bring myself to even try it.,<praw.models.comment_forest.CommentForest object at 0x7fcfb428b240>,TheHalfChubPrince,0,7,8,False,ShittyVeganFoodPorn,Shitty Vegan Chef.,1536028673.0
