,title,comments,author,guilded,num_comments,score,pinned,subreddit,author_flair_text,created_utc,r_id,body
20,"""You need to cut out the toxic people in your life.""",<praw.models.comment_forest.CommentForest object at 0x7fcfb28770b8>,asphaltdragon,0,4,26,False,raisedbynarcissists,,1536076985.0,9cwzcs,"I had someone suggest posting this here after seeing it on /r/MaliciousCompliance so I copied it and posted it in full, including my edit.

So this story is actually about a year old, but I remembered it the other day and decided to post it.

Now for a little backstory. I was 26, in-the-closet trans, depressed, and still entirely dependant on my parents for everything. I worked for my dad. I rented a room in my dad's rental house. My parents co-signed my loan on my car. I was securely under my thumb, and they used that to their advantage.

I had a bad habit of not getting out of bed when my alarm went off. Depression is a bitch. And this morning was like any other at this point. Laying in bed at 9AM, after I was supposed to be up at 7AM. Understandably, my dad is angry, and as he has a key to the rental, busts through my door. I really didn't wanna hear it, so I pretended to be asleep.

What followed was the longest, most painful 30 minutes of my life. Apparently I'm terrible at pretending to be asleep, or my dad is terrible at realizing I'm actually awake. He said he knew I was awake, but I still don't know if I believe him. I don't remember what he said, but a few things stuck out to me.

""Your friends are fake, they don't care about you.""

""You are not a transvestite."" (Of course I'm not, that's something different entirely. Validation, yay.)

""I declare death and destruction on those who would misled you."" (Did I mention my parents were religious?)

***""You need to cut these toxic people out of your life.""***

Oh boy, did I take that last bit to heart. I contacted all of my gaming friends to see if any of them had a place I could stay, saved up, bought a bus ticket, and three months later, at midnight, February 1st, I was on a bus travelling ten hours to Houston, with nothing but three suitcases containing my essentials.

Apparently when my dad told me to cut the toxic people out of my life, he didn't realize that was him and my mom. According to my sister, they are not doing as good.

Careful what you preach, I guess.

EDIT: I did not expect this to have the type of response it has. I should probably clarify a few things.

I left because I was being controlled by the things my parents had provided for me. They were holding them over my head. My dad is less to blame for this than my mom is, she was the one that held them over my head.

My dad is not nearly as bad as my mom, and is doing much better. They've both accepted me now, but back then, my entire family was emotionally abusive without realizing it, with the exception of my dad.

They aren't doing much better now, and I am. I don't know the specifics, except my mom cheated on my dad (for the third time, twice within the year). They're supposedly in divorce proceedings now and she's trying to get everything.

My dad had closed down his business that I was working at a few months before I left, and I was helping him flip houses, which he was trying to get into doing. He had taken out a lot of loans, and is most surely in a lot of debt now.

To be honest, if anyone is at fault here, it's my mom. She's narcissistic, controlling, and was basically using my dad, and still is, AFAIK."
21,I let nmom run her mouth and I didn't respond and I feel really proud of myself.,<praw.models.comment_forest.CommentForest object at 0x7fcfb29d95f8>,TaliaShae,0,4,11,False,raisedbynarcissists,,1536090544.0,9cz20w,"Yesterday nmom and I got into a really heated argument that all started over my lactose intolerance. She claims there's nothing wrong with me (how she would know is beyond me). It escalated to mom yelling with a tone to her voice I've never even heard before, so angry she sounded like a character in a horror movie during an exorcism. I've read all over the place that in her condition (suspected antisocial personality disorder), she doesn't even really know she's doing anything wrong and there very little hope at ""fixing"" her, so I just let her yell. I knew that saying anything would make it worse and there was nothing I could say to make it better. So I just let her go. She was going on for so long I was hoping she might realize that *I'm* not the one with an anger problem that she so intently claims I have.

I wasn't as angry as I thought I would be. Normally, I get so mad that she thinks she's in the right and that I lost the fight but I didn't feel that way this time. I was able to acknowledge that it really doesn't matter how she feels, she's always going to feel the same way about me. I've started to settle with the fact that I have a mom who's simply empty. It's not that I've lost anything, there was just never anything there in the first place. It's a shame that it took me so long to realize how to handle it, but at least it'll be easier to go NC. Idk, just felt like letting that out."
22,Small Victories,<praw.models.comment_forest.CommentForest object at 0x7fcfb2a08ef0>,Kitsunetheeevee,0,3,8,False,raisedbynarcissists,T-Minus 2 weeks until freedom/NC,1536092054.0,9cza4o,"9 days until my 18th birthday. Dropped my college classes, quit both of my jobs (both of which were very understanding), started packing my things, put a down payment on my new apartment, made pick up plans with my boyfriend.

I'm going to do it. I'm going to be free from them. 
"
23,Finally told a family member about what my mom became and admitted she caused my suicidal thoughts—not being lonely up here,<praw.models.comment_forest.CommentForest object at 0x7fcfb2877208>,reallypetitebarista,0,6,119,False,raisedbynarcissists,,1536039615.0,9csth4,"My Dad has a friend he’s known since high school, who is basically my uncle. His wife acts like my aunt, and his daughter a cousin. I had work all day today, knowing they love me, I asked if they were doing anything for Labor Day that I could invite myself to. They told me to get over there. (I moved 2 hours away from my immediate family, they’re the only “family” I’m close to visit up here)

In the evening I mentioned something my mother did that bothered me, and explained that’s why I was there, I was lonely and needed to see people I loved and trusted. She seemed concerned, and suddenly it all poured out. The jokes about my suicidal period, jokes about taking medication for my mental health, the demands of me in comparison to the GC, the emotional abuse, the physical abuse, how I once went 4 months without speaking to my mother.

And then, my aunt began to cry, and jumped up and hugged me, she said she knew it was bad, but she didn’t know what my mom was doing to me. That she was degrading me. 

And finally coming from a family member who knows my mom, and not a therapist. Who loves my mom, but believed me, IMMEDIATELY, was so relieving. She just held me while I grieved for my loss of supportive mother and parents as I reached my final years of maturity. She told me it wasn’t my fault, I didn’t do anything wrong, and that I didn’t deserve it, and that I didn’t owe it to them to visit them. 

I’m not crazy, and I got a mommy hug and support like I’ve never had in years. Although I’m still scared, I’m so glad I told. "
24,Anyone else feel societal pressures to keep a relationship with their Nparent (s)?,<praw.models.comment_forest.CommentForest object at 0x7fcfb27ffdd8>,alien_crybaby,0,8,12,False,raisedbynarcissists,,1536083034.0,9cxycj,"The title pretty much says it all. However I do have a few things to add. 

Specifically, I have two different information coming from two different reputable people and I don't know who's advice to take. 

A woman (40) I know tells me that I should keep the relationship with my mom even though it's still toxic. Her mother is very emotionally abusive and a diagnosed narcissist. She's basically told me to ""pick your battles"". 

Another girl (20) I know says it's perfectly fine to cut off your parents if they are still toxic to your mental health and that I shouldn't feel guilty if I do. She as well had a narcissistic mother. 

I guess I just need more opinions from other people with similar situations. So how do you guys feel about it? Is it alright to cut off toxic parents or should we keep them in our lives simply because they are our parents? "
25,"""Trauma bonding"" vs ""healthy bonding""",<praw.models.comment_forest.CommentForest object at 0x7fcfb29d98d0>,hashedram,0,11,90,False,raisedbynarcissists,,1536044093.0,9ct875,"[Trauma bonding](https://en.m.wikipedia.org/wiki/Traumatic_bonding)

 I've been reading about this concept and I think this is something anyone who's facing conflicting feelings about whether they actually love their Nparents or hate them should know.

When two people have a healthy relationship, over time they do things together and bond with each other. This is perfectly normal and healthy.

""Trauma bonding"" is a perversion of this. People who experience trauma, generally tend to bond more deeply with the person most available to bonding. This is why soldiers who go into battle together bond so strongly.

Long term abusers and especially N's tend to take advantage of this.


Step 1: The N hurts the victim and causes trauma

Step 2: The N comes back later, with a different personality and validates the victim's pain and emotions. 

Step 3: The N makes sure that they are the only available source of emotional validation to the victim and isolates the victim from other healthy sources. The victim has no voice but to bond deeply with the abuser.

Step 4: Once sufficiently dependent, the N hurts the victim again and the process repeats. Only the bonding is even stronger.

I've experienced these myself and some of the common side effects are

- Not wanting to upset the N, for fear of losing validation.
- Thinking the N will change over time and their not changing is our fault 
- Feeling that they love their abuser and hate them at the same time.

This love simply isn't real. It's an illusion. And understanding that is the first step to getting away.  And for those who have gotten away and feel guilty for still wanting to go back, it's ok to feel that way. But it probably isn't real love. Real love doesn't traumatize."
26,My Mom threw away my picture.,<praw.models.comment_forest.CommentForest object at 0x7fcfb27ffc50>,HopefullyGinger,0,5,15,False,raisedbynarcissists,,1536077152.0,9cx0cm,"I have a ton of posters from when I was a kid because I was only allowed to put things on the wall if my mom did it for me. Like I think I can handle a pushpin but whatever. Still there were plenty of things on my wall even when I moved out including a poster size coloring picture of a horse that I had diligently colored for my Great-Grandmother. I had even written on it {Dear Granny I love you double. Love [me]}. That coloring page stayed on my wall from the time she died when I was maybe 10 or 11 til just recently when my Mom took everything off my walls to try and empty out my room because my Dad has turned it into his ‘workshop’ (No never mind the two sheds full of junk in the backyard. He also needs my childhood bedroom.) She has so many paintings and posters rolled up but when I looked through them, that coloring picture wasn’t there. I asked her about it and she said, “It may have gotten thrown away. I didn’t realize it was so important.”

Bitch

Really you didn’t think this picture that’s been on my wall for almost twenty years was important? I almost started crying about it until she said, “I’m sorry I’m such a terrible mother.”

That stopped me because of course I’m not allowed to have feelings in their house. Can’t feel sorry, sad, sick, sore, nothing. So now I just desperately look for it every time I’m at their house but I think it’s a lost cause. She threw it away. I’m not sentimental about almost anything except for things I created for relatives that are gone now, or things they may have given me. I remember being so proud of myself for coloring that big picture and staying in the lines and following the pattern so that the right things were colored the right color. I remember being excited when they put it up in her room at the nursing home. I remember getting it back when she died and putting it on the wall right by my door so that I could remember those feelings when I saw it. 

But no, you’re right it was just a coloring page...why would that matter? Oh btw I saved all these Tiger Beat posters of celebrities for you..."
27,NDad tried to friend me on Facebook,<praw.models.comment_forest.CommentForest object at 0x7fcfb28772b0>,dollface411,0,2,6,False,raisedbynarcissists,,1536093209.0,9czg5u,"Edit: I’m on a mobile. Not sure if the formatting is any good. Sorry 

TL/DR: Never met my real dad, everyone who’s met him says hes an abusive jerk. He tried to friend me on Facebook, then tried to make me feel bad for him, and wanted to build a relationship, when I didnt he called me the daughter of Lucifer. 




So a little back story. I have never personally met my real dad. However I have heard probably everything about him from my siblings who grew up with him, my siblings from his side (and not from my mom) and obviously stories from my mom. I do not take what my mom says to heart, because she has some abusive traits and sometimes I believe she is a narc as well, and because sometimes she embellishes stories. This post is not about her. 
     Anyone that I have talked to about my real dad all say the same thing. He was a lying, manipulative, abusive, psychopath man who will do anything to help himself even if it meant destroying other people. Everyone says that he is also charming, and tries to get on your sweet side. Trying to say that he’s the one getting abused, he’s the one that’s the victim. And then when you show a moment of vulnerability, he destroys you. Financially, mentally and even physically. 
       For awhile I didn’t believe what people said about him. Yeah he was a deadbeat dad who left his kids to starve but surely he couldn’t be that abusive and evil? Right? Well I started trying to fact check everything and cross reference people’s horror stories of him. And yeah it all matched up. So I decided that I was finally okay with not ever meeting my dad and it turning into a wonderful relationship. I put him out of my mind and stopped obsessing over getting a good father, and hoping that everyone was wrong about him.

Well... as my title says, one day I received a friend request from him on Facebook. It weirded me out to no end. I didn’t accept it. I debated accepting and seeing what kind of person he was for myself. I couldn’t decide so I turned to my siblings from his side. They all said block him. But I guess I still kind of was curious what he was like and also super curious as to why he was trying to friend me now, after 20 years of never hearing from him trying to contact me.  So I messaged him (without accepting) and asked simply “why did you send me a friend request?”  Just to see what he’d say. And he didn’t answer til the next day. He said “is there any reason I shouldn’t have?” 

      That made me laugh. I could write a book on all the reasons he shouldn’t. Anyway I kind of laid into him about him never trying to come into my life, he missed his chance, he’s an abusive person, I don’t tolerate abusive people in my life. All that fun stuff. He then tried to tell him my mom left him (if she did, kudos to her) and that he tried to still be a dad but my mom thought it wasn’t best. You know that exact script every dead beat dad has to try to win over their kid. And he’s also saying he never abused anyone and it was my mother that hurt him. (Bull, my brother was like 6 and remembers him beating on her and the smaller kids). 
       I’m getting tired of him trying to twist everything into his favor, so I tell him I have no interest in building a relationship with him, I don’t care about him, I don’t allow abusive people into my life. I’m telling him if he doesn’t see what he did as abuse, that’s on him and he needs to have some self awareness. All the stuff I’ve been wanting to say to him since I realized what kind of person he was. 
  WELL. He did NOT like that one bit! He starts saying that my mother is a wh*re and I’m just like her, that I can’t even stop and think or reason, that I’m just like her. Calls me a total waste of space and air, that he can’t wait til me and my mom dies. Like he  really turned completely around from saying he was the victim and oh poor him to calling my mom every insult in the book and saying he hopes I die. (Real great dad material there). His last message to me before I blocked him was “goodbye daughter of Lucifer and mother of all wh*res.”  (Which really is stupid because he called himself Lucifer).

His last message made it very clear I made the right decision In not wanting a relationship with him. He did get inside my head a little bit and I did feel kind of guilty about not giving him a chance but after reading his last message, the guilt went almost completely away. 
     I’m hoping I did the right thing. I feel like maybe I should’ve given him the benefit of the doubt, but at the same time that would be discrediting all the years my mom and siblings endured abuse from him. Im not sure how I should’ve handled it. "
28,"My nMom stole $20,000 from me",<praw.models.comment_forest.CommentForest object at 0x7fcfb2b42358>,stro3ngest1,0,62,75,False,raisedbynarcissists,,1536043585.0,9ct6nc,"Some basic facts. I’m 17, I did some acting as a child and earned a fair amount of money for myself, around 20,000 and it was put in a trust.

My nMom just told me she used that money to buy her current house. I’m beyond angry right now. This is the same woman who has stressed NOTHING in life is more important than getting money. The woman who constantly belittles me for not spending all my money on frivolous shit. 

On a side note- Is there anything I can do? I have no ability to GET the money, and no other adult figure in my life who can help me to do so. I’m afraid my options are limited as i’m not a legal adult in my province until I am 19 and nobody believes in her abuse. Hell sometimes I don’t even believe it.

"
29,Uh oh. Grey rocking has nmom upping the ante.,<praw.models.comment_forest.CommentForest object at 0x7fcfb2813198>,Shouseedee,0,6,13,False,raisedbynarcissists,,1536077216.0,9cx0pb,"Since moving in to a new place I've found out a lot about what narcs are, what they're about and how to treat them. I've had my mom on a information diet as well as just have been spending less time at home whenever possible. She hates it. After a few months here my mom has finally found someone to convince she's saintly so she can play the victim and soak up whatever praise they lavish upon her. Not only that, they just happen to have all of this old stuff just sitting around that mom could use. It's hideous and doesn't match at all, but mom would rather just have everything handed to her. This has been going on all damn week. I should mention she insisted that one park where it's blocking the car so I can't leave (needs me to confirm all of the things she's been telling them behind my back).

&#x200B;

Part of the couch set looks hauntingly familiar to the furniture my dad left us with when I was four (she probably hand-picked that one just to trigger me over my father's death) and does this whole ""Come out and help me figure out where it goes"" speil in which I tell her she's doing great and go back to what I was doing. 

&#x200B;

Then it's ""Oh look at this new bed I just need your help so bad with figuring out with direction to have it! I tell her she's doing great and go back to what I was doing. 

&#x200B;

Then it's ""Oh look at all the furniture, pick what you want and have the guys bring it in!"" (give me an excuse to enmesh you in this process so hard you can't ignore me anymore) I don't have any room in my room for more stuff. ""Just put it in the spare room for now. You're doing great, back to what I was doing now...""

&#x200B;

I wake up this morning and find that she now has a dog. She must be getting desperate. ""Look, I got a dog! Come help me pick out a name!""""Well mom, this is your dog. You should be the one to pick out a name. I got to name my dog, it's not fair that you don't get to. But hey, she looks great, so I'm just going to go back to what I was doing now."" I feel real sorry for that dog. 

&#x200B;

Who knows what I'll wake up to tomorrow. "
30,"**Warning: Some gross stuff involving bodily functions mentioned** First love-bombing, now Nmom is saying I had the ""perfect life"" that others would have died for. Could anyone confirm if this is true? /s",<praw.models.comment_forest.CommentForest object at 0x7fcfb2833780>,Radiant_Piccolo,0,7,11,False,raisedbynarcissists,,1536082072.0,9cxt2r,"In my previous posts, I was saying that I've been having issues with nMom, and have very recently gone NC. Since going NC, she has been love-bombing me, sending me one of those insipid messages from chain emails about how 'daughters are so awesome'. When I didn't reply to that, the love-bombing continued, with her complaining about how this is probably karma for her for hating her parents for making her life a misery (grandma was a major narc, and grandparents had violent arguments when my mum was a child), but that in the end 'she missed her', probably implying that I'll miss my mum too. Then today she sent me the following messages, basically gaslighting every incident of abuse she put me through. RP is me, and I've deleted my location etc. For context, she cared for my grandparents in their old age, and I did my best to help her when I came back home. And she 'pulled me out of' my problems by beating me up with her hands, various kitchen objects, pulling my hair, and having my dad join in as well occassionally, in addition to calling me names such as 'b\*tch\*, 'b\*stard' etc etc. 

&#x200B;

>**NMom**: Hi bum. I know you are angry. Maybe it is Karma. 😬I hated amma and appa when I was growing up for making my life so miserable, until she fell sick and passed away. Miss her now. Coming to **\*my location\*** on the 27th September. Hope to be lucky to catch a glimpse of you. Have a great day, today, RP. ❤  
>  
>**NMom**: Good night darling.

\*more missed calls from her, then the guilt-tripping messages\*

>**Nmom**: Past few days, It was nightmare for me. Thinking you were sick and hurt. Relieved now. Just curious, which part of 25years of your life was so bad. Maybe your first 10years. Where I had pull you out of ??autism, bed wetting, feeding problem, rashes, allergy and be there for you every single day of your life. Which dream of yours did not come thru? When was it that you ever asked to speak to the two person who gave their life for you, Appa and Amma? Did you volunteer to take care of Amma even one day. She changed your pampers and changed it to cloth pampers when you had rashes. She spend her whole day feeding you. Even when she fell sick, did you feed her even once? Did you change her soiled pampers even once? Did you bother to be there for your sister who hero worshipped you all her life? She was going thru the darkest part of her life, did you bother to at least message her or give her at least a 1 minute call? So, please don’t point at me a say I was bad. I stood by you every single part of your life. You had the perfect life, every young girl would have died for. It took you 25years of your perfect life, to say I was a bad mum?  
>  
>**Nmom**: So, all this about me being such a horrible mother? Unfortunately mothers never get to do that, no matter what. So, throw me away in your life for just asking to call home. So, Daddy and **\*my sister\*** were horrible to you too?  Because of this horrible mum, you are now a doctor qualified from UK, not even India. You got the best life compared to us and your friends. Even **\*my ex\*** had to part time to pay for his tuition. While you got a single ensuite room wit attached kitchen. Was that life so bad? Try telling your problems to your nurses, your attendance, janitors, taxi drivers and anyone you come across. Compare your life with theirs.  
>  
>**Nmom**: I am coming there on the 27th. However, not expecting anything at all from you. Staying in a cheap Hotel,  20 minutes walk from your hospital. Thanks RP for your time, in reading my message.

I will always be thankful for the opportunities that got me away from her and enabled me to seek help. However, I will never forget the abuse, and how it affects me to this day. Yes maybe I wasn't the perfect child and had issues being withdrawn at school, but why did that mean it had to be beaten out of me EVERY SINGLE DAY? Why didn't she get proper help? One can still succeed in life without being put through the abuse I went through.

&#x200B;"
