,title,comments,author,guilded,num_comments,score,pinned,subreddit,author_flair_text,created_utc,r_id,body
0,Shortest MIL Stories Megathread,<praw.models.comment_forest.CommentForest object at 0x7fcfacef5be0>,AutoModerator,0,118,46,False,JUSTNOMIL,automated mod abuse,1535955301.0,9cj24g,"Use the fewest number of words to express how heinous she is!
"
1,"Gather around, my children",<praw.models.comment_forest.CommentForest object at 0x7fcfb18e1208>,DJStrongThenKill,0,187,774,False,JUSTNOMIL,butts,1535912522.0,9ce9jg,"Thanks to the recent influx of peeps from askreddit mentions, the power hungry mods have decided to reiterate some of our rules and remind everyone of the newest rule changes. 

One post per day. Seriously, don’t spam. 

SO bashing is not tolerated. Let me repeat that for those in the back, SO BASHING IS NOT TOLERATED. I speak for all of the mods when I say that it’s super annoying to open up modmail and find numerous reports on comments because people cannot/will not follow the rules. Telling OP to leave their SO and/or insulting the SO will receive a ban. 

Do not DM mods. We prefer that you message us through mod mail so that we can discuss everything together because we are a team. Attempts to triangulate the mods against each other will be met with a temp ban and we will laugh at you. 

Encourage, advise, and comfort, don't fear monger. We are a team of different thoughts, not one hive mind of terror. Fear mongering will earn a temp ban or a perma ban, depending on the severity. That’s up to the mod who handles the report or finds it. 

If you're offended that's your responsibility, not OPs. If you can’t say anything nice in a support group, don’t say anything at all. 

Don't word police. We look for poor attitudes and genuine prejudice, we do not try to fight the useless uphill battle of censorship through word policing. Obviously there's not a place for someone talking about ""daddy's cummies 💦,"" but if it's something MIL said we aren't stopping you from describing relevant information. If you are offended at something not directed specifically towards you that is your responsibility. Still, don't hesitate to hit report it you think it might be hate speech against a group no matter what language used.

We need to respect anonymity here. So no chasing users across various subs or linking to their profile after they’ve deleted their posts. 

/u/Made_you_read_penis should be worshipped as a God, and requires sacrifices of eggplant emojis to be send their way at every possible occasion.

/u/dietotaku needs BTS gifs to survive. 

/u/mysisteristrash is my bae. That’s all. 


We put a lot of time and effort into moderating this subreddit and it’s because we genuinely love what this community has become. Let’s all do our part in making r/JustNoMIL great again. 
"
2,"MIL threatened grandparents rights, earned immediate NC",<praw.models.comment_forest.CommentForest object at 0x7fcfb1bf8da0>,sequinsandpolkadots,0,217,1289,False,JUSTNOMIL,,1536076939.0,9cwz36,"Longtime lurker, first time poster. (Yay?) 

DH and I have been married for almost six years, and MIL has been an issue since exactly two weeks before our wedding. Once she realized that we were definitely getting married, it's like a switch flipped. She has constantly disrespected our boundaries, acted like she's a perpetual victim, feels entitled to do whatever she wants, and treats us like crap. She has also made it clear that she believes I married DH for his money, even though I also work full-time. 

For six years, we've gone through these cycles with MIL where she attempts (pretends?) to behave for six to nine months. Then, she doesn't get her way regarding something trivial and has a full-on tantrum that involves her not speaking to us for about three months. Once she's ready to speak to us again, she and FIL start trying to guilt trip DH. The phone calls start. The passive-aggressive love-your-mother Facebook memes appear. That sort of thing. 

After the most recent cycle, DH and I agreed that we couldn't allow this continue, mostly for the sake of LO but also for our own sanity. I was ready to go NC immediately and be done with it. He wanted to have a Come-To-Jesus meeting to try to ""fix"" everything and see if we could work things out with MIL and FIL. Since this was very important to DH, I agreed but only if we didn't bring LO since I knew the situation had the potential to be volatile. 

It went very well, obviously - Sorry for spoiling the entire post in my title. I could write an entire post about our lovely conversation with them. So much WTF. (MIL believes that every thought that goes through her head and every word that comes out of her mouth is THE TRUTH. FIL enables, enables, enables.) The highlight was when she threated grandparents rights 10 minutes into the meeting. DH and I agreed going into the meeting that any threat of grandparents rights was an immediate NC. As soon as the threat was made, we ended the meeting and left. We are now NC with no potential for reconciliation. 

(Side note: Grandparents rights are non-existent in our state if the child's parents are married, not unfit parents and in agreement regarding not allowing their child to have a relationship with the grandparents. Grandparents rights only come into play if the parents are divorced/a parent dies or disappears, and even then, there are stipulations. However, MIL threated legal action involving our child, so we are taking this very seriously. Also, this doesn't mean they won't be able to find some attorney to take their money to attempt to make a case against us.) 

A nom for your llamas: This particular tantrum was caused when MIL posted a picture of LO on FB after explicitly being told not to post pictures of LO on FB, period. She stopped speaking to us because I had the audacity to call her out on FB. (I also reported the picture to Facebook.) During our meeting, she attempted to scold me for not calling her privately to ask her to remove the picture. I told her if someone disrespected a rule regarding MY child, I would call them out any way I pleased. (Direct quote from MIL: ""What's so special about your baby that his picture can't be on Facebook?"") She also had the gall to complain that she doesn't have any updated pictures of LO because DH and I haven't sent her any in three months. Not surprisingly, this isn't the first issue we've had with MIL and FB.

At this point, we have done/are doing the following:
1) got a call into the attorney to see if we need to take any action right now
2) blocked MIL/FIL on social media
3) blocked MIL/FIL phone numbers
4) installed a Ring doorbell
5) will be purchasing a few video surveillance cameras for our home
6) informed my parents who watch LO a few days/week so they are on alert
7) house is clean (and tends to stay that way, thanks to DH), pantry and refrigerator are stocked, and have started fully baby-proofing in the event of a surprise CPS visit.

Is there anything else you'd recommend doing? How over-the-top should we go with the babyproofing? (LO is crawling and pulls up on things, but he's supervised all of the time. At this point, we have cabinets with any cleaning chemicals locked down and outlets covered.) 

Anything we're not thinking of that we should be? "
3,The wedding dress,<praw.models.comment_forest.CommentForest object at 0x7fcfb7e34fd0>,Boldrockwanders,0,91,1625,False,JUSTNOMIL,,1536056358.0,9cuceu,"Hi all talking about projection queen (pq) which I was told also loosely relates to toilet roll in French (which I think is hilarious) has got me thinking about other stories to do with her. This takes place before the whole message cheating thing. 

This is the tale of the wedding dress, now to preface me and my dh are not traditional at all he helped me chose my wedding dress on line measure me and send off for it. When pq found out she started going on about tradition how it wasn't right (cry me a river). Dh asked if she paid for it, she replied no he responds with well you don't get a say, (I told you all he is awesome as hell).

Now we had travelled down once again to see them, and things were actually going okay between pq and me, I decided to throw her a bone and showed her my dress, now to me it's gorgeous fitted to the waist then kinda comes out like a skater skirt to just above the knee. She is umm and ahhing over it and actually being generally nice about it.

She then comes out with gem I have a simialr dress in pink I think I will wear it to your wedding, record scratch what, like hell you will. I didn't dear readers say anything in the moment I was shocked. Later on that evening me and dh where talking and I told him what his mum had said, needless to say he wasn't happy he went down stairs and asked me to follow him, he out right asked his mum what was said and the daft bint repeated word for word what she said to me, he played along and was like oh beautiful can I see it, and dear readers I'm ashamed I doubted my dh and was about to kill him, as she scampers off to get the dress he looks at me and says don't worry, at this point I'm still shooting him daggers.

She come down stairs with a dress that isn't like mine guys it was identical and when he looked at the tag it was from the same shop and everything and neon pink! He takes the dress pretending to inspect then looks her straight in the eye and says mum if you so much as entertain the thought of wearing this dress or turning up to my wedding in it you will not be welcome, you will look ridiculous in a neon pink dress the same dress my wife will be wearing, and I will tell everyone you ordered it specially for the wedding to match the bride (her image is her everything) and tell them we told you not to. She splutters out some excuses and says she won't wear it, the subject was left alone after that.

Upon returning home with my dh I'm unpacking and discover the dress my dh didn't fully trust her, so he stashed it so she had no access to it, she never mentioned the dress going missing and never as far as I know brought the subject up again."
4,The Time Republimom kicked me out and got mad at me for being outside,<praw.models.comment_forest.CommentForest object at 0x7fcfb7e1ce80>,ThrowThatAssAwayYo,0,32,403,False,JUSTNOMIL,only sucks vegan dick,1536080389.0,9cxjba,"This story comes when I was still undiagnosed with my severe as shit ADHD and Republimom blamed my inability to focus on “laziness.” I dreaded going home every day because it meant hours of screaming. I was only thirteen and I decorated the area around my bed with a series of dates written on paper. Those were the dates that I wanted to kill myself of self-harm but didn’t. A thirteen-year-old shouldn’t have that. She should have a volleyball poster or a lipgloss-smudged Jonas brothers cardboard cutout (or whatever the kids are into these days).

​

Anyway, I got in the car with Republimom and she started doing her typical screaming and I did something I’d never done before: I greyrocked. I greyrocked as fuck. I just sat there and let the ADHD daydreams take me away.

​

We were MAYBE two minutes down the road when she pulls over and orders me out of the car and tells me to find my own way home. I gladly oblige. I mean, it’s maybe a five minute drive from my school to home, and the route is basically straight, left, driveway. It was along some busy sidewalk-less main roads but I could walk in the grass, no biggie.

​

Maybe 20 minutes goes by and I see Republimom’s black car appear again, and my heart fucking sinks. I’m about to be herded back into hell. She picks me up in the car, and is screaming at me again for walking along the major roads because “what would people think if they saw you walking home on the side of the road? They’d think I’m a bad mother!”

​

So it’s ok to kick your child out of a car and make them walk home alone, as long as no one looks down on you for it. K."
5,Was hoping I wouldn’t have anything to post for a while,<praw.models.comment_forest.CommentForest object at 0x7fcfb6e52d30>,ohreallynowlinda,0,29,206,False,JUSTNOMIL,,1536087435.0,9cylvd,"I am writing to you from home state as we have been here a few days now. I am the woman who’s MIL came in my room after I delivered and took my baby to another room and had me and the hospital staff freaking out for a while after I lost my infant daughter two years ago. 

So the current situation had us returning to home state unfortunately. My in laws live in a midwestern state that has had some awful weather recently. My FIL and BIL work construction and were driving in one of their work vehicles during a bad storm. Their truck was was hit head on by another large truck that had hydroplaned. The driver of the other truck was killed instantly and my FIL and BIL were severely injured. BIL we are not sure if he will recover from his injuries as he has not woken up since the accident and FIL is awake but had broken bones and a lacerated liver. He has had a couple surgeries so far to repair the damage. There might be more in the near future. 

Of course hearing this DH and I with our son flew to home state.  MIL is a hot mess. She is trying to stay together and not freak out but I don’t know if she is taking too many meds or not enough or just losing her freaking mind. She sits in the chair shaking and staring at either FIL or BIL depending on who’s room she is in then gets up and mutters to herself and cries.  I’m sure she is scared to death to lose her husband and her son but I don’t think she is anywhere close to normal. 

I have put aside my issues with her for the moment. I need to be here for DH because he has gone through so much recently. If BIL doesn’t make it DH is going to be lost. His brother is his best friend. We are scared. 

When we arrived at the hospital the first day I had brought son with us because one of DH’s cousins couldn’t get to us yet to pick him up to watch him. We knew it would be an awkward meeting but I wanted to see FIL and BIL too. I love them very much. MIL was waiting for us in the waiting room since we couldn’t take little man into the ICU.  She burst into tears seeing us and nearly toppled DH over with her hug. She looked like she didn’t know what to do with me so she said hello and waved. I’ll give it to her for not trying to jump on me too. I could tell she wanted to take the carrier from me because she wanted to hold little man but she stopped herself. 

She took DH in first then she took me into each of their rooms. FIL was doped up pretty well with a lot bruising but he smiled at me and squeezed my hand. BIL looked nothing like himself with all the tubes and wires. I cried and MIL rubbed my back like we were a normal family. After that cousin took the baby for a while and we talked about prognosis for both. The day after we got not good news on BIL about the swelling in his brain and responsiveness. MIL has now gone we think three days without really eating a whole and only napping here and there. I guess that is probably adding to her craziness. 

She did call at like 2 am last night as we have
Been staying at a friend’s home. She asked if she could see the baby for breakfast. DH told her to go back to sleep or whatever she was doing and don’t call at 2am.  He hung up and confronted her this morning about it.  She says she doesn’t remember calling. He said she looks like she hadn’t slept at all and is running on fumes. So who knows maybe she sleep dialed or something. Or she really is losing her mind. 

I really wish this bad shit would stop. Our little family needs some healing time. "
6,"Moisturizer Nazi got a taste of her own medicine, and DH is on my side again (update)",<praw.models.comment_forest.CommentForest object at 0x7fcfb7cafcf8>,cindyxloowho,0,54,200,False,JUSTNOMIL,,1536086928.0,9cyj9o,"(TL;DR of this whole ordeal: DH basically went full mama’s boy with JNMIL after she moved in with us and was letting her read my angry texts. They cracked a joke about my moisturizer choices and that was the last straw. DH promised to talk to her, but never did.)
Also, potato format cause I’m on mobile.

Thank you to everyone for your advice, it really helped me grow some hypothetical balls. 

As I stated in my last update, DH started seeing my point of view, for an entire night, before JNMIL sucked him back into his unhealthy sharing of our relationship problems. 
Since he’s off work on Saturdays, I formed a plan. A plan to give each of them a taste of their own medicine. First, I invited my cousin and sisters over without telling either of them. I made sure they came over when they both least expected it, bright and early.  When they showed up, I decided to let my sisters make breakfast. DH walks out and is visibly irritated. My sister asks if he wants some eggs and bacon, he says sure and sits down with us. Like clockwork, this is when JNMIL decides to join us as well. We’re all eating breakfast and my sisters and cousin bring up the fact that my daughter’s birthday is coming up soon. JNMIL says “I know, it really sucks that I have to visit my other son in (state) &amp; miss the party.” to which my cousin responds with “That sucks, OP’s  mom is planning the entire thing and even took off work that weekend to make sure it was perfect. I wish you could be here to see it.” 
Keep in mind, this is the same cousin i vented to about everything prior to this, so I was doing an internal victory scream when she said this.
JNMIL replies “I know, I just really want to be there for my son and see my newest grandbaby. She looks *just* like him.” 

After everyone’s done eating, cousin decides to try and bait JNMIL into talking bad about me in front of my sisters. She says “Isn’t it nice not having to cook breakfast?” I almost expected JNMIL to not say anything, then again, she wouldn’t be a JNMIL if she didn’t. 
She says “OP never makes breakfast like this cause she usually just gives the kids cereal, so yeah it is.” 
Bingo. 
My sisters darted their eyes at each other and my youngest sister says “Well, it *is* hard cooking for three kids as it is, let alone two adults on top of that.” 
JNMIL rebuttals with “I used to make a big  breakfast for my 5 children and my husband every morning when I didn’t work.” 
My middle sister starts picking up on what I was talking about and replies “Well, DH could always make his own breakfast if he wants a big meal, OP is the one with the kids all the time. It’s only fair.” 
JNMIL scrunches up her face and says “He shouldn’t have to, he works so she can stay home all day. I used to stay at home with my kids too and I still managed to get a warm breakfast made every morning until I started working again.” 
DH notices the tension rising and changes the subject by saying “What do you guys want to do today?”. My cousin says “We just wanted to visit for the day. OP has been telling me how lonely she’s been feeling, so we thought we’d come keep her company.” 
DH gives me a ‘wtf you told them?’ look. 
I ignore it. 
Skip to the evening, JNMIL asks what we want for dinner. 
Middle Sister decided to reply with “Isn’t OP gonna cook? You said she never makes big meals, you should let her cook for you.” 
JNMIL says “Well, she does cook but it’s usually just the same old stuff.” 
My youngest sister starts getting irritated, 
“Well, you don’t want her to cook, then you get mad at her for not cooking? That makes no sense!” 
I get a text from DH that says “Tell your sister to calm down, dude.” 
My inner smart ass jumped out and I tell my sister, “DH just texted me to tell you to calm down.” 
My cousin &amp; oldest sister are holding back chuckles now. 
Youngest sister is fully triggered at this point. 
She tells JNMIL, “You know what? I’m not gonna calm down, cause I don’t think you should putting OP down all the time. That’s my sister, and I’m not gonna let you talk about her that way without saying anything.” 
It gets quiet again, and my sisters and cousin get up to go outside to play on the trampoline with my kids. 
The doorbell rings and I realize DH ordered some pizzas. 
When I go to the door to get them, JNMIL sees me and loses it  “Are you seriously that vindictive that you’re gonna waste money on pizza when I *just* offered to cook dinner? Are you really *that* upset over what I said? I didn’t mean it that way, you need to get over yourself! All I said was that you didn’t know how to cook like me, it was supposed to be a joke!! You &amp; your family are being ridiculous!” 
I was left speechless and was about to start crying, when DH walks up and says “THAT IS ENOUGH MOM! I ORDERED THEM! LEAVE HER THE HELL ALONE ! WHY CAN’T YOU EVER JUST BE NICE TO HER? STOP!! YOU’RE PISSING ME OFF NOW!” 
JNMIL was obviously caught off guard, and she scoffs and replies “ Well, how was I supposed to know that? You know I don’t mean it like that! She’s allowed to bitch at you all the time, but I’m not allowed to tease her about one little thing? Do we all have to treat her like a baby now?” She looks and sees that I’m crying, rolls her eyes and sits down at the table. 
My sisters and cousin bring our kids back inside to eat, then pull me aside and ask what’s wrong. I tell them, and my sister storms into the kitchen and asks my children to go outside again for a minute. 
They leave, and she starts going in “YOU SHOULD BE THANKFUL THAT OP &amp; DH ARE EVEN LETTING YOU LIVE HERE! IF I WERE HER, I WOULD’VE KICKED YOU OUT WEEKS AGO!” 
JNMIL claps back with “SHE TREATS MY SON LIKE SHIT! SHES ALWAYS BITCHING AT HIM AND PUTTING HIM DOWN! MAYBE YOU SHOULD TALK TO HER, NOT ME!” 
At this point DH is visibly pissed, “OKAY! EVERYONE WHO DOESN’T LIVE HERE, LEAVE! NOW!” JNMIL puts on a smug smile, then DH says “YOU TOO MOM!”.  She packs a bag and has a cab take her to his sister’s house. 
JNMIL hasn’t talked to me since, but DH said she’s coming back tonight and wants to have a “civil” conversation with the both of us. 
I told him I wanted her out by the start of December and he said okay. 
Will post another update after this.
"
7,Please read. Emergency situation.,<praw.models.comment_forest.CommentForest object at 0x7fcfb4767fd0>,texasbrownies,0,112,287,False,JUSTNOMIL,,1536075779.0,9cws33,"My MIL has hit a new level of crazy today that is making me shake with fear. 

A little background, she has a conceal and carry. She has a history of mental illness. No I do NOT let her near our DD. She tried to forcefully grab my Dd from while arms while she was feeding. She tells me I'm ""stealing away her son"". This has been going on for two years. 

I'm pretty sure she just threatened me. I'm not sure if I should go to the police or if I'm over reacting? Her behavior is so unstable right now, she is all over the map. And I am freaking out. 


Text exchange:

MIL-""IF u want to keep demonizing me-keep it up""

Me-""Nothing wrong with help. It's when someone wants to take a title from you that is so great.  mother""

Me-""Get over the fact that I don't want you calling yourself mommy Mary. ""

Me-""Why is that so hard????""

MIL-""no""

Me-""Why can't you respect that??

Me-is that a threat? (Realizing what the heck I just read)

MIL-"" (name)- you are really crazy :-(""

Me- ""are you threatening me""

MIL-"" yes OH MY""

I'm trying to get a hold of my husband but he's working on a roof today so I can't reach him. I am shaking. I am mad and I am scared. I don't know how to get the whole conversation on here but it is like...I'm very scared. 

Should I go to the police? Wait for my husband? I can't think right now. 

Edit: I haven't let our DD around her since May. "
