,title,comments,author,guilded,num_comments,score,pinned,subreddit,author_flair_text,created_utc,r_id,body
22,I'm losing my mind,<praw.models.comment_forest.CommentForest object at 0x7fcfb3c77b38>,antisocialprincess92,0,12,36,False,JUSTNOMIL,,1536088077.0,9cypbn,"I have posted previously about my future MIL and how she recently joined Primerica. 

Since then, things have been extremely stressful between me (26/F) and my bf (27/M). From the very beginning I was skeptical and expressed my opinion to her, urging her to reconsider. She rejected everything I had to say and convinced my bf to attend a presentation, and to bring me along. We were lied multiple times by her new boss, who was so clearly a con man who figured out pretty quickly there was no way I was leaving my medical billing job with full benefits for Primerica. He did think he had a shot convincing my bf who is 3 months away from getting his degree to become an accountant that he should throw that dream away and join his mom's ""team"", though. 

Since then, my bf's mom has tried relentlessly to convince my bf that he should work with her. That Primerica is so legit and being an accountant would be a waste of time. That he'll be making 60k a year, which is nothing compared to what he could make at Primerica. That everything we've found online, proving her boss to be a complete liar who has been to court multiple times for wage garnishment, is not what it looks like. That her boss is really a millionaire. 

A week ago she called my bf, saying that he owes her 1500 for money that was gifted to him over a year ago. This was after my bf made the mistake of telling her about the scholarship he'd just received, which would cover the rest of his schooling. She originally said this 1500 was sent from his uncle in Mexico and it was never established that this was a loan before. Ever. But now it is. Supposedly she can't pay her mortgage but my bf's brother who lives with her rent-free knows nothing about that. She was just on a trip to Florida this past weekend for a Primerica conference, which she had to have financed herself, despite being broke and in debt from living off credit for nearly 2 years. 

My bf told her via text that he won't pay her the money until she quits Primerica. That he will help her as long as she is going to make good financial choices. Otherwise she is going to continue needing his financial support that he simply cannot afford to provide regularly. She texted him back, belittling his career dreams and shaming him for not supporting her. Saying she is heartbroken over his words and his skepticisim. That he is not realizing his true potential by going to school for accounting and he is making a mistake by not joining her. 

I was **livid**. I actually started crying when he was telling me what she texted to him. To think a mom could say that to her son, who has been working so hard in college and is so close to graduating....it is bewildering to me. I have a seven year old and can't imagine speaking to my son that way when he is working to achieve his goals that will give him an honest income.  I wanted to call her up and pop off at her but it took everything I had not to. I seriously don't want to see this woman again. I don't want to be around her in any capacity. What she is doing is making me so angry, I can't even fully express the anger I feel. I know that you're not supposed to alienate the person whom you're trying to help out of an MLM/cult but at this point I don't even care. I don't care what happens to her as long as she doesn't think my bf is doing a single thing for her. I feel like a bad person for thinking this way but I can't help it. She crossed the line and has no remorse. 

I can't help but worry that this will tear me and my bf apart. He still gives his mom the benefit of the doubt and says her actions are just a result of the brainwashing her MLM has done to her. As much as I can believe that has had an effect, I don't find that to be enough of an excuse for her numerous attempts to manipulate and shame my bf into allowing her to **scam** him. Family has got to mean more than some ""business opportunity"". 

I doubt this is the end of this craziness. I think she is going to break my bf down so badly that he helps her, and I'm worried. He is clearly hurt by that conversation. Even if he is sticking to his guns about the money right now, I do not doubt she will continue trying to manipulate him. I just want her to go away and stop making this our problem. "
23,Introducing ... my GMIL in “Adventures in Caretaking” Long long long,<praw.models.comment_forest.CommentForest object at 0x7fcfacebe048>,cityvengeance,0,12,48,False,JUSTNOMIL,,1536080001.0,9cxh40,"As a preface, I’ve been with my husband for almost three years now. We have one child together, both of us have fairly large families. Everyone is fairly okay, some are better than others. Except for his mothers side, the controlling and incontinent matriarch is his grandmother, who is a total JustNo. She rules from her lift chair, when she isn’t busy asking everybody to live her life for her. 

This woman has pretty much always had it easy. Came from a well-off family, has no idea about money to the point of her having a double-mortgage on a house that shouldn’t have one. She will however only spend money for new items for herself. She gives out weird shit from her hoard that is obviously used or bought from a flea market. (But she expects beautiful new things herself. 🙄) She is a Good Catholic with a penchant for indoctrination. She loves to gossip about anybody and anything. 

GMIL has no concept of appropriate behavior. Upon asking her to please not be naked in front of my husband, even if she is somewhat covered, she promptly burst into tears and told me I was “cruel and strange for thinking the way I do”. “I know where I stand!” She cried out, heaving and whining. We don’t want to fucking see you naked. That’s a pretty adequate request if we are in your home helping you out. 

Which brings me to this. Almost a month ago we were asked to help caretake for her. We lasted almost three weeks. It was me, DH and toddler. I would have to actively ignore my toddler because this horrible woman would tell me her needs are more important than my child’s. She would call me at 1, 2, 3, 4 and 5 in the morning. All night. “I’m so *lonely*, CV,” she says as I’m running on two hours of sleep. Talking at me even after I requested to be let go from the conversation. So much shit to deal with. The toddler has far better manners than her asshole great-grandma.

Which brings me to why we left. 

One morning I am sitting with Toddler in the couch, watching Pocoyo. I can occasionally hear strains of conversation from GMIL’s room, with all her equally-hideous-inside friends. What I hear next stops me in my tracks as I carefully stand up and set toddler in the baby jail. 

*”I think CV and [husband] are drug addicts. I can tell by the way they are. Did you know she only fed me a piece of toast this morning? And then she had the audacity to go out and smoke a cigarette. The dog hid under the bed from her because she’s so awful. She neglects me and the baby! I try to be so nice to her but she is so sour and mean. I don’t understand why her and [husband] are together. It has to be the drugs. I just don’t see what he sees in her.”* And this went on for almost two and a half hours. All this insulting bullshit about me. She barely knows me, she blatantly made up crap about me. 

Hold the fuck UP. This woman had been praising me all the time (which made me incredibly uncomfortable). Always going on about what a good wife I am and this and that. I knew she was a two-faced narcissistic witch. And that’s when I decided *fuck this I am going home, fuck this 77 year old bully*. After she got off the phone, I knocked on the door after she said “Come in!” all cheerily. 

I walked into her room, stone-faced. I’m a tall woman, with a serious RBF. She looked mildly perturbed. I told her we were going home that day, and I was packing all of our belongings. At first she acted delighted we were going and then immediately got suspicious. We were leaving two days earlier, why? I stared at her, took a breath, and in a low tone I said this:

“I want you to know we are leaving because I can hear *every. Single. Word.* that you said about me and DH. I heard all the nasty lies and everything else. You should be ashamed of yourself. Good luck trying to get anyone else to take care of you.” She sputtered and squeaked out with “well I tell you that you’re a good wife and mother!!”

I stared at her in disbelief and responded with “Just because you say this to my face is not what others are hearing. You called me a drug addict. You called my husband a drug addict. I don’t want to hear from you ever again.”

Then I slammed the door and got all of our shit together. This woman won’t be teaching my child how to act like a two-faced bitch. There are so many more stories about this evil creature but it felt good to beat her at her own game a bit. "
24,Ex gf invited to my baby shower,<praw.models.comment_forest.CommentForest object at 0x7fcfb3dd68d0>,jordynwx,0,137,589,False,JUSTNOMIL,,1536030367.0,9crvp5,"I’m not sure if this is the right place to post honestly, but I definitely need some advice/support. I’m currently pregnant with SO’s son. We are not married, however we are now living together. Boyfriend and I were together for over year, however boyfriends mom made no effort to get to know me until after the pregnancy was announced. At first it was great, and then once he moved out she totally changed. She has been not so nice to me this entire pregnancy. I have had feelings she did not like me at all, but bf continues to deny it and says it’s just me being sensitive until recently when we argued. After this I had enough, I texted her saying if she had an issue with me that I would like a conversation about it. Instead of texting me, she texts SO about it. Saying “I think a conversation needs to be done over face” exactly what I had said. Now I get the feeling she was only trying to stir the pot because she texting him saying “I didn’t mean to cause problems between y’all, I figured you knew about her texting me, however I think we need to have a face to face discussion”. It didn’t cause problems, and she never brought it up to me, or at all. Fast forward a month of me staying out of her way, she texts SO asking if he would like a baby shower. He responded that I would like one so she begins planning one and inviting all of her friends and family “to celebrate the upcoming birth of her first grandson”. However, I recently found out she has invited SO’s ex girlfriend to the baby shower. She was the only non-friend and non-family member she invited. His ex is not friends with him, and through the guest list there wasn’t a single friend of his invited. I brought this up so SO and his response was that she’s friends with his exes mom. Even so, why invite her too? Or at least ask me? "
25,MIL and the 'homemade soup',<praw.models.comment_forest.CommentForest object at 0x7fcfb3ab3fd0>,Sheanar,0,18,228,False,JUSTNOMIL,,1536048521.0,9ctn2t,"I recently joined this sub, and seriously you folks are the best. I've got a JNMIL (NC for 3yrs), a JNXMIL(LC), and a Nmom(NC 1yr). So really, great. Finally feeling like I'm not alone and in many cases seeing abuse for what it is. I could write so much just on what I've learned, but there is another sub for that.

For my first post I have decided to feed the llamas with a great BEC moment from JNMIL.

Backstory: I've known my BF for about a decade, but we've only been together a few years on account of her meddling. She's been spreading lies about me since she heard of me. Eventually, he grew a spine and we got him and his brother away from her.

Right before I moved in with my BF, YGMIL died of a heart attack, and right after GFIL was diagnosed with cancer. We live literally next door to him, so we took care of most of his day-to-day care (despite JNMIL's sister living next door on the other side - they shared a patio). Every so often JNMIL or JNMIL's sister would bring by leftovers and stay for a little bit, but then he'd call myself or BF (or BF's brother who lives with us) to help him clean up the mess they made. 

One time I was helping him with phone calls to doctors and making him lunch when JNMIL came over. She was oscillating between pretending to be happy I was caring for her dad and CBF. It was so awkward every time I had to deal with her. So on this one occasion she made a big show of this up-cycled yogurt tub full of ""homemade soup I *just* made last night. You can reheat it for him for dinner"". She went on about how good it was but eventually stuffed it in the fridge and left. 

Cancer is ruthless, and GFIL had no teeth in the first place and couldn't use his dentures. The guy was living on soups and mashed foods. If she cared at all she could ask him what he'd like or what he's been eating. But then she wouldn't be a JN, would she? 

The soup she was going on about was just some canned beef chunk soup she had put into a tub and made this huge story to feel good about herself. GFIL took one look and said he wouldn't eat it. When I showed it to BF and BF's bro we all agreed to just push it to the back of the fridge and wait for a good chance to toss it. She's one of those people who just don't care. She brought him soup for herself, not really for him. I knew it, she knew I knew it, but I was just smiling and nodding to make her leave faster.

Not directly related, but sort of. After she saw how much GFIL trusted me with his care she lost her shit (more) and added to the list of lies she was telling her side of the family about me. My ""favourite"" being that I wanted dead YGMIL's jewelry and such. Unfortunately it worked. By the time of GFIL's funeral none of that side of the family will talk to any of us, except for BF's 2 half-sisters (3 different dads between them) and they're on book of faces birthday card level contact. "
26,General clinginess and GPS tracking,<praw.models.comment_forest.CommentForest object at 0x7fcfb3ba9630>,arkhamdovahkiin,0,77,38,False,JUSTNOMIL,,1536081307.0,9cxosi,"Hey everyone, I’ve lurked for a while and am posting for the first time about my FMIL. For the most part, we get on really well and she is (mostly) JustYes. However there is just one thing that bugs me and it’s that she is quite clingy!

Me and my SO are both 19 and at university (starting 2nd year next month) and have been together for 2 years and although she’s gotten a bit better since we got together, FMIL is very clingy. My SO is her eldest child and she doesn’t like to let him go anywhere without knowing and if possible supervising/accompanying him. 

For example, she insists she take him to his doctors appointments and any time he has even a slight cold she will act as if he is dying. This one bugs me because a few months ago I went to A&E (emergency room) from midnight til 10am for abdominal pain and she did not accompany me (we were staying with them) or ask me if I am okay (FFIL and SO took me). 

In comparison, for the 1st year of our relationship SO and I were long distance, and she forbade me from visiting on a planned trip once because SO was “very ill” (he had sniffles,  not even a cold) so she could look after him. 

When we moved to uni halls last September she did not like this change at all and insisted we come to see them every single weekend. I didn’t mind this that much, it was nice to see them and their cats, but we couldn’t go more than a week and a half without a call saying we *need* to visit. 

The problem I wanted advice on is the Life360 app, which is a family tracking app. My FSIL is 15, so it makes sense for her to be on it, but SO doesn’t need to be tracked and it notifies her every time we leave university. 

Once, she phoned in a hurry at 7PM asking where we were going because it notified her (we were just going grocery shopping...) and she acted as if we had no business being outside this “late”!

This Sunday we move into a studio flat in a different area of London and I don’t want it to be on the tracking app. I’ve tried asking my JustYes FFIL and he said it’s just how she is and I “won’t understand” until I’ve had my own children, as if this is how all mothers are. 

My own mum is very JustYes and does not track me or ask where I am going; she is much more easygoing and less overbearing.

My mum lives 3 hours away vs my FMIL living ~30 minutes away from us, so we’re hardly very far from my SO’s family (which I could maybe use as justification for tracking him if we were very far away). 

It just feels like FMIL won’t let SO grow up: I really like and get on with her 90% of the time but on the topic of my SO she will not budge on being overbearing and trying to micromanage his life. 

If anyone has any advice on how SO or I can broach the topic of asking not to be tracked with her without making her upset or feeling attacked (I don’t want to make her feel bad) I’d love to hear it. 

TL;DR - my boyfriend and I live together while at university and my FMIL insists on knowing where he is at all times via a tracking app. What can we do about this?"
27,"She hid with the druggies, fanatics and freaks",<praw.models.comment_forest.CommentForest object at 0x7fcfb39cfcf8>,ConvolutedTomorrow,0,6,47,False,JUSTNOMIL,,1536075933.0,9cwszp,"^(I don't know how to start this, but I was triggered by a TV program about cult survivors and have had memories flooding through my mind one after another, and I feel this gut-wrenching urge to get it out even though I don't know where to begin.)

_______________________________________________________

**For those who don't know, my mother is a sociopath.** Yes, she was diagnosed, and I will probably bring myself to write about in the future. She's not your average selfish narc, there is something truly evil and cruel in that empty void, a void that she filled with my screams and tears. She was never phased by the idea of killing me or harming me beyond recognition and probably would have if it wouldn't get her ""toys"" taken away, she didn't have empathy or guilt, she just didn't want to be caught and prevented from doing whatever she wanted.

In the beginning, she was sloppy, mimicking emotion posed more of a challenge and she was slower to figure out what was expected and how to respond. As a result, she had more slip-ups and people ""wised up"" a lot faster. Most people would begin to realise something was ""wrong"" pretty soon after meeting, she never quite ""sat right"", breaching the uncanny valley, and left a sickly feeling in the pit of your stomach; her face would move but her eyes were dark windows into something so sinister and silent it made you want to scream and you couldn't say why. The smart ones left within a week or two, but she honed her craft over the years.

She realised that ""normal people"", even if they didn't want to know or do anything about it, would get suspicious and eventually question things. All the lies, manipulation and isolation in the world can't stop gossip. So she changed her focus to people whose capacity were reduced. It started with churches, they were already so fervent and gullible in her mind, if they could reject reality for this imaginary group experience with God, surely they would accept her and ignore how fucked up she was. **And the scary part was, she was right.** 

All she had to do was be a ""poor Christian woman seeking God and salvation"", and they would forgive her of anything and everything, embracing her as she used them as pawns in her game and provided a perfect cover for abuse. This later escalated into more outlandish and cult-like religious groups that included writhing around on the floor during prayer and speaking in tongues. To an outsider, they looked crazy, so they couldn't question her without taking scrutiny themselves. This trend continued as it opened a new avenue: People in need of help. Drug addicts and mentally unwell people cycled through her life, incapacitated by illegal substances that she continued to supply to lure them in and keep them around. In an altered state, they barely had the senses to function, let alone resist and it took longer for them to realise they needed to get out. Eventually, they cycled through her life as transient nobodies, many of whom were a risk to my sibling and I, trying to physically/sexually assault us and being abusive in many ways; but to us, no one could be as scary or damaging as our mother. 

She also weaponised sex with these addicts to emotionally abuse, using it to break my sibling mentally and destroy any comfort and stability they thought they had. All my life I became a meat-shield and tried to protect them, but there was only so much I could do, and even holding my hands over their ears as tears streamed down their face was futile against the fake and exaggerated noises coming from the bedroom designed to break them. I wasn't bothered by it, but the image of that scared and broken child is burned into my heart and fills me with angry tears every time.

From the outside, she came off as charitable and kind, helping desperate people. But in reality, she took advantage of their vices, vulnerability and kindness to serve her own purposes. 

**Those who got away have no clue how lucky they are, I'm sure they saw glimpses that scared them enough to save themselves... If they only knew how bad it could've turned out for them.**

**TL;DR:** *My mother is a crazy sociopath that covered her tracks by hiding amongst religious zealots and drug addicts, exposing me to some serious creeps and dangerous people, and used them to torture my sibling.*

_______________________________________________________


**For reference:** I have severe CPTSD due to abuse and neglect, this is a journey for me and I am still learning how to talk about it. My mother is a sociopath and a real risk, she has stalked and attempted to kidnap me multiple times, do not ask for personal info.

**Please do not share this outside of Reddit. This is very personal trauma, not drama.**  "
