,title,comments,author,guilded,num_comments,score,pinned,subreddit,author_flair_text,created_utc,r_id,body
0,Do you care about this community? Would you like to help us keep it going? Apply to be a mod!,<praw.models.comment_forest.CommentForest object at 0x7fcfb2c8f978>,RBNmod,0,59,489,False,raisedbynarcissists,Do not PM shared account.  Use the modmail link in the sidebar.,1526642684.0,8kcf8k,"[Heyo RBN!](https://media.giphy.com/media/dzaUX7CAG0Ihi/giphy.gif)

Have you been an active user for a year or so, and would like to help make this sub a better place? We have an opportunity for you! We are looking for some people who would like to be trained to be an RBN mod.  Specifically, we are looking for people who care deeply about this community and the support that it offers and would like to help the team develop it and keep it safe.  We are not looking for folks who just want another badge. 

You can spend as much time as you like helping keep this community safe for abuse survivors.  If you have 20 minutes a day, that's a huge help!  If you have 2 hours a day, that's great, too!  It's all up to you!

As this is a huge subreddit, we understand that jumping right in can be stressful. That is why we are looking for people who would like to (start out or) be mini-mods. What’s a mini-mod, you may ask? Well, we are looking for mini-mods to do one or both of the following:

**Flair Control** - As a flair mod, your sole responsibility would be to go through our unmodded links, and confirm or apply the proper flairs according to guidelines. We have automoderator tag according to key words, but as it’s a robot that can’t understand context, it’s not always right. Many people do not apply flairs or do not know how to apply flairs as well (which is absolutely fine!) as this mod would help with that.

**Auto-Mod Queue** - as a queue mod, you would go through our queue and deal with only the items reported by our automoderator. The automoderator will report items based on key words, to confirm context or to alert us to possible drama or someone who needs extra support. As far as user reports go, you will not be responsible for this, as we will handle this.

Mini-mods are not given full mod permissions immediately, as with most jobs there is a probationary period to ensure that the new team member is an appropriate fit for the sub (acts appropriately, follows the mod rules/guidelines, etc.). Generally training takes one to two months for mini-mods but that depends on the individual, the time they can commit to the volunteer position, how much material is covered and how the senior mods feel about the trainee's progress.

If you'd like to be promoted to a full-mod eventually, that is something you can work towards.  If you would like to stay a mini-mod, that is just fine, too!  It's up to you.  

However, there is one bit that is no longer optional.  **Availability on Discord for text chat only (never video) is required.**  It doesn't mean that you must be on Discord all day or that you must answer any message to you on Discord instantly.  It just means that you should be able to check in with Discord periodically (at least a few times a week) to get updates from the other mods about what is going on and for training assignments, etc.  

I also want to be honest about what this job entails.  It is reading a lot of triggering content.  It is seeing the truly dark side of RBN that our general members never get to see, because we try to remove all that B.S. before our members have to read that nonsense.  It can take an emotional toll, but it is also rewarding.  The thank you notes that we occasionally get from members are nice.  The posts that thank the mods because the group saved their life... those are nice, too.  

If modding sounds like a good job for you, fill out the form linked below and it will be reviewed ASAP! Successful applicants will be contacted by a mod of /r/raisedbynarcissists some time in the future (sorry, no time line available at this point).
[
Mini-mod Application Form Here!](https://goo.gl/forms/KWZ3Yr0ysyT1w2Ll1)

"
1,Welcome new subscribers - read this before posting or commenting!,<praw.models.comment_forest.CommentForest object at 0x7fcfb2b815c0>,RBNmod,0,79,465,False,raisedbynarcissists,Do not PM shared account.  Use the modmail link in the sidebar.,1524697182.0,8exxwp,"Welcome new members! 

For those of you who are wondering what a ""Nmom"" is or a ""FIL,"" [**here is a list of acronyms**.](https://www.reddit.com/r/raisedbynarcissists/wiki/acronyms)

**What is a narcissist?**  [Check out this link.](http://parrishmiller.com/narcissists.html)  It's a link about mothers, but it can apply to any ""narcissist.""  

Please note that ""narcissist"" in this group doesn't necessarily mean a person with Narcissistic Personality Disorder (NPD).  **""Narcissist"" in this group means any abusive parent, but most of the parents that we talk about in this group *probably* have a personality disorder whether it is diagnosed or undiagnosed.**  If you see the traits list (linked above) and can strongly relate even if you don't think your parent has a personality disorder, you are still welcome here.  

[**Here is a link to a list of FAQ topics.**](https://www.reddit.com/r/raisedbynarcissists/wiki/helpfullinks)

RBN is a unique subreddit with a supportive culture unlike that which you find in most other places in Reddit.  Because of this, **we strongly encourage you to read [our rules](https://www.reddit.com/r/raisedbynarcissists/wiki/rules) before you post or comment.  If you have any questions about the rules or questions about a post that would derail the post to ask under that post, please [send a modmail](http://bit.ly/20bctQq).**  *Please do not PM the mods individually, because you never know who is on duty that day or when you will get a reply.  If you send a modmail, whichever mods are on duty can help you out, so definitely modmail > PMing specific mods.*  

If our rules look completely alien to anything you have seen before, I recommend that you sit back for a few days or weeks and read the comments and posts to get a feel of what is appropriate for this group before you participate.  

Veteran members, whenever we have to assimilate this many new people, there is always a long process of weeding out the trolls and just people who cannot follow the rules.  **Please use the report button if you see anything rule breaking or sketchy.**  Using the report button is completely anonymous so that even the mods have no idea who reports what.  So, please use that report button to point the mods at potential problems.  This subreddit is far to large and active for the mods to read every post or every comment.  We depend on our members to let us know when rule-breaking things are going on."
2,[RANT] NMom and NSis showed up to my home after I went NC with them,<praw.models.comment_forest.CommentForest object at 0x7fcfb2b6fcc0>,sexyhappyunicorn,0,68,604,False,raisedbynarcissists,,1536075650.0,9cwre1,"Yesterday I hosted the family Labor Day celebration at my home. 


Usually it’s at my parent’s house but my NMom and Dad are separated so no one wanted to go to their house. My NMom and NSis live there and my Dad is staying with me until their divorce is finalized.


For the first time in a long time all of my local family showed up. Most of them refuse to come to family events (except funerals) because they don’t want to deal with my NMom. 



We were having a great time. Everything was stress free. 



Then my NMom and NSis walk in the gate to my backyard. My heart sank immediately.



Everyone goes silent. A few of my relatives run inside the house because they didn’t want to deal with her or NSis. My Aunt who records all family events turns the camera to them.



My NMom yells at me about how inconsiderate it was to exclude them, how much I must really hate her and my NSis, how jealous of them I am,  how she hates coming to my house because it’s always so “sterile” and she’s afraid to touch anything or sit anywhere. 



I cut her off at that point and tell her neither of them are welcome and they need to go before I call the police (my Dad has a restraining order against my NMom). They head to the gate but not before she had to get the final word. 



**She tells me she read the e-mail I sent to her about cutting off all contact. She says “I’m offended by you and how you say I’ve treated you. All I’ve ever done is try to love you and you’re unlovable. How is that my fault? He’s (she pointed to my Dad) unlovable too. My online therapist says you’re both social rapists and terrible people!”**



I shrugged my shoulders and responded “of course we are. Nothing is ever your fault. I abused myself all those years. And if you truly feel that way about us then leave and never come back here. I don’t want you to feel socially raped.”



**Her response was “I had to come since you changed all your phone numbers, I can’t reach you at work, your Dad got that restraining order on me and any e-mails I send to you come back with a message that you’re not taking my e-mails and not to contact you. I knew you’d be here so I came to tell you and him (she pointed at my Dad) I’m done with you both. If you two don’t want me to contact you anymore then I won’t. Let’s see how good your life is without me. You’re not welcome at my house ever again. I don’t need either of you.”**



I tell her “I’m good with that. Have a nice life.”



When they’re almost at the car my NSis comes back and yells to my Dad “you’ll never see your grandkids again.” My father points to my NSis’ ex-husband who says “they’re here with me. They’re inside the house playing video games. He’ll see them plenty.”



My NSis kicks over 2 of my potted cactus plants, gets scratched by the needles then tripped by the first pot she kicked over. She gets up then runs to the car crying.



We all  try not to laugh since it was so comically dramatic but it was very hard not to so we laughed.




I hope I don’t see or hear from either of them anytime soon. I still feel good about going NC with both of them. Best decision I’ve made ever. 



**Thanks to everyone on here who sent me encouraging PMs after going NC with them. The positive support has been overwhelmingly awesome. There’s comfort knowing that I’m not alone and I can help others not feel so alone since we’re all going through the same things.**"
3,Mentally Changing My nDad's Name in my Head is Giving Me a Newfound Boundary and Freedom.,<praw.models.comment_forest.CommentForest object at 0x7fcfb2afa588>,AnonymousZi,0,83,490,False,raisedbynarcissists,,1536060421.0,9cuqj7,"TL;DR : Addressing my nFather by his name has really helped sever the already frayed emotional ties I have to the man. Now Jim is just the guy that Mom and I take care of. 

I'm currently reading the story of Regina Calcaterra and the severely harsh upbringing she endured with her sisters and brother. In the book, ""Etched in Sand"" (and her sister Rosie's book, ""Girl Unbroken""), they called their mother ""Cookie"" because she was their mother in blood, but not in any other sense of the term. 

Now, I'd never say my upbringing was anywhere close to what those siblings went through, and I feel guilt even adapting this emotional tool from them, but in the passed two days I've mentally changed the way I think of my father from ""Dad"" to ""Jim"" has actually worked wonders. 

No more rabbit-hole thinking for me of, ""Dad's mad, what did I do? I just got home, I thought I did everything right today, why is he taking it out on me? Why is it always like this? Why does he hate me so much? My chest is tightening already - I hop he doesn't pick up on that, then he'll really go off."" 

Now it's just, ""Jim's silently fuming at us? That's just Jim for you. Jim's got issues that I can't help or fix. Whatever. I have some laundry to fold."" 

Has anyone else adapted this? "
4,Love Bombing HURTS,<praw.models.comment_forest.CommentForest object at 0x7fcfb2c034e0>,flare_of_light,0,19,272,False,raisedbynarcissists,Support,1536066938.0,9cvhxs,"So... my parents have been texting me recently. At first I got all excited because of course I love them and when dad text me to share an annecdote about his life I felt really happy and I missed them both and wanted to feel closer to them. 

But... when they do this, it usually means they either have bad news about someone I love or they've just given my sibling a massive present and they're messaging me to try and either let me know so I'll be hurt or maybe just to assuage their subconscious guilt. 

Anyway, following day I get mega love bombed, fished for information (they're on a pretty severe information diet) and get my spouse casually insulted by mum. Then I find out they've just bought my sibling (who they've been bank rolling at about $60,000 a year to study and not work - she's in her 30's and this is her third different qualification) a holiday to the west coast of America with her best friend because she got good grades. 

So I got proved right. Then I cried because I was right. 

Then I gaslit myself for the next three days that I'm being irrational and somehow this is all something wrong with my perception of the situation and that they're great. Thats still going on. I guess I still just want to be loved so much. Ugh.

Since I went v low contact I stopped getting cystic acne, stomach ulcers, depression & dissociative episodes. So clinging onto my improvement in health as evidence I'm not crazy and I'm doing the right thing by keeping the boundaries and the VLC rock solid. "
5,My Nparents resent me for being a successful and functioning adult,<praw.models.comment_forest.CommentForest object at 0x7fcfb2b39240>,LittleSeries,0,23,100,False,raisedbynarcissists,,1536080557.0,9cxkc2,"My family was very poor growing up. My Nfather is 55 and is a high school drop out. My Nmother is 59 and dropped out of college and hasn't had a job since the late 70's. Throughout my life they pushed me to go to college and get a degree because they said it was the key to success, but they really had no idea what any of it meant. Their highest aspirations for me were for me to go to community college maybe.

So basically I had 0 guidance in life on where to go. My parents were no help, they have no idea how the world works and make no effort to learn. I went through school and got a degree in CS. My first job was working help desk for $6 dollars an hour (I'm 34 so this was in the mid 2000's). I made less with a college a degree than without one stacking boxes at a grocery store.

But I fought and was driven to climb the corporate ladder. I self taught myself countless things, gained experienced, and then moved from job to job to gain more money. It took me 7 companies and well over a decade, but I finally became successful. I worked my ass off and now I make 6 figures working in my living room in a city I used to vacation in. I'm happily married to my wonderful wife and we have a great life 5 states away from the city I grew up in.

My parents should be proud of me right? Wrong. They call my wife and I ""snobs"". They guilt trip me for moving away all the time (they want me to live in their shit hole neighborhood with them). They give us backhanded remarks in a condescending tone like ""you're so fancy"" and ""you're riccchhhhh"". They don't even know what I do for a living or what my company's name is called. When they visit me they tell me ""I live in a bubble"" and other bizarre shit. I even caught my Nmother talking shit about me to my aunt because she accidentally dialed my number and left the disturbing shit on my voicemail.

Worst of all is that talk about my brother's job and how great he is constantly. He's 30 and lives at home and he's a janitor. They go on and on about how good his job is and how successful he is. They do this because they can control him because and thus he's the ""golden child"". Never mind the fact that he put a gun to my father's face and said he was going to kill him. They didn't press charges of course. After all this he is held in a higher regard than myself while they resent me for not being in their stable to mental illness.

They can resent me all they want, the best revenge is a life well lived."
6,"Nparents tried to villainize me to a friend's sibling, but they couldn’t keep from acting crazy and awful long enough for it to work.",<praw.models.comment_forest.CommentForest object at 0x7fcfb2c0d978>,incasethisgetsugly,0,7,79,False,raisedbynarcissists,Mommy’s little villain ,1536077680.0,9cx3f1,"Several months ago a friend’s brother ended up doing some maintenance work at my Nparents’ house. I’m NC, and have been for over a year. The first day they did a number on him saying that they were just so hurt that I wouldn’t return their calls and that they bought me some expensive gift and they just wanted to talk to me. Friend gets a call from her brother that night about how maybe I had gone too far and that friend needs to reach out to me on their behalf. She says no, and that I have my reasons end of conversation. Her brother goes back to their house the next day, and apparently thinking that he’s now on their side, they spend the entire day ranting about how I’m an “ungrateful fucking bitch” and just really letting all of their crazy awful behavior hang out. 
He called my friend at the end of that day to say that she had been right and that they’re nuts. 

Now, of course this is all secondhand from my friend, but it matches their behavior exactly. She said, “I didn’t want to tell you because I thought it would be upsetting hearing about them saying that stuff about you” and my response was “That sounds exactly like them”.
I’m just so glad that someone else got to see it. "
7,I can't believe nmom sold it...,<praw.models.comment_forest.CommentForest object at 0x7fcfb2ab0160>,lucid_shad0w,0,27,107,False,raisedbynarcissists,,1536072943.0,9cwcjs,"...Wait, yes I can, but I'm still mad.

When I was a kid, I was super into collecting Breyer horses (realistic model horses).  Knowing this, my grandfather offer to build me a custom barn to house them in.  He did an amazing job and presented it to me at Christmas.  It was awesome and got a ton of use.

Fast forward: As I'm moving out at 22, I took my Breyer horses with me but left the barn as it was large and my apartment was small.  Nmom at the time was storing all of my old toys in hopes that a grandchild would be able to play with them.  Nparents had a basement and even when I bought my first house it was in North Carolina and had no basement.  Believing that nmom was keeping all of my old toys, I didn't think much of it.

Fast forward some more: We move back up to Ohio so my daughter can be closer to all of her family.  Nmom start slowly giving out my old toys to her (of course, it's a little bit at a time as an ""excuse"" to see my daughter).  Last night, nmom gives my daughter all of the Breyer horse accessories then casually mentions that she had gotten rid of the barn because it was too big.  I sat that flabbergasted because that literally was the only thing I cared about, and she didn't keep it (i.e. she sold it, and pocketed the money).  


I'm still upset today.  I know it's just a thing, but it was the nicest thing my grandfather every gave me (he died in early 2013) and I was looking forward to seeing my daughter play with it.  If she would have said something that she didn't want to store it anymore, I would have gladly taken it off of her hands.  Rather, I'm assuming that she just wanted the money.  If I would have known this was going to happen, It would have been the first thing I'd have taken with me when I first moved out.  The hubby convinced me to email her about it, since it's apparently upsetting me this much.  We'll see how that goes...

​"
8,"“no one will ever love you, but your mother will always be there for you”",<praw.models.comment_forest.CommentForest object at 0x7fcfb2c0d7f0>,marshlovsky,0,33,131,False,raisedbynarcissists,,1536061541.0,9cuusy,"so me and my bf broke up and when my nmom found about it she started yelling at me and telling me that everything is my fault, that no one will ever love me, that she knew that will happen but she doesn’t wanna be mean :)
also she said „everyone will leave u and i will always be there supporting you because you’re my daughter” and im so scared. that sounds like a nightmare. she wants me to be completely dependent and wanna control all my life. 
she gaslighted me and mentioned her death (she knows my deepest fears, thanks to my ex therapist!) and it drives me crazy. 
im living in a constant fear and trauma. im all alone with her and i cant deal with suicidal thoughts and self harm. 
*sorry for my english, im shaking ughhh

"
9,"My parents placed a ridiculous punishment on me, I need desperate advice and help.",<praw.models.comment_forest.CommentForest object at 0x7fcfb2c09780>,RudeDelivery,0,21,65,False,raisedbynarcissists,,1536074217.0,9cwjpo,"I haven't been punished for my grades since middle school. Out of nowhere I'm obligated to have A in all classes and at least one B. the problem is i'm a shit student, but the punishment is far worse. Here it is:

I cannot use my phone anywhere. my mom said i could be slowly dying and she wouldn't give it to me to call 911

I cannot watch TV of any kind or Youtube

I cannot use the computer at all. This even applies to studying for god's sake

I cannot use my social media for whatever reason

I cannot purchase anything, even with my own money

I cannot leave the house except for school/job

I cannot have sugary foods/drinks

I cannot listen to music.

I cannot play video games.

I cannot message friends.

I cannot interact with my younger sibling if it means entertainment.

I cannot go outside.

I cannot complain or speak for myself unless asked.

I can only take one shower per day, and it can only be five mins. (i often take long showers to calm myself/escape my problems)

​

I refuse to refer to my parents as ""narcissistic"" but this is way over the line. I will admit video games primarily have been distracting me, but this is way too overboard. This applies to over the weekend was well. I refuse to call myself depressed, but i've attempted two on multiple occasions (two of recently) and i'm trying to get the balls to do it. The thing is, I feel they'll barely even revoke these rules if i ever do bring my grades up, especially the way they talk about it. My life has become go to school, pray to god i get good grades, come home, do homework and go to bed. That's my life and i'm fucking sick of it. I'm also and not going to be able to reply until tomorrow, when i'm back at school.

\-Sent via school computer

​

​"
