,title,comments,author,guilded,num_comments,score,pinned,subreddit,author_flair_text,created_utc,r_id
0,A good friend and neighbor recently passed away and left me 5% of his surprisingly large will. Now his adult son is suing me (Virginia).,<praw.models.comment_forest.CommentForest object at 0x7fcfaea25f28>,Iron__Maiden,0,121,2029,False,legaladvice,,1536067853.0,9cvmf2
1,DNA test proves man who paid $58k in child support isn't the dad,<praw.models.comment_forest.CommentForest object at 0x7fcfae7b9a20>,Pervymorganfreeman,0,1454,12711,False,news,,1536063724.0,9cv3fp
2,Aretha Franklin’s family found eulogy by Rev. Jasper Williams Jr. ‘distasteful’,<praw.models.comment_forest.CommentForest object at 0x7fcfae46af98>,Loracfro,0,2238,23353,False,news,,1536056849.0,9cudyg
3,TIL the historical inaccuracies in the movie U-571 caused so much controversy it ended up being condemned in British Parliament. Americans did not capture the Enigma machine. The code had been broken years before they entered the war.,<praw.models.comment_forest.CommentForest object at 0x7fcfae6ffe80>,WritingManBrit,0,3432,40514,False,todayilearned,,1536053979.0,9cu3y6
4,The EU and national funders launch a plan to make all publicly funded research available for free instead of scientific publications hiding it behind their pay walls.,<praw.models.comment_forest.CommentForest object at 0x7fcfaea41128>,Mrdontknowy,0,985,52337,False,worldnews,,1536058717.0,9cuk9u
5,"And this folks, is how gerrymandering works",<praw.models.comment_forest.CommentForest object at 0x7fcfae0c9080>,jackmedrek1,1,1899,27029,False,coolguides,,1536061633.0,9cuv4d
6,"European science funders ban grantees from publishing in paywalled journals - As of 2020, the group, which jointly spends around €7.6 billion on research annually, will require every paper it funds to be freely available from the moment of publication.",<praw.models.comment_forest.CommentForest object at 0x7fcfadda2ac8>,mvea,0,294,13171,False,Futurology,MD-PhD-MBA,1536062341.0,9cuxtp
7,What's technically true but extremely misleading?,<praw.models.comment_forest.CommentForest object at 0x7fcfadbd2940>,GeneReddit123,0,7307,19849,False,AskReddit,,1536033861.0,9cs8xt
8,Harry Potter fan doesn't recognize J.K Rowling,<praw.models.comment_forest.CommentForest object at 0x7fcfadac90b8>,UnlikelyJuice,0,462,8048,False,facepalm,,1536068794.0,9cvr4z
9,"LPT: if you see a TSA agent wearing a white shirt at airport security, get out of that line and go to someone with a blue shirt. White shirts are new hires and are in training.",<praw.models.comment_forest.CommentForest object at 0x7fcfad8f3c50>,PHATstuFF21,0,212,3365,False,LifeProTips,,1536070815.0,9cw19c
10,Immortality,<praw.models.comment_forest.CommentForest object at 0x7fcfad8eb470>,jurlo,0,354,25179,False,comics,Lord of the Gadflies,1536065818.0,9cvcpk
11,Grandmothers used to share old wive’s tales. Now they share fake news on social media.,<praw.models.comment_forest.CommentForest object at 0x7fcfad729f98>,hutimuti,0,743,42624,False,Showerthoughts,,1536058631.0,9cujyy
12,"Woman who alleges Mormon MTC president raped her is filmed testifying about him in church. Before she is forcibly removed from the pulpit, she warns the congregation that the church is harboring and protecting a rapist.",<praw.models.comment_forest.CommentForest object at 0x7fcfad59c748>,relevantlife,1,354,10492,False,TwoXChromosomes,All Hail Notorious RBG,1536052661.0,9ctzu6
13,"The wife and I got tattoos of a diagram depicting the position of the planets as they were the exact time we were married. Izic Woodall, Holy Grail Tattoo, Lakeland, Florida.",<praw.models.comment_forest.CommentForest object at 0x7fcfadd9a400>,ElephantErik,0,173,20496,False,tattoos,,1536011808.0,9cpmrr
14,"You'll get $100.000 if you binge-watch the same movie for a week straight with only 4h sleep a night, what movie do you pick?",<praw.models.comment_forest.CommentForest object at 0x7fcfad596898>,Caboucha,0,16246,42493,False,AskReddit,,1536009938.0,9cpe0d
15,"After seeing much debate about what truck drivers can/can’t see while behind the wheel, I thought I’d give everyone a little perspective.",<praw.models.comment_forest.CommentForest object at 0x7fcfad328e48>,vovan45619,0,876,12176,False,IdiotsInCars,,1536066560.0,9cvg50
16,laughs in Britain,<praw.models.comment_forest.CommentForest object at 0x7fcfad009b38>,NotOlafFromFrozen,0,491,22256,False,HistoryMemes,,1536054825.0,9cu6tg
17,Anon has a stressful day at work,<praw.models.comment_forest.CommentForest object at 0x7fcfad060358>,autonova3,0,192,18067,False,greentext,,1536055716.0,9cua36
18,Wookiee cookies,<praw.models.comment_forest.CommentForest object at 0x7fcfad05b278>,Gamurboy,0,115,8135,False,StarWars,,1536057616.0,9cugl7
19,"Guys, I've been noticing a pattern here...",<praw.models.comment_forest.CommentForest object at 0x7fcfacd630b8>,wojtek2000,0,541,10394,False,PoliticalHumor,,1536060339.0,9cuq8r
20,What is the strangest experience you have had with a friend's parent?,<praw.models.comment_forest.CommentForest object at 0x7fcfaccb7550>,hobb_function,0,850,1245,False,AskReddit,,1536058282.0,9cuit9
21,Local Fish and Chip shop firing back,<praw.models.comment_forest.CommentForest object at 0x7fcfaea57780>,LegitimateDinosaur,0,443,22032,False,MurderedByWords,,1536056775.0,9cudq5
22,A young couple dies on their way to their wedding....,<praw.models.comment_forest.CommentForest object at 0x7fcfae77b908>,CHChevrolet,0,121,4617,False,Jokes,,1536061392.0,9cuu7r
23,Sidecar co-pilots hugging the corners at the Scarborough Gold Cup.,<praw.models.comment_forest.CommentForest object at 0x7fcfaccb7d68>,PHIL-yes-PLZ,0,459,18121,False,sports,,1536065002.0,9cv8wv
24,PlayStation 2 repair services close in Japan. Sony ends its repair service for the PS2 more than 18 years after the console went on sale.,<praw.models.comment_forest.CommentForest object at 0x7fcfae8bbe48>,ConsciousDepth,0,923,32298,False,technology,,1536053369.0,9cu1xv
25,My Grandpa turned 100 last week. He stayed up until midnight to see off the last century on his flip phone.,<praw.models.comment_forest.CommentForest object at 0x7fcfaed25390>,carryme-ohio,0,852,61699,False,pics,,1536059833.0,9cuoeo
26,Preferred alcoholic beverage by country in Europe: 1990 vs. 2015 [OC],<praw.models.comment_forest.CommentForest object at 0x7fcfb5ab74a8>,NaytaData,0,678,8494,False,dataisbeautiful,OC: 17,1536067093.0,9cvin7
27,TIFU by posting on Reddit,<praw.models.comment_forest.CommentForest object at 0x7fcfb7ab6b00>,The-Co-Commentator,0,143,2289,False,tifu,,1536065658.0,9cvbz2
28,A blind man walks into a gay bar.,<praw.models.comment_forest.CommentForest object at 0x7fcfb7708f60>,NoEmploy2,0,288,12999,False,Jokes,,1536055924.0,9cuatz
29,Narrow-Minded Award 2008,<praw.models.comment_forest.CommentForest object at 0x7fcfaf7159e8>,unknown_human,0,508,28300,False,gaming,,1536058220.0,9cuill
30,I want to befriend a crow. What's the best way of doing it?,<praw.models.comment_forest.CommentForest object at 0x7fcfaf588a20>,Badgercat1,0,375,4118,False,NoStupidQuestions,,1536053586.0,9cu2mj
31,How simple pieces of wood and hinges makes a basic mechanical binary counter,<praw.models.comment_forest.CommentForest object at 0x7fcfb6508e80>,Mass1m01973,0,144,11841,False,mechanical_gifs,,1536048849.0,9cto4l
32,Someone at the construction company really loved Space Invaders,<praw.models.comment_forest.CommentForest object at 0x7fcfb6439978>,-sUBzERoo-,0,141,11324,False,gaming,,1536065352.0,9cvajf
33,Bonfire at Burningman,<praw.models.comment_forest.CommentForest object at 0x7fcfb43c2e80>,Rawalmond73,0,204,7445,False,interestingasfuck,,1536062256.0,9cuxh5
34,"Happy 20th Birthday Google (September 4, 1998). I was a part of Keyhole and the launch of Google Maps and Google Earth and wrote a book about it. AMA.",<praw.models.comment_forest.CommentForest object at 0x7fcfb26660f0>,BillyK_NeverLost,0,435,2154,False,IAmA,,1536064430.0,9cv6d2
35,The guy who wore a Pepsi shirt to the World of Coca-Cola museum.,<praw.models.comment_forest.CommentForest object at 0x7fcfb77793c8>,zerotolerance40,0,401,14689,False,firstworldanarchists,,1536061882.0,9cuw2k
36,Thanks for the help dad,<praw.models.comment_forest.CommentForest object at 0x7fcfafc9af60>,Tucko29,0,76,7686,False,ChildrenFallingOver,,1536059378.0,9cumqt
37,Building and improving on existing D/ST projections,<praw.models.comment_forest.CommentForest object at 0x7fcfafc7a080>,quickonthedrawl,3,201,2196,False,fantasyfootball,FantasyBro & 2012 Accuracy Challenge - Top 10 Cumulative,1536064269.0,9cv5of
38,"He didn’t do his part on the group project, gets mad that other group does not let him in and I won’t put his name on the paper (I ended up doing all the work).",<praw.models.comment_forest.CommentForest object at 0x7fcfb5c31f28>,peiattention,0,1165,36673,False,ChoosingBeggars,,1536026562.0,9crg7x
39,Best Mashup!,<praw.models.comment_forest.CommentForest object at 0x7fcfb7992eb8>,najmussajid,0,65,7132,False,freefolk,,1536058483.0,9cujh6
40,"Report: Hole in Soyuz Spacecraft Caused by Drill, Not Debris Strike",<praw.models.comment_forest.CommentForest object at 0x7fcfb2437828>,universal_native,0,672,5677,False,space,,1536053345.0,9cu1up
41,"In honour of Move-In Day, RAs of Reddit, what’s the worst parent/student separation you’ve seen?",<praw.models.comment_forest.CommentForest object at 0x7fcfb2dfee48>,hubbertpuff,0,1019,2770,False,AskReddit,,1536012665.0,9cpqos
42,Skyrim Security,<praw.models.comment_forest.CommentForest object at 0x7fcfb775f0f0>,altec98,0,445,17610,False,gaming,,1536055088.0,9cu7q6
43,Can GateKeeping be good? *Found it on a chat group don't know who to credit*,<praw.models.comment_forest.CommentForest object at 0x7fcfad33a940>,Light05,0,504,14904,False,gatekeeping,,1536050585.0,9cttdz
44,Kid throws garbage on bus. Gets rocked.,<praw.models.comment_forest.CommentForest object at 0x7fcfb02e1e80>,bursatele,0,427,3354,False,PublicFreakout,,1536067525.0,9cvkm6
45,My wife died this weekend. How do I find out what kind of debt she had or retirement accounts she started?,<praw.models.comment_forest.CommentForest object at 0x7fcfb5980860>,clownsoup,0,86,814,False,personalfinance,,1536067508.0,9cvkm8
46,Get a female roommate they said,<praw.models.comment_forest.CommentForest object at 0x7fcfb7985f28>,Scaulbylausis,0,1822,35833,False,WatchPeopleDieInside,,1536039168.0,9csrxc
47,Saudi Arabia declares online satire punishable offence,<praw.models.comment_forest.CommentForest object at 0x7fcfb48194e0>,DoremusJessup,0,179,2850,False,nottheonion,,1536073922.0,9cwi0q
48,2meirl4meirl,<praw.models.comment_forest.CommentForest object at 0x7fcfb46f1780>,neohail,0,37,9124,False,2meirl4meirl,,1536045267.0,9ctcft
49,Girl sews corn into her hair to make cornrows,<praw.models.comment_forest.CommentForest object at 0x7fcfb4832668>,O-shi,1,890,21547,False,blackpeoplegifs,,1536055081.0,9cu7oe
50,I'm guessing Hermes Deliveries are so named because Hermes was the Greek god of taking the fucking piss.,<praw.models.comment_forest.CommentForest object at 0x7fcfb4501e48>,wormwood_pearl,0,150,2690,False,britishproblems,Edinburgh,1536047567.0,9ctjxc
51,New Image from Netflix's Cult-Thriller 'Apostle' - Starring Dan Stevens & Directed by Gareth Evans ('The Raid'),<praw.models.comment_forest.CommentForest object at 0x7fcfb02d89e8>,BunyipPouch,0,260,5445,False,movies,,1536058747.0,9cukdd
52,Just Do It!,<praw.models.comment_forest.CommentForest object at 0x7fcfae789e48>,aegist1,0,149,2187,False,PoliticalHumor,,1536065722.0,9cvcan
53,"Don’t play with fire. But when you do, make it good.",<praw.models.comment_forest.CommentForest object at 0x7fcfaf648c18>,mcsabas,0,263,22808,False,oddlysatisfying,,1536052898.0,9cu0g3
54,This asshole needed MORE room to look out...,<praw.models.comment_forest.CommentForest object at 0x7fcfb6b8ce80>,jennthemermaid,0,115,12421,False,AnimalsBeingJerks,,1536059598.0,9cunjb
55,US nurse discovers colleague doctor was premature baby she cared for 28 years ago.,<praw.models.comment_forest.CommentForest object at 0x7fcfaf64e518>,abdilatifysh,0,791,72381,False,aww,,1536053855.0,9cu3jb
56,"From the dinosaurs' point of view,Humans are basically post-apocalyptical mutants.",<praw.models.comment_forest.CommentForest object at 0x7fcfb4bfd748>,Wikij_88,0,154,5218,False,Showerthoughts,,1536060670.0,9curh4
57,(Whore),<praw.models.comment_forest.CommentForest object at 0x7fcfb25bca58>,Terralbarn,0,118,3418,False,Badfaketexts,,1536057986.0,9cuhtc
58,College Football Empires Map (Formerly Imperialism Map) Week 1,<praw.models.comment_forest.CommentForest object at 0x7fcfafc0df28>,nbingham196,0,736,2675,False,CFB,Tennessee Volunteers / /r/CFB Top Scorer,1536067227.0,9cvj9y
59,Wes Andersons evil twin might like it here...,<praw.models.comment_forest.CommentForest object at 0x7fcfae9858d0>,Thedham,0,99,5000,False,evilbuildings,,1536064340.0,9cv5zd
60,Filming for the upcoming Spiderman film in London. (NO SPOILERS),<praw.models.comment_forest.CommentForest object at 0x7fcfae98a400>,Uhtred101,0,340,2909,False,marvelstudios,,1536060463.0,9cuqml
61,"Look, it’s a little human.",<praw.models.comment_forest.CommentForest object at 0x7fcfafbfb128>,deathakissaway,0,604,42664,False,aww,,1536043668.0,9ct6w5
62,How can you be so delusional?,<praw.models.comment_forest.CommentForest object at 0x7fcfb4aff048>,karriSSS,0,496,9410,False,insanepeoplefacebook,,1536045799.0,9cte54
63,when the dog saw his old friend,<praw.models.comment_forest.CommentForest object at 0x7fcfaeb66f28>,tiktokreallyfunny,0,72,7903,False,AnimalsBeingBros,,1536064607.0,9cv75c
64,"Came across this gem on whisper. She keeps writing posts about how she’s too big to wipe and is tired of getting shit for it. Then she reposted this convo for some reason, to prove her point?",<praw.models.comment_forest.CommentForest object at 0x7fcfb27aacf8>,TamerOfStrange93,0,366,4279,False,trashy,,1536059983.0,9cuoyl
65,Can we use Moons gravity to generate electricity?,<praw.models.comment_forest.CommentForest object at 0x7fcfb432a3c8>,noximo,0,169,1014,False,askscience,,1536066523.0,9cvfz9
66,Woman falls through the ceiling in convenience store (Metal Gear Version),<praw.models.comment_forest.CommentForest object at 0x7fcfae7927b8>,yothisisyo,0,450,7886,False,videos,,1536050571.0,9cttc9
67,Large ship comes loose in Osaka typhoon. Just happened.,<praw.models.comment_forest.CommentForest object at 0x7fcfb261a588>,Crkilla414,0,142,3317,False,CatastrophicFailure,,1536043683.0,9ct6vf
68,"Pakistan's Hidden Shame (2017) - ""In a society where women are hidden from view and young girls deemed untouchable, the bus stations, truck stops and alleyways have become the hunting ground for perverted men to prey on the innocent."" [46:55]",<praw.models.comment_forest.CommentForest object at 0x7fcfb261acf8>,pot09,0,587,2366,False,Documentaries,,1536052151.0,9ctyal
69,Volvo's collision detection fails during a press event,<praw.models.comment_forest.CommentForest object at 0x7fcfae4f2780>,biscuitboy2002,0,105,2112,False,shittyrobots,,1536066300.0,9cvezf
70,"Destiny arrives all the same. And now, it's here. Or should I say... someBODY",<praw.models.comment_forest.CommentForest object at 0x7fcfb2788748>,actuallydavide,0,149,13683,False,thanosdidnothingwrong,Saved by Thanos,1536056493.0,9cucqz
71,Baby learned to wave.,<praw.models.comment_forest.CommentForest object at 0x7fcfaeec45f8>,ImaginingDragon,0,53,3139,False,MadeMeSmile,,1536068740.0,9cvqux
72,"The Italian geneticist who dismantled the concept of «race». Luigi Luca Cavalli Sforza, author of 'Who are we? History of human diversity', died today aged 96 in Belluno",<praw.models.comment_forest.CommentForest object at 0x7fcfb21077b8>,Al-hazred7,0,923,3598,False,europe,,1536045599.0,9ctdjc
73,Her kid is just dismantling our education system on his first day of eighth grade.,<praw.models.comment_forest.CommentForest object at 0x7fcfafdfcc18>,DexterSununu,0,228,3549,False,thatHappened,,1536061413.0,9cuubb
74,Play it safe guys,<praw.models.comment_forest.CommentForest object at 0x7fcfb28d9e10>,Petaaa,0,108,12306,False,dankchristianmemes,,1536048484.0,9ctmxr
75,Thought you guys would appreciate this Advance Wars press kit as only 50 were made,<praw.models.comment_forest.CommentForest object at 0x7fcfae84b7b8>,GamesConnectionUK,0,113,5056,False,nintendo,,1536054912.0,9cu72a
76,Electric eel power demonstration using LEDs,<praw.models.comment_forest.CommentForest object at 0x7fcfb28ebe10>,beingjac,0,789,35002,False,interestingasfuck,,1536036580.0,9csitw
77,"TIL that in ancient Rome, commoners would evacuate entire cities in acts of revolt called ""Secessions of the Plebeians"", leaving the elite in the cities to fend for themselves",<praw.models.comment_forest.CommentForest object at 0x7fcfb61f4208>,Pjotr_Bakunin,0,4664,99506,False,todayilearned,,1536013768.0,9cpvk2
78,"[Serious] Do all ""grown"" adults feel like they're still faking ""adulting,"" and if so, why is that the case?",<praw.models.comment_forest.CommentForest object at 0x7fcfb7ad59e8>,jdogsmith231,1,1191,3201,False,AskReddit,,1536036882.0,9csjvl
79,Found in a Facebook group,<praw.models.comment_forest.CommentForest object at 0x7fcfae8adf60>,Milvus-Milvus,0,64,3097,False,oldpeoplefacebook,,1536072437.0,9cw9rb
80,Throwing out your dirty nike shoes isn’t a boycott,<praw.models.comment_forest.CommentForest object at 0x7fcfb28eb470>,Lik78,0,651,42176,False,BlackPeopleTwitter,,1536027502.0,9crk3k
81,What's she on about??,<praw.models.comment_forest.CommentForest object at 0x7fcfb870ecf8>,municipalplant,0,165,7554,False,funny,,1536057781.0,9cuh5b
82,"Buzz Aldrin slams 'First Man' movie controversy, posts photos of US flag on moon with 'Proud to be American' hashtag",<praw.models.comment_forest.CommentForest object at 0x7fcfaf75e128>,MotoTango,1,4113,18909,False,news,,1536018867.0,9cqi6t
83,"People who are more well-off were made happier buying experiences over material things (the “experiential advantage”) but this is not universal - the less well-off get equal or more happiness from buying material things, suggests a new study.",<praw.models.comment_forest.CommentForest object at 0x7fcfb8703dd8>,mvea,0,83,1569,False,science,MD-PhD-MBA | Clinical Professor/Medicine,1536064941.0,9cv8lu
84,This rainbow around the airplane’s shadow,<praw.models.comment_forest.CommentForest object at 0x7fcfb861b358>,smasxer,0,299,29267,False,mildlyinteresting,,1536054460.0,9cu5ma
85,SLPT:,<praw.models.comment_forest.CommentForest object at 0x7fcfb81e1fd0>,Kibbaa,0,95,9386,False,ShittyLifeProTips,,1536056226.0,9cubvw
86,DickTricklez doing the Lord's work,<praw.models.comment_forest.CommentForest object at 0x7fcfae85cf28>,aeternavindictus,0,71,4677,False,PornhubComments,,1536056229.0,9cubw8
87,"This scenery was pitch black until the northern lights showed up. Off the beaten track in Lofoten, Norway. [OC] [2048x1375]",<praw.models.comment_forest.CommentForest object at 0x7fcfb7ffae48>,Fishermang,1,115,15120,False,EarthPorn,,1536055360.0,9cu8rx
88,"Found an old thrift store painting for $5, so I decided to spice it up a bit. ""Le restaurant de Bob en France avec les Burgers"" (16x20) - Acrylic on Unknown",<praw.models.comment_forest.CommentForest object at 0x7fcfb80006d8>,namdaman5601,0,119,5216,False,BobsBurgers,,1536066353.0,9cvf85
89,Spaghetti Westerns Were a Glorious Moment in Wild West Movies,<praw.models.comment_forest.CommentForest object at 0x7fcfaf770390>,BunyipPouch,0,672,8907,False,movies,,1536038157.0,9csojl
90,Slovenia is a Beautiful place to hike in the summer,<praw.models.comment_forest.CommentForest object at 0x7fcfb7f3a0b8>,TheRealSlimRavi,0,125,5934,False,travel,,1536056709.0,9cudi6
91,18-22,<praw.models.comment_forest.CommentForest object at 0x7fcfb788fd30>,hathasandey,0,36,3729,False,WhitePeopleTwitter,,1536066248.0,9cveqr
92,Worth dying for,<praw.models.comment_forest.CommentForest object at 0x7fcfb789b128>,MageLight25,0,531,27350,False,Tinder,,1536038678.0,9csqbw
93,Coming out of the woods.,<praw.models.comment_forest.CommentForest object at 0x7fcfb7697d30>,deathakissaway,0,105,10057,False,pics,,1536057494.0,9cug5r
94,This dog fight that suddenly turns into a Waltz,<praw.models.comment_forest.CommentForest object at 0x7fcfb782fcc0>,jokermoonbow,0,304,36404,False,funny,,1536053969.0,9cu3x5
95,Meirl,<praw.models.comment_forest.CommentForest object at 0x7fcfb782fd68>,Damnit_Dogz,0,79,5049,False,meirl,,1536055411.0,9cu8yl
96,"Small dog saves girl, 11, from being abducted by man in Pasadena, family says",<praw.models.comment_forest.CommentForest object at 0x7fcfb7436978>,Sariel007,0,74,2231,False,UpliftingNews,,1536064293.0,9cv5sg
97,Trump's tweet attacking the DoJ for investigating Republicans may be an impeachable offense,<praw.models.comment_forest.CommentForest object at 0x7fcfb7307fd0>,ghqwertt,0,105,1263,False,RussiaLago,,1536064165.0,9cv59t
98,"""if she breathes"" starter packs",<praw.models.comment_forest.CommentForest object at 0x7fcfb72ba7f0>,Harald12,0,215,3275,False,starterpacks,,1536059936.0,9cuosv
99,Customer Service,<praw.models.comment_forest.CommentForest object at 0x7fcfb72a7ac8>,squirrelgirlquirrel,0,226,12398,False,tumblr,,1536024456.0,9cr71u
