,title,comments,author,guilded,num_comments,score,pinned,subreddit,author_flair_text,created_utc
0,Rio’s 200 year old national museum hit by massive fire,<praw.models.comment_forest.CommentForest object at 0x7faf853d4c50>,nostrawberries,0,960,18149,False,worldnews,,1535934131.0
1,(WA) Neighbor who took cringe pictures with my car ia threatening me for “ruining his reputation”,<praw.models.comment_forest.CommentForest object at 0x7faf846d4cf8>,Weirdo9090,0,69,5626,False,legaladvice,,1535898775.0
2,[Colorado] Guy threatening my family to my mother,<praw.models.comment_forest.CommentForest object at 0x7faf84598f98>,momlegalthrow1,0,66,1672,False,legaladvice,,1535901902.0
3,"What moment in video games made you go ""fuck this""?",<praw.models.comment_forest.CommentForest object at 0x7faf846a36d8>,EarlyTransportation,0,21538,33830,False,AskReddit,,1535888169.0
4,Woman claimed her dog turned vegetarian and didn’t crave meat anymore. Dog proves her stupidity.,<praw.models.comment_forest.CommentForest object at 0x7faf844ca978>,dickfromaccounting,0,1096,19252,False,facepalm,,1535938865.0
5,"When sign language users are medically confused, have dementia, or have mental illnesses, is sign language communication affected in a similar way speech can be? I’m wondering about things like “word salad” or “clanging”.",<praw.models.comment_forest.CommentForest object at 0x7faf844a5ac8>,AngrySnowglober,0,133,3100,False,askscience,,1535932802.0
6,You spelled “nudes” wrong,<praw.models.comment_forest.CommentForest object at 0x7faf8485be10>,mootjuggler,0,823,81132,False,funny,,1535936544.0
7,Littering out of a Taxi,<praw.models.comment_forest.CommentForest object at 0x7faf846916a0>,Gridelin,0,534,28674,False,Unexpected,,1535932372.0
8,"New experimental painkiller is like stronger morphine without the addiction: The drug, called AT-121, targets the same opioid receptors in the brain but also latches on to nociception receptors, that block the brain’s addiction-forming response, in a primate study in Science Translational Medicine.",<praw.models.comment_forest.CommentForest object at 0x7faf8403c8d0>,mvea,0,1215,20973,False,science,MD-PhD-MBA | Clinical Professor/Medicine,1535922670.0
9,Amazing Slim Shady drawing,<praw.models.comment_forest.CommentForest object at 0x7faf83eba358>,dickfromaccounting,0,198,15271,False,interestingasfuck,,1535937453.0
10,Illegal picture taken inside the US Supreme Court in 1932. Dr. Erich Salomon faked a broken arm so he could hide a camera in his cast.,<praw.models.comment_forest.CommentForest object at 0x7faf85403a20>,etymologynerd,0,964,54750,False,pics,,1535924976.0
11,"I guess we are adopting you today, Ms. Stray Cat",<praw.models.comment_forest.CommentForest object at 0x7faf83b8cc18>,bhudzieeeee,0,129,8034,False,aww,,1535934836.0
12,Flat earthers must be afraid that meteorites could hit the earth from underneath.,<praw.models.comment_forest.CommentForest object at 0x7faf83b82278>,TUNNY19,0,692,20624,False,Showerthoughts,,1535927488.0
13,"TIL that even though daddy-long-leg spiders don't have powerful enough venom to harm humans, they hunt and kill larger spiders that can kill humans, like the redback spider. They use their long legs to quickly wrap other spiders with webbing, immobilizing them before biting and eating them.",<praw.models.comment_forest.CommentForest object at 0x7faf839c7940>,UPPERCASE_THOUGHTS,0,893,23360,False,todayilearned,,1535930248.0
14,All 153 Disses on Eminem's album Kamikaze Counted and Categorized [OC],<praw.models.comment_forest.CommentForest object at 0x7faf839c7780>,theonlydjorkaeff1,0,1882,24816,False,dataisbeautiful,OC: 24,1535929671.0
15,What do you need a compliment on that would make your day better?,<praw.models.comment_forest.CommentForest object at 0x7faf8385d240>,your_nameless_friend,12,10986,43190,False,AskReddit,,1535903674.0
16,Amazing Slim Shady drawing,<praw.models.comment_forest.CommentForest object at 0x7faf83df9240>,dickfromaccounting,0,618,36096,False,BeAmazed,,1535937469.0
17,Cowardly actions of a cowardly group - Update Video,<praw.models.comment_forest.CommentForest object at 0x7faf83331f28>,PoliceAlarm,0,319,4902,False,videos,,1535932971.0
18,If I’m not happy you can’t be happy either!,<praw.models.comment_forest.CommentForest object at 0x7faf831ccdd8>,flyoverthemooon,0,886,31749,False,WhitePeopleTwitter,,1535931492.0
19,Eminem releases “Kamikaze” (2018),<praw.models.comment_forest.CommentForest object at 0x7faf83331e48>,hoodja42,0,470,11814,False,fakehistoryporn,,1535934638.0
20,Did I ask? No!,<praw.models.comment_forest.CommentForest object at 0x7faf82f6da20>,goosechaser95,0,442,5151,False,ChoosingBeggars,,1535926048.0
21,"Those who have weird neighbors, what does your neighbor do that is weird or creepy?",<praw.models.comment_forest.CommentForest object at 0x7faf82f6d978>,Cringer90,0,8103,18650,False,AskReddit,,1535893928.0
22,When I ask mom what we're having for dinner,<praw.models.comment_forest.CommentForest object at 0x7faf82f6df60>,n1407,1,144,23301,False,PrequelMemes,,1535922293.0
23,Steve Carell mirin his wife,<praw.models.comment_forest.CommentForest object at 0x7faf82be00b8>,TetrisIsTotesSuper,0,170,7186,False,pics,,1535922878.0
24,My husband and in-laws wanted a family photo while I was in labor and having contractions,<praw.models.comment_forest.CommentForest object at 0x7faf8478e588>,ashrychel,3,3734,125880,False,funny,,1535914428.0
25,Petty payback,<praw.models.comment_forest.CommentForest object at 0x7faf82998e10>,ThickCapital,0,782,49452,False,BlackPeopleTwitter,,1535924559.0
26,Tony is going to have a great time,<praw.models.comment_forest.CommentForest object at 0x7faf82834fd0>,Anti-MonitorXXX,0,106,8325,False,thanosdidnothingwrong,Saved by Thanos,1535935194.0
27,(NSFW) What’s the worst thing you have witnessed at a bachelor/bachelorette party?,<praw.models.comment_forest.CommentForest object at 0x7faf82792f98>,Tassimo1,0,2098,4135,False,AskReddit,,1535906894.0
28,Was excited for the extra drawer space outside our bathroom in the new house. But I let my wife choose her side first.,<praw.models.comment_forest.CommentForest object at 0x7faf82792f60>,MilkCanMatt,0,413,24389,False,mildlyinfuriating,,1535922989.0
29,New player accidentally kills child.,<praw.models.comment_forest.CommentForest object at 0x7faf828349e8>,GladiatorJustin,0,101,5780,False,DnDGreentext,,1535909664.0
30,Noob vs Pro (GTA V),<praw.models.comment_forest.CommentForest object at 0x7faf8244f390>,Adlinaa,0,175,11834,False,gaming,,1535926428.0
31,"Remember that, fellas!",<praw.models.comment_forest.CommentForest object at 0x7faf823a5160>,n00b491,0,291,26387,False,wholesomebpt,,1535918550.0
32,I wanted someone different...,<praw.models.comment_forest.CommentForest object at 0x7faf82288b38>,Gawd_of_oh_Lawd,0,230,10365,False,PoliticalHumor,,1535934269.0
33,I had to do it,<praw.models.comment_forest.CommentForest object at 0x7faf8228ea20>,travtron45,0,574,27568,False,Tinder,,1535924507.0
34,Kevin had just gotten a new car and was out for a drive,<praw.models.comment_forest.CommentForest object at 0x7faf823a55f8>,coelacyanth,0,207,8970,False,Jokes,,1535918794.0
35,to all dota and fortnite fans,<praw.models.comment_forest.CommentForest object at 0x7faf826e5240>,Lord_of_theDarkness,0,802,18870,False,gaming,,1535932022.0
36,"LPT: If your partner is always doing something specific to make your life better, try doing the exact thing for them sometimes. We often give best what we need most.",<praw.models.comment_forest.CommentForest object at 0x7faf81f37f98>,Praha3,0,100,6836,False,LifeProTips,,1535917321.0
37,And he could go on...,<praw.models.comment_forest.CommentForest object at 0x7faf81e8a5f8>,bene_dictum,0,760,10335,False,MurderedByWords,,1535939514.0
38,What are some cliche things that people do in real life only because they've seen it done before in movies?,<praw.models.comment_forest.CommentForest object at 0x7faf84814cf8>,HaveHacks,0,8176,15095,False,AskReddit,,1535896572.0
39,[Homemade] Salsa fresca,<praw.models.comment_forest.CommentForest object at 0x7faf81ddaf60>,PooYaKasha,0,451,14729,False,food,,1535930003.0
40,Cards Against Humanity - 90s pack.,<praw.models.comment_forest.CommentForest object at 0x7faf81999f98>,spicerldn,0,17,4316,False,tumblr,,1535930392.0
41,All kids are the same no matter the species..,<praw.models.comment_forest.CommentForest object at 0x7faf820c5d30>,antonyhayden,0,329,43595,False,aww,,1535927953.0
42,TIL that Bhutan is the only country in the world whose nature converts more CO2 than the land itself produces.,<praw.models.comment_forest.CommentForest object at 0x7faf8481c6a0>,CooperDE,0,188,6842,False,todayilearned,,1535927304.0
43,I still think this is the best introduction of a re-casted character I’ve ever seen.,<praw.models.comment_forest.CommentForest object at 0x7faf81789320>,Randylahey117,0,673,19167,False,marvelstudios,Doctor Strange,1535909572.0
44,Artificial waterfall,<praw.models.comment_forest.CommentForest object at 0x7faf8177d080>,WhiteShaneDiesel,0,506,24020,False,interestingasfuck,,1535930361.0
45,Has anyone tried to make a wiki for this sub?,<praw.models.comment_forest.CommentForest object at 0x7faf8150ef60>,SO1D,0,32,610,False,outside,,1535933183.0
46,World’s Largest Ocean Cleanup System Is Finally Ready to Launch,<praw.models.comment_forest.CommentForest object at 0x7faf8177d048>,Elliottafc,0,148,5973,False,UpliftingNews,,1535927985.0
47,DUI arrests cut in half since ride-sharing began in Louisville,<praw.models.comment_forest.CommentForest object at 0x7faf8141fe80>,Quiglius,0,1109,28465,False,news,,1535912172.0
48,FINISH HIM,<praw.models.comment_forest.CommentForest object at 0x7faf8152ae48>,4fxsake,0,258,17650,False,funny,,1535926410.0
49,The Wasp cosplay by Chris Lee,<praw.models.comment_forest.CommentForest object at 0x7faf811ced68>,ForSucksFake,0,136,13936,False,gifs,,1535929542.0
50,hmmm (@lushux),<praw.models.comment_forest.CommentForest object at 0x7faf8481ccc0>,delroydz,0,585,14395,False,pics,,1535922949.0
51,"Zookeeper here, first time poster, too! Thought our new Sable Antelope calf would be well received here :)",<praw.models.comment_forest.CommentForest object at 0x7faf810889e8>,prizedsheep,0,96,6041,False,aww,,1535939498.0
52,"In the latest episode of “Should I call the police?” LAOP found a chat thread on his mum’s computer where she’s arranging a hit on him and his pregnant wife. Yes, LAOP, yes you should.",<praw.models.comment_forest.CommentForest object at 0x7faf80fb1518>,TitchyBeacher,0,148,1936,False,bestoflegaladvice,Super Jealous,1535926820.0
53,Finally found the perfect stick,<praw.models.comment_forest.CommentForest object at 0x7faf80fa5f98>,dinglehoppercomb,0,200,13348,False,aww,,1535929921.0
54,*posting this on reddit to get 4 karma*,<praw.models.comment_forest.CommentForest object at 0x7faf8141f4a8>,IcanSoSitHereAndCry,0,265,11595,False,creepyasterisks,,1535927779.0
55,Don’t ever change,<praw.models.comment_forest.CommentForest object at 0x7faf80e15a90>,CygnusBC,0,73,2282,False,im14andthisisdeep,,1535934761.0
56,If you keep a baseball bat,<praw.models.comment_forest.CommentForest object at 0x7faf848344e0>,gildhninjas,0,232,4278,False,funny,,1535930756.0
57,You become an adult once your bed goes from the corner of your room to the middle,<praw.models.comment_forest.CommentForest object at 0x7faf80da2be0>,epic_cake101,0,360,6733,False,Showerthoughts,,1535926756.0
58,Tinder but FaceTime where you have to say yes or no to their face,<praw.models.comment_forest.CommentForest object at 0x7faf80c69f60>,nebsA1,0,45,1238,False,CrazyIdeas,,1535938580.0
59,Good fences make good neighbours!,<praw.models.comment_forest.CommentForest object at 0x7faf80c06b00>,AppleGuy53,0,584,78810,False,wholesomememes,,1535918923.0
60,Anddddd the mother of the year award goes to... definitely not this chick.,<praw.models.comment_forest.CommentForest object at 0x7faf81a58048>,conez420,0,401,8338,False,iamatotalpieceofshit,,1535911660.0
61,THE BEACONS OF HYRULE ARE LIT,<praw.models.comment_forest.CommentForest object at 0x7faf809c1f60>,charmcitizen,3,120,3896,False,Breath_of_the_Wild,,1535934653.0
62,TIL The 2 % failure rate for Condoms means that for every 100 couples using them for 1 year 2 will get pregnant and not 2 times per 100 intercourses.,<praw.models.comment_forest.CommentForest object at 0x7faf80d73f28>,JonSnowKnowsNuffin,0,1687,37090,False,todayilearned,,1535909808.0
63,When I cheerfully greet a customer and they ignore me,<praw.models.comment_forest.CommentForest object at 0x7faf80859f28>,sintaroactual,0,249,20123,False,DunderMifflin,got fully dissadulated,1535918330.0
64,Just a reminder of a certain email sent to a certain lawyer concerning a certain presidential candidate,<praw.models.comment_forest.CommentForest object at 0x7faf80da2940>,blewupmyspot,0,349,9032,False,The_Mueller,,1535920476.0
65,"Thanks, Mom",<praw.models.comment_forest.CommentForest object at 0x7faf80917e48>,uncom4table,0,108,5212,False,WhitePeopleTwitter,,1535926542.0
66,"Ouroboros, Digital, 7""x10""",<praw.models.comment_forest.CommentForest object at 0x7faf80541c50>,chunlo,0,151,12908,False,Art,,1535932878.0
67,"Such athleticism, much wow !",<praw.models.comment_forest.CommentForest object at 0x7faf805584a8>,pp0787,0,100,14181,False,BetterEveryLoop,,1535917934.0
68,"Petition to have our logo be the same, but with the planet tilted the other way",<praw.models.comment_forest.CommentForest object at 0x7faf847a0390>,DawsTheB0ss,1,423,40631,False,madlads,,1535918361.0
69,Unidos,<praw.models.comment_forest.CommentForest object at 0x7faf80418ac8>,El-Discrepador,0,100,7761,False,LatinoPeopleTwitter,Born to be an incomprendido,1535924248.0
70,I’m still on the fence.,<praw.models.comment_forest.CommentForest object at 0x7faf8036e160>,TheAmericanWay1597,0,1775,44936,False,futurama,,1535907806.0
71,Bruh....,<praw.models.comment_forest.CommentForest object at 0x7faf802a9ac8>,lifeandtimes89,0,164,7671,False,funny,,1535917612.0
72,Childhood is wanting Cyclops' eye beams or Professor X's telepathy. Adulthood is wanting Wolverine's healing powers.,<praw.models.comment_forest.CommentForest object at 0x7faf8029d6a0>,SchwarzSabbath,0,703,14000,False,Showerthoughts,,1535913363.0
73,"Incredibles 2 becomes first animated film to pass $600M domestic. Also, it's the third Disney produced superhero film to pass $600M domestic this year.",<praw.models.comment_forest.CommentForest object at 0x7faf805457b8>,mi-16evil,0,1378,43261,False,movies,Paddington rulz ok,1535905607.0
74,[Postgame Thread] LSU Defeats Miami 33-17,<praw.models.comment_forest.CommentForest object at 0x7faf7fec0f60>,CFB_Referee,0,1226,1020,False,CFB,/r/CFB,1535945346.0
75,To put on this face mask,<praw.models.comment_forest.CommentForest object at 0x7faf7fd17278>,Toomad316,0,193,13064,False,therewasanattempt,,1535922153.0
76,Curious as to why she does this...,<praw.models.comment_forest.CommentForest object at 0x7faf7fbab208>,JimJamIsHere,0,76,2776,False,StoppedWorking,,1535914203.0
77,Husky telling hooman he's scared of the water,<praw.models.comment_forest.CommentForest object at 0x7faf800400f0>,mr_pou,0,1152,70752,False,aww,,1535911195.0
78,Samoan Prime Minister: Leaders Who Deny Climate Change Are ‘Utterly Stupid’: Tuilaepa Sailele suggested that such skeptics should be taken to a mental institution.,<praw.models.comment_forest.CommentForest object at 0x7faf847a0b38>,maxwellhill,0,2302,56938,False,worldnews,,1535906806.0
79,But I need it.....,<praw.models.comment_forest.CommentForest object at 0x7faf7f958b70>,yourdaddyissues72,0,945,20474,False,trashy,,1535914195.0
80,"Erosion differences between 15,25&50 years",<praw.models.comment_forest.CommentForest object at 0x7faf7f745e10>,lordbaby1,0,1868,92451,False,gifs,,1535908286.0
81,"LPT: If you move to a new place, or simply want to make friends, try volunteering. Volunteer at as many places as you have the time for, long term or one-time events: parks, beach clean up, library, museum, local animal shelter, fundraisers, etc.",<praw.models.comment_forest.CommentForest object at 0x7faf7f5ed6d8>,Infogal,0,326,15093,False,LifeProTips,,1535902855.0
82,"After many years, he finally broke down the Berlin Wall, c. 1960's -> 1990's",<praw.models.comment_forest.CommentForest object at 0x7faf7f5ea160>,MagicalPhoenix,0,197,33944,False,OldSchoolCool,,1535918864.0
83,Problem: Stage Stuck,<praw.models.comment_forest.CommentForest object at 0x7faf7f399f60>,ZuphCud,0,205,11305,False,LateStageCapitalism,Billionaires don't work a million times harder.,1535912368.0
84,Why everyone should go camping - this is what we woke up to today!,<praw.models.comment_forest.CommentForest object at 0x7faf7f324f60>,rich_gart,0,180,6168,False,pics,,1535930306.0
85,My childhood pet parrot Sweetie. She still gives zero fucks,<praw.models.comment_forest.CommentForest object at 0x7faf7f2510b8>,futurefiction2,0,92,13692,False,Eyebleach,,1535918415.0
86,Using a UV lamp to imprint photos.,<praw.models.comment_forest.CommentForest object at 0x7faf7f3196a0>,godsEguns,0,418,9329,False,DiWHY,,1535920861.0
87,Found on marketplace,<praw.models.comment_forest.CommentForest object at 0x7faf7f163518>,onesixthree,0,73,8692,False,oldpeoplefacebook,,1535906518.0
88,squish.,<praw.models.comment_forest.CommentForest object at 0x7faf7f14bbe0>,littlepup26,0,67,17298,False,pics,,1535925577.0
89,"In Captain America: The First Avenger, the “German” tank used in the propaganda movies is actually an m3 Stuart, an American light tank, as they were much easier and cheaper to find, especially at the start of the war",<praw.models.comment_forest.CommentForest object at 0x7faf7f0a8898>,ROTTENDOGJIZZ,0,301,24209,False,MovieDetails,,1535903035.0
90,Omg this is so cute. I want a hug like this,<praw.models.comment_forest.CommentForest object at 0x7faf7efcfc50>,Steph2145,0,54,5281,False,AnimalsBeingBros,,1535933866.0
91,I’m in an Arya Stark mood Upvote the shit outta this to get Arya on the front page,<praw.models.comment_forest.CommentForest object at 0x7faf7efc7e48>,XHelheimX,0,141,4664,False,freefolk,,1535930731.0
92,"If guys gained dick weight when they got fatter, the game would change drastically",<praw.models.comment_forest.CommentForest object at 0x7faf7f2b5208>,HaikuHighDude,0,157,3589,False,Showerthoughts,,1535925843.0
93,Homecoming,<praw.models.comment_forest.CommentForest object at 0x7faf7ee9ff60>,Zumba_Samba,0,91,6281,False,inthesoulstone,108050,1535915611.0
94,[image] PlayStation offices are getting pumped for the release Spider-Man,<praw.models.comment_forest.CommentForest object at 0x7faf7ee9b0f0>,clappuh,0,228,9899,False,PS4,,1535925430.0
95,My niece got her first bass,<praw.models.comment_forest.CommentForest object at 0x7faf7edf5fd0>,fishingthe804,0,80,4444,False,Fishing,,1535935498.0
96,You hid the body. Now comes the hard part.,<praw.models.comment_forest.CommentForest object at 0x7faf7edff5f8>,pencer,0,111,9020,False,wheredidthesodago,Soda Saucer,1535924437.0
97,"he kiss, he attacc, but most importantly, he got your bacc",<praw.models.comment_forest.CommentForest object at 0x7faf7ed38ba8>,jina100,0,19,5291,False,rarepuppers,,1535937628.0
98,This artificial waterfall,<praw.models.comment_forest.CommentForest object at 0x7faf7ee937b8>,merd2k,0,122,5891,False,Damnthatsinteresting,,1535937077.0
99,Labor Day weekend is for heroes like this daredevil,<praw.models.comment_forest.CommentForest object at 0x7faf7ec9e550>,GrouchyAnalysis,0,565,40889,False,gifs,,1535919932.0
